date,date_only,source,title,link,published,summary
2026-03-17 12:07:27+00:00,2026-03-17,Reddit_r/investing,Are AI portfolio assistants actually useful yet or still mostly marketing?,https://www.reddit.com/r/investing/comments/1rw3hii/are_ai_portfolio_assistants_actually_useful_yet/,2026-03-17T12:07:27,"Over the past year I’ve noticed more investment platforms launching AI assistants that analyze your portfolio and provide insights about diversification, risk exposure, and market events. On paper it sounds useful. If an AI can quickly identify things like sector concentration or overlapping holdings, that could save a lot of time compared to manually reviewing allocations. At the same time, I’m skeptical about how much value these tools actually provide once you understand the basics of portfo"
2026-03-17 14:03:26+00:00,2026-03-17,Reddit_r/investing,I want to invest 100k up to 1 million USD into these. I want both growth and dividend (monthly income) what do you guys think?,https://www.reddit.com/r/investing/comments/1rw5xer/i_want_to_invest_100k_up_to_1_million_usd_into/,2026-03-17T14:03:26,"These are the ones that stood out to me from my research As I don’t want only growth and only dividend but a mix of both so I get the best of both worlds. I do want a monthly income though. I have looked into Irish equivalents of these because of the 15% withholding tax as opposed to 30% GPIX, JEPG.L, XYLP.L, IDVO, JEPQ.L"
2026-03-17 00:33:27+00:00,2026-03-17,Reddit_r/investing,Regular Vanguard S&amp;P 500 vs Paris-Aligned S&amp;P 500 ETF?,https://www.reddit.com/r/investing/comments/1rvq7ed/regular_vanguard_sp_500_vs_parisaligned_sp_500_etf/,2026-03-17T00:33:27,"If you had to choose between a plain S&amp;P 500 ETF and a Paris-Aligned Climate S&amp;P 500 ETF for long-term investing, which would you pick and why? I’m trying to balance returns with being at least somewhat ethical, and I’m wondering if the climate-screened version is worth it or if the regular S&amp;P 500 is just the smarter move. I’m not asking which one is “morally perfect.” I’m more trying to understand: - Whether the Paris-Aligned version is meaningfully worse for returns over time"
2026-03-15 19:18:15+00:00,2026-03-15,Reddit_r/investing,Salesforce generates more free cash flow than ServiceNow and Workday combined. So why does it trade at one-third of their valuation?,https://www.reddit.com/r/investing/comments/1ruldl4/salesforce_generates_more_free_cash_flow_than/,2026-03-15T19:18:15,I have been trying to understand why this stock is down 28% while the business looks like this. $14.4 billion in free cash flow. $72 billion in contracted future revenue. An AI product that went from zero to $800 million ARR in 18 months. The CEO just raised $25 billion in debt specifically to buy back 26% of the company at current prices. And yet it trades at 13x free cash flow. ServiceNow is at 38x. Microsoft at 36x. Workday at 25x. Salesforce generates more free cash flow than ServiceNow an
2026-03-16 22:06:46+00:00,2026-03-16,Reddit_r/investing,"Moving USCRX to SCHD, but cannot decide",https://www.reddit.com/r/investing/comments/1rvma1d/moving_uscrx_to_schd_but_cannot_decide/,2026-03-16T22:06:46,"I want to move my IRA (USCRX) because of its high expense ratio, and becase I don't think it's performing that well. But more I look more I get confused and cannot decide. Currently, I am thinking SCHD. Will it be safer option or am I missing something?"
2026-03-15 13:32:05+00:00,2026-03-15,Reddit_r/investing,Does anyone else feel like stagflation risk is creeping back?,https://www.reddit.com/r/investing/comments/1rucv3f/does_anyone_else_feel_like_stagflation_risk_is/,2026-03-15T13:32:05,"It kind of feels like the market isn’t really afraid of just one thing right now, It’s more the combination of inflation staying high while growth starts slowing down. That’s usually the kind of environment that makes investors uneasy because it puts central banks in a tough spot. Curious if others are seeing the same thing, or if this is just macro noise."
2026-03-16 18:54:03+00:00,2026-03-16,Reddit_r/investing,Is the current geopolitical tension around oil creating value opportunities?,https://www.reddit.com/r/investing/comments/1rvgrvi/is_the_current_geopolitical_tension_around_oil/,2026-03-16T18:54:03,"I don’t usually post long threads here, but the recent developments around the Strait of Hormuz and oil supply risks made me start thinking about something from a value investing perspective. A lot of discussion in trading communities right now is focused on **short-term oil price spikes**, but I’m more curious about whether this situation could create **longer-term mispricing in certain sectors**. For context, roughly **14 million barrels of oil pass through the Strait of Hormuz every day**,"
2026-03-15 21:09:42+00:00,2026-03-15,Reddit_r/investing,Investing in SP500 when new additions come in,https://www.reddit.com/r/investing/comments/1ruoavg/investing_in_sp500_when_new_additions_come_in/,2026-03-15T21:09:42,"So I do invest in SP500 though I like talking about individual stocks. But I look at the news and I see that SpaceX, OpenAI, Anthropic and other companies are expected to join soon. My worry is they will have PE more in line with Tesla or Palantir, and be very overvalued. So what are you planning on doing? Continue investing in SP500 and let them sort it out, or change your portfolio to equal weight or midcaps or something else?"
2026-03-15 15:10:10+00:00,2026-03-15,Reddit_r/investing,"J.P. Morgan, 1 day before the war started: ""we do not anticipate protracted oil supply disruptions""",https://www.reddit.com/r/investing/comments/1ruf0n6/jp_morgan_1_day_before_the_war_started_we_do_not/,2026-03-15T15:10:10,"[https://www.jpmorgan.com/insights/global-research/commodities/oil-prices](https://www.jpmorgan.com/insights/global-research/commodities/oil-prices) Probably the worst prediction of 2026 so far Article posted on 27th of February (1 day before the war started): &gt;**Oil price forecast: A bearish outlook for Brent in 2026** \[...\] &gt;Despite a recent spike in oil prices, J.P. Morgan Global Research expects to see Brent crude averaging around $60/bbl in 2026. \[...\] &gt;More recently, ma"
2026-03-17 02:01:39+00:00,2026-03-17,Reddit_r/investing,Alternatives to receiving a K1?,https://www.reddit.com/r/investing/comments/1rvsbez/alternatives_to_receiving_a_k1/,2026-03-17T02:01:39,Considering buying a 1% stake in a local small business and would receive a K1 with my share of the LLC’s annual profit/loss. I don’t have anything I could write off the losses against and obviously would prefer not to have to report the income. Is there another way I could structure this investment so that I don’t receive a K1? Maybe the deal could be structured in a way that I only report gains on investor distributions or upon liquidation/exit?
2026-03-17 06:24:42+00:00,2026-03-17,Reddit_r/investing,Earning well at 26 but still not managing money properly - where do I start?,https://www.reddit.com/r/investing/comments/1rvxu0x/earning_well_at_26_but_still_not_managing_money/,2026-03-17T06:24:42,"I’m 26 and earning around ₹1.7L/month, but I haven’t really built any solid savings or investments yet. Most of my income goes into regular expenses and a bit of travel, so nothing much is left at the end. Now I feel like I should get more serious about my finances. Not sure if I should start SIPs directly or first build an emergency fund. How would you approach this if you were in my place?"
2026-03-17 01:02:33+00:00,2026-03-17,Reddit_r/investing,Bad advice coming from family,https://www.reddit.com/r/investing/comments/1rvqx3k/bad_advice_coming_from_family/,2026-03-17T01:02:33,"I work in public accounting on the audit side, but during my time of also studying for the CPA exams I have learned and researched tax laws and implications of such laws. I just found out from my mom, that her sister, who is about 64 is going to eventually sell their home while currently building one. well apparently the 1st payment is coming up on the build and it’s going to be close to $60k, and she told my mom that “she will just draw from her 401k because the stock market isn’t doing so hot"
2026-03-15 20:45:54+00:00,2026-03-15,Reddit_r/investing,The Year of IPOs. A Deep Dive.,https://www.reddit.com/r/investing/comments/1runodp/the_year_of_ipos_a_deep_dive/,2026-03-15T20:45:54,"Hey Guys :) With multiple record breaking IPOs happening this year, I thought I would take a few hours to publish a piece about IPOs. In the end, it took me dozens of hours to research, write and edit. I would greatly appreciate if you guys read and give thoughts, sorry about the lack of pictures and graphs, and a bunch of footnotes are missing as it is originally written for Substack. Think it has some valuable content about whether this years IPOs are a good potential investment! Thank y"
2026-03-15 02:48:27+00:00,2026-03-15,Reddit_r/investing,"Why the SpaceX IPO should be concerning to passive investors tracking the NASDAQ-100 index, and other indexes",https://www.reddit.com/r/investing/comments/1ru1gw4/why_the_spacex_ipo_should_be_concerning_to/,2026-03-15T02:48:27,"SpaceX (which has acquired xAI, which itself has acquired X) is looking to list on the NASDAQ. aiming for a valuation of around $1.75 trillion. However, SpaceX is insisting that NASDAQ changes its rules for inclusion in the NASDAQ-100 index, as a condition for listing. The NASDAQ-100 rule changes would, effectively, allow SpaceX to very quickly get included on the NASDAQ-100, which then forces any index fund tracking the NASDAQ-100 to buy SpaceX stocks based on SpaceX's market capitalisation."
2026-03-16 20:52:58+00:00,2026-03-16,Reddit_r/investing,Any other companies like MSTR?,https://www.reddit.com/r/investing/comments/1rvk7bf/any_other_companies_like_mstr/,2026-03-16T20:52:58,"I’m trying to find companies that own assets that are valued higher than their current market cap. For example, MSTR owns 761,068 BTC which is valued today at $56 billion but their market cap is only $49 billion. Any other examples of companies that own more stuff than what the whole company is worth?"
2026-03-16 19:32:48+00:00,2026-03-16,Reddit_r/investing,Been investing for 2 years and finally think I am ready to start opening positions in indivisible stocks,https://www.reddit.com/r/investing/comments/1rvhvrr/been_investing_for_2_years_and_finally_think_i_am/,2026-03-16T19:32:48,"I’m 27, for the last 2 years I’ve been 100% indexes, I’m starting to think I’m doing myself a bit of a disservice for not taking a bit more risk, I think with this market pull back maybe is a good time to get into individual stocks in my ROTH IRA. I’m mainly looking at the high quality companies that are going at a discount rn like googl, msft amzn etc. What’s your thoughts on rddt? I’ve followed the stock for a while seems to be undervalued Edit: pls excuse spelling error in title smh"
2026-03-16 22:38:23+00:00,2026-03-16,Reddit_r/investing,How Are People Getting Exposure to Greenland Minerals Right Now?,https://www.reddit.com/r/investing/comments/1rvn57t/how_are_people_getting_exposure_to_greenland/,2026-03-16T22:38:23,been reading a lot about the push into greenland recently and wondering if anyone has found a good way to actually invest in it. between the tariffs on russian palladium and all the talk about arctic resources i feel like there has to be some kind of play here but i cant figure out where most of the greenland mining stuff seems to be either private or listed on exchanges i dont really use. is there anything on nasdaq or nyse that gives exposure to greenland specifically? or am i stuck looking a
2026-03-16 18:45:50+00:00,2026-03-16,Reddit_r/investing,"33 years old, $50 every week into SWPPX. Mutual fund Bad idea?",https://www.reddit.com/r/investing/comments/1rvgjia/33_years_old_50_every_week_into_swppx_mutual_fund/,2026-03-16T18:45:50,"“Mutual funds are open-ended, which means the fund company creates or cancels shares based on investor demand. The challenge is capital gains distributions. In a high-turnover mutual fund, or one that realizes gains and losses throughout the year, investors can receive a capital gains tax bill even if they never sold their own shares.” I use Charles Schwab and started “auto investing” this week into schwabs s&amp;p 500 fund of SWPPX. And want to keep it going but read the info above. This is a"
2026-03-16 09:00:48+00:00,2026-03-16,Reddit_r/investing,"Daily General Discussion and Advice Thread - March 16, 2026",https://www.reddit.com/r/investing/comments/1rv3e3v/daily_general_discussion_and_advice_thread_march/,2026-03-16T09:00:48,Have a general question? Want to offer some commentary on markets? Maybe you would just like to throw out a neat fact that doesn't warrant a self post? Feel free to post here! Please consider consulting our FAQ first - [https://www.reddit.com/r/investing/wiki/faq](https://www.reddit.com/r/investing/wiki/faq) And our [side bar](https://www.reddit.com/r/investing/about/sidebar) also has useful resources. If you are new to investing - please refer to Wiki - [Getting Started](https://www.reddit.co
2026-03-16 21:35:35+00:00,2026-03-16,Reddit_r/investing,Do any of you use AI to analyze your investment portfolio?,https://www.reddit.com/r/investing/comments/1rvlej9/do_any_of_you_use_ai_to_analyze_your_investment/,2026-03-16T21:35:35,"I’ve been thinking about how people actually analyze their investment portfolios. Most people I know just check returns or maybe look at allocation, but I’m curious if anyone goes deeper than that. Do you use any tools to analyze things like risk, diversification, sector exposure, or historical decisions? Also wondering if anyone is using AI tools (ChatGPT, etc.) to get insights about their portfolio. Or do you mostly rely on spreadsheets / broker dashboards?"
2026-03-16 15:55:32+00:00,2026-03-16,Reddit_r/investing,Is robinhood’s ira match and gold card worth using robinhood for?,https://www.reddit.com/r/investing/comments/1rvbpcy/is_robinhoods_ira_match_and_gold_card_worth_using/,2026-03-16T15:55:32,Same as title. Can’t decide if it’s worth using robinhood over other brokers for the Ira match and gold credit card. I know that over time that small Ira match growing tax free will be a huge benefit but at the same time you have to stick with robinhood for that. Is it worth swapping over for?
2026-03-16 16:46:46+00:00,2026-03-16,Reddit_r/investing,Getting lots of pop-ups from defi masters about the US about to go broke,https://www.reddit.com/r/investing/comments/1rvd3ph/getting_lots_of_popups_from_defi_masters_about/,2026-03-16T16:46:46,"Hi all, i’m not an experienced investor but more like a little old lady trying not to get wiped out financially. I have to admit I’m very rattled by this notion that the US has crossed a threshold where its debt is at the same percentage of GDP - or higher - that Greece‘s debt was when they had a debt crisis and their citizens lost a big percentage of their savings. What are y’all doing to protect your assets in this worst case scenario?"
2026-03-16 17:38:16+00:00,2026-03-16,Reddit_r/investing,What do I do with profits?,https://www.reddit.com/r/investing/comments/1rvekuf/what_do_i_do_with_profits/,2026-03-16T17:38:16,"I’m a little stuck in what to do with profits in a Roth IRA for a stock pick that hit. I don’t normally buy individual stocks and am in FTEC in Roth IRA, VTI in traditional, and FXIAX &amp; the international fidelity fund in my 401k. I got extremely lucky with NBIS in my Roth but now I feel the profit has been enough that I’d like to “lock” that in. Should I just throw it all into FTEC if that’s my core holding and will be for the future? Thanks"
2026-03-16 18:16:43+00:00,2026-03-16,Reddit_r/investing,Is anyone here thinking of selling US assets? Cashing out?,https://www.reddit.com/r/investing/comments/1rvfoyw/is_anyone_here_thinking_of_selling_us_assets/,2026-03-16T18:16:43,"I've been investing my own portfolio since the 1990s, mostly just buying and holding a conservative mix of stocks and bonds. Right now, I fear Trump is destabilizing the world economy and markets worldwide will implode. The last time the world suffered oil shock was in 1973 (https://en.wikipedia.org/wiki/1973\_oil\_crisis). People were lined up at gas stations day after day for months. The market in the US cratered and we had serious knock-on inflation until the early 1980s as a result. Long ter"
2026-03-15 14:41:19+00:00,2026-03-15,Reddit_r/investing,Nvidia and Nokia collaboration,https://www.reddit.com/r/investing/comments/1ruec6p/nvidia_and_nokia_collaboration/,2026-03-15T14:41:19,Recently Nokia increased significantly. What is your take on the announcements of Nvidia for their collaboration? Does it worth to look at it? Is the 6G a major update that can restore the company's profile? I'm looking for opportunistic investments. What are the best opportunities during the war?
2026-03-16 12:43:00+00:00,2026-03-16,Reddit_r/investing,"Why is crypto market going up, what is going on?",https://www.reddit.com/r/investing/comments/1rv74q9/why_is_crypto_market_going_up_what_is_going_on/,2026-03-16T12:43:00,"Hi With so much going on in terms of ""geopolitical tensions"", stocks going down since some time, soon we may see bigger prices in shops because crude oil cost more and today I see upswing in crypto market. I know this market is very swingy but still logic says ""crypto will go down"". Btc went from 62k in february to 73 today. Is this some kind of anomaly ?"
2026-03-16 11:39:12+00:00,2026-03-16,Reddit_r/investing,"Ferrari, what do you think ?",https://www.reddit.com/r/investing/comments/1rv5yzr/ferrari_what_do_you_think/,2026-03-16T11:39:12,"I have Ferrari at a price of €370 and I’m starting to wonder if it will be able to go back in the medium term or not. I tried to mediate on the big descents, bringing me to an average loading price of €358, but at the moment I don’t feel like doing anything else, besides not having a large liquidity ready"
2026-03-16 09:18:23+00:00,2026-03-16,Reddit_r/investing,"$KSTR will rise about 6%, maybe more by same time next week",https://www.reddit.com/r/investing/comments/1rv3oau/kstr_will_rise_about_6_maybe_more_by_same_time/,2026-03-16T09:18:23,"STAR50 is the index of top-50 tech companies of China. We're talking SMIC. We're talking Cambricon. We're even talking QuantumCTek, just all the heavyweights. If you only check \`KraneShares SSE STAR Market 50 Index ETF\`, it doesn't paint a promising picture, but keep in mind that this is an ETF. Year-to-date, it's up \~14.2%, but the index clearly saw profit-taking in preperation for the Q2 rebalancing. That's precisely why it's time to strike. All those profit bookers will be back, now that"
2026-03-16 10:32:31+00:00,2026-03-16,Reddit_r/investing,"Bitcoin used to feel very volatile, it does not anymore",https://www.reddit.com/r/investing/comments/1rv4u9k/bitcoin_used_to_feel_very_volatile_it_does_not/,2026-03-16T10:32:31,"A few years ago Bitcoin felt like a very volatile asset compared to other asset classes. Lately less and less so. \- S&amp;P500: -19% in Apr 2025 \- Nasdaq100: -22% in Sep 2022 \- Gold: -18% in Feb 2026 \- Silver: -33% in Feb 2026 \- Dubai real estate index: -35% in Mar 2026 \- Crude oil: +65% in Mar 2026 \- Bitcoin currently: -42% below all time high It is increasingly difficult to find an asset class that does not suffer major volatility. Bitcoin is still the most volatile, but the mar"
2026-03-15 09:01:12+00:00,2026-03-15,Reddit_r/investing,"Daily General Discussion and Advice Thread - March 15, 2026",https://www.reddit.com/r/investing/comments/1ru8ayk/daily_general_discussion_and_advice_thread_march/,2026-03-15T09:01:12,Have a general question? Want to offer some commentary on markets? Maybe you would just like to throw out a neat fact that doesn't warrant a self post? Feel free to post here! Please consider consulting our FAQ first - [https://www.reddit.com/r/investing/wiki/faq](https://www.reddit.com/r/investing/wiki/faq) And our [side bar](https://www.reddit.com/r/investing/about/sidebar) also has useful resources. If you are new to investing - please refer to Wiki - [Getting Started](https://www.reddit.co
2026-03-14 16:10:45+00:00,2026-03-14,Reddit_r/investing,First Ukraine Reconstruction UCITS ETF listed,https://www.reddit.com/r/investing/comments/1rtluxo/first_ukraine_reconstruction_ucits_etf_listed/,2026-03-14T16:10:45,"White-label issuer HANetf has extended its thematic ETF roster with an attention-grabbing launch intending to capture the beneficiaries of the rebuild of Ukraine’s infrastructure, energy network and industrial base. The Ukraine Reconstruction UCITS ETF (UKRN) has begun trading on the London Stock Exchange (LSE) Deutsche Börse and Borse Italiana with a total expense ratio (TER) of 0.65%. UKRN tracks the VettaFi Ukraine Reconstruction index which provides exposure to 50 companies across three ma"
2026-03-15 03:37:11+00:00,2026-03-15,Reddit_r/investing,How much Finance-related content is on your feed?,https://www.reddit.com/r/investing/comments/1ru2i4d/how_much_financerelated_content_is_on_your_feed/,2026-03-15T03:37:11,"Lately I’ve realized that I’m probably consuming way too much social media, and most of it is finance-related. My feeds are full of content about stocks, options, futures, order flow, etc. across X, Instagram, and Reddit. The thing is, I rarely actually follow the advice from these posts. But I still find myself constantly reading, checking, and thinking about the market throughout the day. It’s starting to feel a bit unhealthy, and honestly, I’m not sure it’s adding much value to my life or e"
2026-03-14 23:07:38+00:00,2026-03-14,Reddit_r/investing,"Got lucky switching portfolio bank, now 100 percent liquid-Now what?",https://www.reddit.com/r/investing/comments/1rtwfxf/got_lucky_switching_portfolio_bank_now_100/,2026-03-14T23:07:38,"As the title says, I had to liquidate my portfolio around 4th of March (switching from a US bank to a european one, which means I had to sell to reinvest in European instruments) Now I am watching the repercussions of the Iran war and I am not 100 percent sure the worst has happened yet. Do I yolo and buy, or do I ride out my liquidity for a bit longer and watch what happens? Very undecided."
2026-03-15 18:13:10+00:00,2026-03-15,Reddit_r/investing,Should I lock in gains now to position for the future?,https://www.reddit.com/r/investing/comments/1rujnxt/should_i_lock_in_gains_now_to_position_for_the/,2026-03-15T18:13:10,"All across Reddit it seems everyone is so sure the market is gonna go down down down over the next couple weeks til who knows when. I have some money to the side to play with, but a lot is tied up in investments already. Should I move them into sgov or similar for the time being and see what happens with the market over the next month or so to position myself to buy back in cheaper? Whats the consensus?"
2026-03-15 07:11:58+00:00,2026-03-15,Reddit_r/investing,"Came across Leopold Aschenbrenner’s Situational Awareness stuff, thoughts on the power/compute thesis?",https://www.reddit.com/r/investing/comments/1ru6k4a/came_across_leopold_aschenbrenners_situational/,2026-03-15T07:11:58,"As the title says, I recently listened to the Limitless podcast episode with Leopold Aschenbrenner following the 13F release (the one where they dive into his fund’s growth from \~$1B to $5.5B+ in a year by betting on AI’s real bottlenecks), and lowkey i agree cause it feels different from the usual hyped-up AI/semicon names (which feel priced in), and its also a pure thesis play on power/compute demand which seems logical. I’m definitely not well informed when it comes to investing (i j dca in"
2026-03-15 00:38:56+00:00,2026-03-15,Reddit_r/investing,Finally opened a position in Reddit.,https://www.reddit.com/r/investing/comments/1rtymp1/finally_opened_a_position_in_reddit/,2026-03-15T00:38:56,Wrote an article analyzing the business a couple weeks ago and now finally felt comfortable enough to open a 1% position into the company. Hopefully every couple weeks moving forward will add another 1% until I get to 4% of my portfolio. Thoughts? Anyone else recently opened up a position? (Using a 28 EPS growth rate and 30 P/E I got a return of 15.7% CAGR over five years.)
2026-03-15 19:49:30+00:00,2026-03-15,Reddit_r/investing,Saved enough for private banking and scared to give green light to buy into market,https://www.reddit.com/r/investing/comments/1rum77m/saved_enough_for_private_banking_and_scared_to/,2026-03-15T19:49:30,"Hey all, need some advice .. We are high earners and savers.. have cash in money market right now as the bank wealth advisors need a min to start as a client. We don't have the time to manage on our own. First, we are scared as hell about getting into the current market. Just doesn't feel right like a crash or correction of some kind is around the corner. We work in tech and so many layoffs and restructuring happening at the moment. The whole AI bubble seems real however there's also a lot o"
2026-03-14 16:14:02+00:00,2026-03-14,Reddit_r/investing,Cash equivalents 2 years before and in retirement,https://www.reddit.com/r/investing/comments/1rtlxvn/cash_equivalents_2_years_before_and_in_retirement/,2026-03-14T16:14:02,"I'm a bit confused about the information on cash equivalents. (Outside of say 60% stocks/40% bonds) Some say keep 3-5% in cash equivalents while others say keep less because of opportunity lost. What do you all suggest/what do you do? I feel comfortable with 3 years cash, but not sure if that's the smartest course. (SS covers half my expenses)"
