date,date_only,source,title,link,published,summary
2025-11-03 08:00:00+00:00,2025-11-03,Google_News_Forex,Euro Forecast: EUR/USD on Cusp of Testing November High - FOREX.com,https://news.google.com/rss/articles/CBMisAFBVV95cUxNU3IxQ2gzVHE4UmhkbjhXM05RUWJxb0xkdm1nUHF2UjBTSExqNGRFTHZrX1BRQWV2eGpMTk8yaUV3MUgzU2czZGYyTEg2djRsS3FpX1RMZ3c3VXBRbWU0U0ZtWW4zR01najJoX2lxcGo3YkhlRlcwUkx4Wkp4aUJiSVYwbThaMVUxRmQ5Y1BGUXJDYTExNFZuUFdVcnBzWFdlR1o4RnZTTEIyM0w3QWJSMtIBvAFBVV95cUxQWXdSYnljV0tqd3l5cDkwbjlmQXFSSC1VSDBuNnVmYmlfWWVFanJOcU1la3ZDblhITHJxcmhra21NcGgxS1F2RWdzNkVKUlRWc0o3SW1pWnF6NHlNUWl5YUh3aGZ4ZkVnV0gtQWpscXZ1QmJKRnZxYWhwb2oyTGowT09yeXhhNXRPOXlKRDNxRjNHekNWTVJPRGE2VFhLdGxYNXk4RS14UVc5MDZwQXoteXdJMnRiVlRpaThSMA?oc=5,"Mon, 03 Nov 2025 08:00:00 GMT",Euro Forecast: EUR/USD on Cusp of Testing November HighFOREX.com
2025-10-13 07:00:00+00:00,2025-10-13,Google_News_Forex,"EUR/USD forecast: Currency Pair of The Week | October 13, 2025 - FOREX.com",https://news.google.com/rss/articles/CBMiqAFBVV95cUxQaFJOUHVlOEJJTDhFSWN3QkJ2N2haaXZ3NlB5NEdQOXNjUzZwbkMtVW1lbmdyek1xZmtYNW9lU2M2WWRrUVFwMXBkMUo3dFBJTnd1YUhIYkFXQ24zU2VUcHJVQ2QxOUp0SFBOREZyS3k3XzgyRnRrRjBnVFc5V2E1RmRtUHhfT2psZlF6VWc0MXlwa3JzR3g0WG5xY21Ta2IzUk9OVmhhN23SAbQBQVVfeXFMT2NvN2syOTRkdElJNUNNa0YzclhNV3ZHSks3UkRsTFRQbjFmZWhBSXp3SXJLSHc5U244eGxScFpYdVJyYUdBc3BXT2g1Tm9Ha3R3MWxDTWVYcXJrcDBjWGk4TzVWOHBhNkxJXzB0WTk2clBBWV9KRGsySTZraGNpOFpILTBFdTFhLXY5MUt3ME5NUDJpaW92Q0Y3NkJhOUd5bEZSbVFvVXZRRlc1SG5MQnlIN2tp?oc=5,"Mon, 13 Oct 2025 07:00:00 GMT","EUR/USD forecast: Currency Pair of The Week | October 13, 2025FOREX.com"
2026-02-28 08:00:00+00:00,2026-02-28,Google_News_Forex,EUR/USD weekly outlook: All about oil prices and Middle East - FOREX.com,https://news.google.com/rss/articles/CBMiqgFBVV95cUxPZ2F6M1F0OEhIa2JlQlViemtOMVNnUk5Rd3gtZ2thU0x6LUpQNlNwN3AtUWNMVENQZmlheXFnTW9QX0FHRWg5cDBkTzRxTWZpMXJoYnBnU3VmU3d3bEMwQlVIWW1JcEY1RC1RNURlZTdpZm1zb1ZGOXVtS2R2bG9MR3lfNkQ5dFhRYVAxcUlqeFI4OGpucVdST3dQNTlhOTBSUXg5QkVKcTRIUdIBtgFBVV95cUxPaEpSSUNNdWhlWkRwbG45VGNBWlAtV0dWLVVwOFNlS19GSlpSVkZiVERnUmxuamhxQjdmMW5YZi1zSDhwcnFxZVFDZjI1NUxxaERLRG45N1phRDVRLXFtb3BZRUVNcGFOeTVfZ19yeDNMZmpJTk02eVZTaEFKcGVaaTdzT3RHdktWSWtrQm1OeVZzR3FDd2Q2dC1DN1dSb3NJUGVlMkpyUy1qQmNGME9XNUliN0toQQ?oc=5,"Sat, 28 Feb 2026 08:00:00 GMT",EUR/USD weekly outlook: All about oil prices and Middle EastFOREX.com
2026-01-08 08:00:00+00:00,2026-01-08,Google_News_Forex,"Oil, EUR/USD forecast: Two trades to watch - FOREX.com",https://news.google.com/rss/articles/CBMikAFBVV95cUxNbGI2SVp4OGZ0WjA4LWdDOVp1VlJWYmVxRVl4MTVDcjllLWdRMWpBMjdvYmdJbG5vRklGd1UxTUN3R2Juemd5ckhXNEFlejlCWEFsYlcxQlhOVThjbFk2X0FHSVBSRnhsTzJNUFo1YzVEY1RVN3M5azJSbUs3V2otTnFlUVhEMWIybWJBdnFFbG7SAZwBQVVfeXFMTVRyM3B1QmtRUjJxMHBtVVlRdTJoY09ZRFlLX1VCZHZ6UFFVc2QyRUx0YzZMZG1TcmlUZXhRVGxhTTFscmF6NWxuZEFMU0dvenZ4d1NZVmhFY0JRXy1YaUx5VjFNOW1jOUg4MUlucTlhMFYzRERWbHhUbzlodXdiclBIRnFoQWUydVFvSmRwZDdZWW0tcjB0Q1ZUYTNh?oc=5,"Thu, 08 Jan 2026 08:00:00 GMT","Oil, EUR/USD forecast: Two trades to watchFOREX.com"
2026-03-15 07:42:58+00:00,2026-03-15,Google_News_Forex,Forex Pairs Focus 15th to 20th March 2026 - DailyForex,https://news.google.com/rss/articles/CBMiqAFBVV95cUxQZXZEcjdvajRIUHBKeFl5TkxmTHltTWxnblJ3Y2JvaHlHRGNwYU9pS29QYW8tMWJZSzhkckhucDBQenhoYS1BM0NLRGlkYmg5VFlCdTUzX1p3ellnMGtKVXZGZmpKUzlna0lyTm9oU094YXV4Mmx5amc2YWt6NHFRTHVuSklUelFfNlZTa2k3OUZ5WXRjZEQtd3JRdk0zeEJCdEhjN3B4SlI?oc=5,"Sun, 15 Mar 2026 07:42:58 GMT",Forex Pairs Focus 15th to 20th March 2026DailyForex
2026-01-19 08:00:00+00:00,2026-01-19,Google_News_Forex,"US Dollar Slips on Trump Tariffs: EUR/USD, USD/JPY Price Action Setups - FOREX.com",https://news.google.com/rss/articles/CBMitgFBVV95cUxPX2tJNGJ2V3hDSFpfbnQySTA2bnotYmxscWUtME1OUzd2VF9MVVM5NHJzck9MeEpCNXM5Z2RibGhyTXVMVjN3RFFHRHVSQmxiMDB4RWN6NEVLVmJ5a2ZjZmoxZkpsSTNRSnFXQ2p6VjVCTlZkOS1ZOWdDYnlmaEpCZ25BNzduTFk0akNsYmZBb04ydVdWbWc2RHF6UXZVQ0kwYVpXQWRCc2tJTlliRDhSZXh6WXZvd9IBwgFBVV95cUxQZGtuVnpNX2tFLXhveWR2VUxIVG15Q2U3MTFJX0k5c1BnOW11VG9FNUJFbkpXNHh1azFHNGprUWhyRUFXZnpLZ185NWRrbXh3bi1uUkZXY3hmXy04TXM5SnBKWWlJNXB6akF1SEEzN1R2VzNsUDdVYlQ1eEJFbzcyeVV1QmFfTG1Ic2VOUmxPc3VIMVdrYTZNUW9WWDBQZ1JwVVBCbFhxMkZnYVpGTHhxZ3FMRDY3Tno3SXlPVTRobFBoUQ?oc=5,"Mon, 19 Jan 2026 08:00:00 GMT","US Dollar Slips on Trump Tariffs: EUR/USD, USD/JPY Price Action SetupsFOREX.com"
2026-02-06 08:00:00+00:00,2026-02-06,Google_News_Forex,Euro Short-term Outlook: EUR/USD Reversal Halted at Pivotal Support- Decision Time - FOREX.com,https://news.google.com/rss/articles/CBMi9gFBVV95cUxOaUUzZklqRWN2MGRJdGVEeEVYZXNIdEUzdDhlVF9ZMnRHeGhERWJNYzdidVZ5TnFjVEc2UmFYTlp6clc3NnZxbUEyMGxiVXl3RVJMcmJTb0ppZWNhOWZsYlpKcHhVTU5GNDZST1pqLVJfMGpBMzB5dU00dmVJWGFhc0JfdTZNSUVjcUVGdHFGOTVTYzNYN0plUEdJQk9hTThscHotNVVxc29tSzFoMG5TbGVNaXVXaXRIMzlhNFMtdmZzNU1pcXdZblVsTTcxV0h5clhVa25aNFl3SmJ0UlFMUmJSejdGZTlEdzFQUlN4Q0NyUU4tcUHSAYICQVVfeXFMTzNSRThXb2lhTThWNUNQLTUxMjlFa2FJY3ZWazdSQWljLUpZNEIwRkZlV2JGQVRyb1dIdXBWN3ZaZW56bEN4Q1BIVFZuWG1qaC1QVENncnpUTGRfcUxKWG5jN3lpcURvOUhLTl95STFqWk9wY3Z2djZYMndrd1I3NHVaYnBjdG9VZUNHb0g5QXFtNjRTZG9MSno2S3lXVnAxeU1JRWJsdWY5LUNGbmE2NW9Cb0Z4anZxalcxMU95b1g0X3RyOC1QNUFyd2FtbWFEajdrWmt6UFdES0c5V3F0Zk1kX0Zxa1E4V3JqX05hb0ZlUkNxeDlnV1RyTUJQS0NZVGVn?oc=5,"Fri, 06 Feb 2026 08:00:00 GMT",Euro Short-term Outlook: EUR/USD Reversal Halted at Pivotal Support- Decision TimeFOREX.com
2026-03-09 07:00:00+00:00,2026-03-09,Google_News_Forex,EUR/USD Forex Signal 09/03: Bearish Outlook Ahead of US Infl - DailyForex,https://news.google.com/rss/articles/CBMimAFBVV95cUxPZ20zQTRSUG40bjNPd2Z1RW1ZUENBZDNYTEtHRWMwdWdRQVdsUVVNMXBkeHhWZ2NKUVRjbW9lZHlsRVhpclNDczlTWlZYTThtUHRRVGdHREdFRWNiVTNJZ0lqUEU2SF9JbjQ5RVJ3N3NsaVZuY3RKelV4Mlk3ZGdSUTBEdzB0WXRUN1RMMXQ3S3VTalpxamdYYQ?oc=5,"Mon, 09 Mar 2026 07:00:00 GMT",EUR/USD Forex Signal 09/03: Bearish Outlook Ahead of US InflDailyForex
2026-02-04 08:00:00+00:00,2026-02-04,Google_News_Forex,EUR/USD forecast: Dollar in spotlight ahead of data - FOREX.com,https://news.google.com/rss/articles/CBMingFBVV95cUxNWmZ1eThpU1lWTllXa2dtS1gwQnVTSUtxcEEyVnVxNVVzOERfOGtvT01oSk4wcWhHT0tZcG1SQ2F3ejVFZVFoYW9Ub3NfbzhXczJQcXExYmlRcUZqWmJuZmpSZ0FYQmYtc1ZkeVBmbXl3NGtNeTBIbXh6cG5LdHI1Rno0RU5JeFZwejdKQmhyMGNjbU9FZWg3S1RiNGc1Z9IBqgFBVV95cUxQcUVpVEJTU3BvbUVlSjJDTUFwaUtRNDVoV2FBejFyS2xUSWk2WUozcTZfNzhxVkdyWTJrd2hSNkFHTzVZQXpQZS0zcWgyWDk1VEtpTGZibEEydTEtMl8zLUtzdkNZUmNNdXFkZVVRRzBwdzZ6YjlhcVVrWmlpdUcxTWJhT2lQTkdvYkxCbGNNM3RFeVQyU0dQY1pCamFtaF9VS0Z5VzZZVDFYdw?oc=5,"Wed, 04 Feb 2026 08:00:00 GMT",EUR/USD forecast: Dollar in spotlight ahead of dataFOREX.com
2025-09-30 07:00:00+00:00,2025-09-30,Google_News_Forex,Forex Seasonality – October 2025: Can EUR/USD Build on Its September Gains? - FOREX.com,https://news.google.com/rss/articles/CBMiugFBVV95cUxQZW1IRFhHQnJ5emxRUlVSeG4ya1p3eVQ5VEkwVVZNWnl5T2hNVkJiQ2JPWldSOExoRFE5VnRQRlpJRTI2cUNXNVpMbkJJRF83YkphajNOQTJlQk4tNFFJdnkyRk1OU191MDRQVF95OWpKSHRDT1VvdXd0S3hObEtUWEtybDVEUmdaa3RiWlV1Q0ZXWm5ob25zLWJGRHRqa2hCam5panZIMDctU3NOWVFrQVFPa1plcWc0LUHSAcYBQVVfeXFMT2hoeVE1UnV1VEd6aUhKUTVaNmRrcV9PWElpRXdYal9Nb01CZF9vSm12ZEUwX0RqM2xtbnNhNU9TNGY5YkpNaDJYenBSZ3RxNU5NMmJyb1NaX19IcUY4Yzk2eXRMdkh4cnRYTUlIbFpNTERaMjhlOGtQOGVnaGNWSGZaTXZpdnNVY3VLbXJtaWhTVk9XTWg1RXZjS2pEYk00WjR1cW9kMnI0MW0yUnBhd1UtZ01GYzNwbG1fY19tOUVTOG5uQXVR?oc=5,"Tue, 30 Sep 2025 07:00:00 GMT",Forex Seasonality – October 2025: Can EUR/USD Build on Its September Gains?FOREX.com
2025-10-21 07:00:00+00:00,2025-10-21,Google_News_Forex,Euro Technical Forecast: EUR/USD Plunge Pauses Above Key Support - FOREX.com,https://news.google.com/rss/articles/CBMivgFBVV95cUxQSUROLUFYZ3BhcXdrUmxROFNpWlg2TS1xU25yZVZJM2NYaHpCUzlSUTRxdHJfdjB4NXkyOE4zVVl4YkxBSEMtWFJ0N0U0SmpYeTcwbVlLaVZiRUNmd3h0dWJ4Z0F6SHlWbUpLZGxtN1JMSm5MWF9zVGZwOWlMc0lRaHNjeFRzY1duTTgwM0swS2RmOEJsSFRKQVpVcGNfVnBZSGtHUzRJdlVLUFU1NDlSX3F1SU1kZzFxV0JGNkVn0gHKAUFVX3lxTE9sX0NwVDh4MGptOC1WNi11aDZRVjFRblZWbUZwTF9vaFY5ckpibU0wb3lSMERuYklEb2dRa0U4c0ZIemxNOF83VHpuVy03VkRXMnVURmRrTDJWaVVITFI2VUJUWWFMcjFBU1hzWjdjaDd5ZnVOMjh1R2NzTDNZbUpGd19xOTk4SFJocGlLdXhCUkRMdmhqYm8ybk1KYmh5OVpldFNUcThVWkE0YlYxMmFFMlVaVF8wd3NKd1RaRURybzl4ZGVkOFl4V2c?oc=5,"Tue, 21 Oct 2025 07:00:00 GMT",Euro Technical Forecast: EUR/USD Plunge Pauses Above Key SupportFOREX.com
2025-09-22 07:00:00+00:00,2025-09-22,Google_News_Forex,"EUR/USD forecast: Currency Pair of the Week, September 22, 2025 - FOREX.com",https://news.google.com/rss/articles/CBMiqwFBVV95cUxQN1c4OFQ1RndRMjlDeHdPQy1LT2ZFNWNoYXZlYXlNYVNOZjlyc1JqNTFqY09lUnFoZXpMMnR4MlVlMHJpcE5Eb00zUVV3ZXhvNG9mTGlRSjV4dmstLW15emRKRVU0QXFNMUQwLXNxVGdaYVk1MFVtNDVLOHMwQXdSaFpTdUpIMWJUUlktWUVVSmdXUjA4WncxZjdlMUNnTGlvNzFhUzdBS2J1dEnSAbcBQVVfeXFMT1FKY2k3WTJiaFVGaWdSbzhSMG1Jb2l5ODdpZ2VleEgzc0w2by1RYkVpY3RxWk42QjVreS1wcFprTnAwcG9Xbmp3ZU1rczg3THhTc2RJZXRMUHpGMXdlUWZ1dkRIWnIxSVNPNWpkUFdfeUNMNndieHZRRktwSGd4MFU3MVhEZkxMM2h2ejNzYUwwZWdSOUNiUUF0bmFPZkppd0NZai1DSG5tNTN5T0JfWXdjODA2eXdj?oc=5,"Mon, 22 Sep 2025 07:00:00 GMT","EUR/USD forecast: Currency Pair of the Week, September 22, 2025FOREX.com"
2025-11-12 08:00:00+00:00,2025-11-12,Google_News_Forex,EUR/USD: Bull Trap or Breakout at 1.1600? - FOREX.com,https://news.google.com/rss/articles/CBMijwFBVV95cUxOa1ZEWXNRd2VJN1JzUkR5cHQ2Q3loaTctU0xLVk1zQzF4eDNUN1ZjYmM5YnNNRVZKOWxnRHNQc3BtRHowai1KajMwdzNrRW5wakM3RExqeHA1cnhMM3dXenoxeUh4WmlCX2tOTUZhemdDZWl0MVVrVmtVcEJMY05SS1ZQbk1FUGlkbE9OQ3dQNNIBmwFBVV95cUxOaDRtRUhnV2NlYnhNSzlqNG9XajJzUEhJZ2RjUHY2QmJ6RWpockdXSDlydzI3M0xZdloxS0RHeDVmY2pMSlVyNk9lTVo3cGxMczJPVmdmQjdzdGNsNmZ6OG9aU2xmX0ZjMm90Sm5kWUJLZkF2OU1kZjdUdy01dnZEd0M1MEcwRko2aHJhX1pNb05xNDNMVjR3YWNJYw?oc=5,"Wed, 12 Nov 2025 08:00:00 GMT",EUR/USD: Bull Trap or Breakout at 1.1600?FOREX.com
2026-01-23 08:00:00+00:00,2026-01-23,Google_News_Forex,"USD Breaks Down as USD/JPY Snaps Back: EUR/USD, GBP/USD - FOREX.com",https://news.google.com/rss/articles/CBMingFBVV95cUxPVjVqZy1JVkQwZWtidUVLYkRRcVM5U2xnS0d2NzBKMVlZNVlFckJTTVo2N0FWbHQ5ZEZzeTV0MGJhTnZqTzcyVlQ4bmx2YzdDRnZCWnhqWnBJVVJVcE11MGttNTc0RXRRNm9GS2xzUk5MVkdZclV5VEhSdV9PcmlhWmhHY3RVdmNreEY1bGxKbW1HSGFHTmFGdlZDNWVZZ9IBqgFBVV95cUxPNHdvX2Y4SzFwOGI4THZ6UTVWeVQ0bll0dXAwdHhRTFZPendDYmNTMUtseHVnMVNiZnlNYVBFM2lnemtsblczRGQ0V0U0VDd3eDk2UE9IcVdCWXdheWF4bmdQRENidVh4Szk4OGszWWhMUFdKRjREUTdlWEdzZE5aNVBKOEUweU96UlBrWVo4TG5xVlRVU1VEZ19fQXBFWUFNRVlmeFJqMGQtQQ?oc=5,"Fri, 23 Jan 2026 08:00:00 GMT","USD Breaks Down as USD/JPY Snaps Back: EUR/USD, GBP/USDFOREX.com"
2025-11-13 08:00:00+00:00,2025-11-13,Google_News_Forex,Euro Technical Forecast: EUR/USD Bulls Emerge at Trend Support - FOREX.com,https://news.google.com/rss/articles/CBMiuwFBVV95cUxQLXlLM3RWazcxT1lPYXRqb3dJUXI5ejlFODhpV24xUC05YnZNd0QyYUVoMm1lQjJnOHREdDhYSTJHM3FiTEJQSnRZNVZQSTJjRTFZTE1QOWJGWHliMWVzcVdvN0FMWnpnUWpTcmVWU1FyUm5hdmJLYTFrbzZkVFFJOEhqYkJqX3dMRURNWDNuVzRTczMyczZVcDJidHZNZFlEMHNvSHJER0hyaVVxTTFzTkMzdzV1alJRSDBF0gHHAUFVX3lxTE5tb21nOWJKQzdTTDc3QUVlOWVwTDBHTUNxRUt5WldLWExZUkRxd1F5RExXWlJUTkJaQ2dMNXNMdGxYWEk5Qk1wcGxnam9kMWZQSDlpYTJndnl2akZfaEpWclc4aXNRcGk2NlctZ1F2UjdNbHJsejJqQ0gyX3VJMDJXZmxIQ3ZBb1U1dkpJMHotT0p5djhOZUZXaDVmRjVmT1hGNFljUEdscG1Ec1VGeGgyaXFTeFhBdHl0aldiRHhwbGdKOWVGX1U?oc=5,"Thu, 13 Nov 2025 08:00:00 GMT",Euro Technical Forecast: EUR/USD Bulls Emerge at Trend SupportFOREX.com
2025-12-30 08:00:00+00:00,2025-12-30,Google_News_Forex,"USD into 2026: Gold, EUR/USD, USD/JPY - FOREX.com",https://news.google.com/rss/articles/CBMihAFBVV95cUxPYy1IbWNHUWRPS1otWEZtMGxzVUpfNVk0b1dlOEJLR3VJZm5WbU9NR3E0Z1R3TW5vMlNYMG1QNkgwZzBSTXFtVl9zM05wb243RUlubENXVDgwWmc1MndKcUMzMWZ6ZUlLTlR3dEJEeDZyUlFNbGQzeWl0RUFMTHhBTS1NU3rSAZABQVVfeXFMT3gzTC1NSHJ1ZTNaRWtQaEZIRjFQR3V5U3BpT29VdDFyejZ6WEVsMlhxSlhmTjY1MENScWVvNHM4d0JwSGlZWTZyNENCZ3l6R0RkLVM4OW5WZE1hM0ZRM1NPdzc5NmFzSTU3VmZCOXdNbWdQTW92ZVZacmh1NU80YzdDVTZuZ2d6dGRTaWlZNEZP?oc=5,"Tue, 30 Dec 2025 08:00:00 GMT","USD into 2026: Gold, EUR/USD, USD/JPYFOREX.com"
2025-10-14 07:00:00+00:00,2025-10-14,Google_News_Forex,Euro Short-term Outlook: EUR/USD Holds Lows – Breakout Risk Builds - FOREX.com,https://news.google.com/rss/articles/CBMivgFBVV95cUxQaVFLa3lENkxVb0FfelRDUUJMamdPQWh2QU5mN2JNU21ENHY2TTgxNFFBOTZXUmpKdmMtSjJXaUxSbU5UZ0lWMUR6NkdfcUhLSlZWV0JFaEpIeFg4MHphZnprVW9peWFtZm5EUnp1aDNPRlJQVGVkM3lwTVBZcU00RFBuUmtlR2Y3dVAtUnFReV9iXzNSRHZLZ3BhTFY3U1BfTTM3Nm0wSklSaUZ0ZXJRZlU3dERwUXlZdURRU2130gHKAUFVX3lxTE0tWjlTQWRUek9rRks3TkFRU0xCUUpmYlJ3dTJMVUI4amk2Ti1RRG1kZWNWNWROVEg0c2VQZzUyRG1teUNQRjR5N2xyY29xRmpTX2JTeW93eng3cElmWTBzYlZPb1hOT2JDb3NxOTl2WVpiNk80bTRVQi1DamtJSlNZMmJ2RGswOWFtMkxmc044a1JNR3ZxQTZkaTRreHR5d3V6WUhEbFVuVmhXaEVQT2hiM1VmR3JrSl9oNFpwU0NEdjhyaW9iSnNtTUE?oc=5,"Tue, 14 Oct 2025 07:00:00 GMT",Euro Short-term Outlook: EUR/USD Holds Lows – Breakout Risk BuildsFOREX.com
2026-02-25 08:00:00+00:00,2026-02-25,Google_News_Forex,"EUR/USD, Oil Forecast: Two trades to watch - FOREX.com",https://news.google.com/rss/articles/CBMinwFBVV95cUxQeWFPa0JuZmFBYjlQWE9yUUtTNWlsbVhiZDlucUFaYTJDUjdkVXhaX1g0R3JxWFNRMHVFS0VuS0ZGeWxWSnAwYUs3SDg3d2lRTVZBNkhldmZadC0tbkMtUHI2OGxvb2lqcmM2M0Z1NmE3aU9uNUotR0VGcE9xeUlsemRfOE1GZnJFeC0yRkFNa2xpdURBNDRReDROZGJmQlXSAasBQVVfeXFMUFlDajRRb1FCTzljcUdJejI3aExLVUJ3ZEZMcW9HanM4N21YMlJDaUdDdFhmT0lSeHUyVnFDVnAweklhWDlINFlmSm9nZGJKbmhrU1pUZXRDWEJnMlRaa2tPMUUyOExBR2U2dm1zVFlHY1FRd1YwUVRvbmRxenJXTk9kbm1qMzJNWEEzU3NYX2lJcTJHN1p4Qm9Rd3l6enljYU5qVnBXdnc1OHU4?oc=5,"Wed, 25 Feb 2026 08:00:00 GMT","EUR/USD, Oil Forecast: Two trades to watchFOREX.com"
2025-12-08 08:00:00+00:00,2025-12-08,Google_News_Forex,Euro Technical Forecast: EUR/USD Range Breakout in Focus Ahead of Fed Decision - FOREX.com,https://news.google.com/rss/articles/CBMizwFBVV95cUxNWkxyQWw0YWZIaDBDR2lXTjZVSlBTWkIwYUN1YTE3NjVjUlE4MjlXazF6WFRRallJSF9oYnQ3RFhad0lCeTIwSnBSUGItZWVseTZVTEkwTXE5bnZ6dTZZVEJlc092ZmFyMVAwNTJfNnZDYTlSMFJJUDU5eGZlaFYtVXY1MFRXLWFhbk05cTdYYkNYM3drWDZOVEpZUFlCM2xRcVVFRS1UVTMwRVpkRFdWN1ZlQ242djg0WWp6MnhhajY0WktFZUFvZElOSUVOdknSAdsBQVVfeXFMUGxxR1I2eUkxYlpYTmJMZFFQSWUzMkY2NzdZd1pIdkZYM1hDVFJxeFZBNmtRS09yYU5iU1h2MS1MVWR5YWI5ZG1TTHZ4VDgwQk9UeXpHZzMwSzR2Ml9OU2pKY2M3dy1GREJteE1taDl2OFFaZWI3UXdkVDI0WFVNNGd0dlg2R3lkVUFvend5dk9pVEtxaWpETUp3NE9WTDFNdjhnTTllb05hckNWWm84a2dpQkwzNndKbkNqakVZaDZkZDdWd3ZCWjVKdVhnU0k4YjYxZ1pDakVKVGJB?oc=5,"Mon, 08 Dec 2025 08:00:00 GMT",Euro Technical Forecast: EUR/USD Range Breakout in Focus Ahead of Fed DecisionFOREX.com
2025-11-29 15:09:55+00:00,2025-11-29,Reddit_r/Forex,Are you new here? Want to know where to start? Don't understand why something happened? START HERE!,https://www.reddit.com/r/Forex/comments/1p9puuw/are_you_new_here_want_to_know_where_to_start_dont/,2025-11-29T15:09:55,"##Hello and welcome to The /r/Forex Trading Community! **Please do not post a new thread until you have read through our [WIKI/FAQ.](https://volatility.red/Forex)** It is highly likely that your questions are already answered there. All members are expected to follow our sidebar rules. Some rules have a zero tolerance policy, so be sure to read through them to avoid being perma-banned without the ability to appeal. (Mobile users, click the info tab at the stop of our subreddit to vie"
2026-03-17 16:04:17+00:00,2026-03-17,Reddit_r/Forex,I DID IT!,https://www.reddit.com/r/Forex/comments/1rw9253/i_did_it/,2026-03-17T16:04:17,"I remember saying at the beginning of the month that I would withdraw in 2 weeks, that completely flopped as I didn't take into account how long I would go without trading. So many days of me just sitting on my hands and not making a move because my trading criteria wasn't met for me to take a trade. I also didn't account for the losses I would take so saying that I would withdraw in EXACTLY 2 weeks was silly, but ladies and gentleman we're back. 2k payout coming soon. I've got 2 other accounts"
2026-03-18 03:48:46+00:00,2026-03-18,Reddit_r/Forex,Yesterday i calculated exactly how much money I lost not because of strategy. The number made me sick.,https://www.reddit.com/r/Forex/comments/1rwrz1v/yesterday_i_calculated_exactly_how_much_money_i/,2026-03-18T03:48:46,"I went through 8 months of my trade history last week. Filter for one specific reason — trades I take where my own notes and strategy said ""no clear setup"". 56 trades. All come out of boredom or impatience. Net result: -$2,340. My actual strategy give me in the same period? +$3,100. I was not a losing trader. I was a profitable trader who keep donating his profits to the market on days he had done nothing. The most expensive habit in the trading is not revenge trading. It's not overleverage. It'"
2026-03-17 19:03:47+00:00,2026-03-17,Reddit_r/Forex,An indicator that helped me along my journey. Do what you please with this information.,https://www.reddit.com/r/Forex/comments/1rwe7bu/an_indicator_that_helped_me_along_my_journey_do/,2026-03-17T19:03:47,
2026-03-17 23:59:12+00:00,2026-03-17,Reddit_r/Forex,X-Man pattern Strategy!,https://www.reddit.com/r/Forex/comments/1rwmgur/xman_pattern_strategy/,2026-03-17T23:59:12,Best strategy so far if you see X you go all in With life savings
2026-03-18 05:22:30+00:00,2026-03-18,Reddit_r/Forex,Accepting the Reality of Losses,https://www.reddit.com/r/Forex/comments/1rwtyo9/accepting_the_reality_of_losses/,2026-03-18T05:22:30,"Accepting the Reality of Losses The first step in becoming a pro trader is radical acceptance: losses are not a sign of weakness, but a natural part of trading. Even the best traders in the world face losing streaks; some lose 5–10 trades in a row before a winning setup aligns. Why this matters: Fear of losses leads to revenge trading, over-leveraging, and strategy hopping. The moment you accept that a loss is neutral, not personal, not permanent, you stop giving emotion power over execution."
2026-03-17 19:39:50+00:00,2026-03-17,Reddit_r/Forex,is it wrong to set a daily goal of pips/points to hit ?,https://www.reddit.com/r/Forex/comments/1rwf9az/is_it_wrong_to_set_a_daily_goal_of_pipspoints_to/,2026-03-17T19:39:50,"100 / 200 / 150 or whatever you like Most of the days I aim to achieve my pips goal and leave the chart , and it ACTUALLY WORKS to me And here I am talking about 100$ profit on 0.1 lot is it 100 pips , points or whatever you like to call it I aim for 500 points a week, and for example if I hit 150 on Monday, I can leave with 50-70 on Tuesday The goal is to hit 500 pips a week (500 dollars on 0.1) My RR is 1:1 to 1:3 or even more but never less than 1:1 I do XAUUSD intraday and scalpin"
2026-03-17 20:09:00+00:00,2026-03-17,Reddit_r/Forex,One common mistake traders make is entering too early.,https://www.reddit.com/r/Forex/comments/1rwg47j/one_common_mistake_traders_make_is_entering_too/,2026-03-17T20:09:00,"One common mistake traders make is **entering too early**. Just because you see a Fair Value Gap does not mean price will **react immediately**. The key is patience. Often the market will: • Sweep liquidity • Return into the FVG • Then continue in the direction of the Order Flow Leg Understanding timing is just as important as understanding the concept. In trading, **patience is a real edge.**"
2026-03-17 11:13:09+00:00,2026-03-17,Reddit_r/Forex,XAUUSD H4,https://www.reddit.com/r/Forex/comments/1rw2hr4/xauusd_h4/,2026-03-17T11:13:09,
2026-03-17 15:15:21+00:00,2026-03-17,Reddit_r/Forex,AUD/CAD SCALP,https://www.reddit.com/r/Forex/comments/1rw7qc7/audcad_scalp/,2026-03-17T15:15:21,Looking at this quick scalp on the 1H for AUD/CAD.. I have highlighted some pretty well respected areas of interest aka support and resistance. Hopefully this will be a quick one! 🚀
2026-03-18 01:34:19+00:00,2026-03-18,Reddit_r/Forex,Trading,https://www.reddit.com/r/Forex/comments/1rwowfg/trading/,2026-03-18T01:34:19,
2026-03-17 07:54:16+00:00,2026-03-17,Reddit_r/Forex,Gold sell trade 🤔,https://www.reddit.com/r/Forex/comments/1rvzcfs/gold_sell_trade/,2026-03-17T07:54:16,
2026-03-17 11:41:55+00:00,2026-03-17,Reddit_r/Forex,Trading,https://www.reddit.com/r/Forex/comments/1rw307m/trading/,2026-03-17T11:41:55,"I’ve been trading for years and can confirm or boldly say, top down analysis will be the biggest game changer for anyone who trades whatever, Always use the higher time frame (1H and above) to pick a key point of interest. Check for resistance and highlight that point and use your strategy on lower time frames. Free game. Even a noob will see difference."
2026-03-17 21:00:48+00:00,2026-03-17,Reddit_r/Forex,Looking for an alternative Investment strategy,https://www.reddit.com/r/Forex/comments/1rwhltn/looking_for_an_alternative_investment_strategy/,2026-03-17T21:00:48,Any good Forex traders that are here in the United States?
2026-03-17 17:11:03+00:00,2026-03-17,Reddit_r/Forex,USD/JPY holding key resistance at 159 ahead of Fed &amp; BoJ... my levels + chart,https://www.reddit.com/r/Forex/comments/1rwaxp4/usdjpy_holding_key_resistance_at_159_ahead_of_fed/,2026-03-17T17:11:03,"USD/JPY is trading near 159.80 right now, sitting just under the key resistance level ahead of the Fed and BoJ meetings this week. Oil prices rose after more news on supply issues in the Middle East, pushing crude close to 100 dollars. The RBA raised its rate from 3.85% to 4.10% earlier today. Most other central banks including the Fed are expected to keep rates on hold. I put together this hourly chart with the 100-hour moving average shown in orange. Support sits at 158.80. On the weekly time"
2026-03-18 00:04:39+00:00,2026-03-18,Reddit_r/Forex,Forex FA/Macro Backtesting Platform - Looking for feedback,https://www.reddit.com/r/Forex/comments/1rwmmhf/forex_famacro_backtesting_platform_looking_for/,2026-03-18T00:04:39,Hello! I wanted to share the project that I've been working on because I'm looking for fundamental traders which focus on global macro strategies to test it. The problem I was having (and am still having) is that I wanted to learn fundamental analysis properly but couldn't find a good way to practice it. Most backtesting platforms are geared towards T
2026-03-17 23:46:34+00:00,2026-03-17,Reddit_r/Forex,🚀 Tuesday Session Recap: Strong 3.9% Day Pushing Weekly and Monthly Gains,https://www.reddit.com/r/Forex/comments/1rwm4su/tuesday_session_recap_strong_39_day_pushing/,2026-03-17T23:46:34,"🚀 Tuesday Session Recap: Strong 3.9% Day Pushing Weekly and Monthly Gains Closed out Tuesday with a solid 3.9% gain on the 16 Setup System, fueled by exceptional performance on US500. The 1-minute setup absolutely delivered with an 8% return — one of those sessions where everything clicks and the system fires on all cylinders. US30 and US100 both contributed steady gains across their faster timeframes, with the 45-second setups leading the charge at 4.5% and 5% respectively. US2000 was the on"
2026-03-17 23:15:57+00:00,2026-03-17,Reddit_r/Forex,Gold is dropping today. Any idea why?,https://www.reddit.com/r/Forex/comments/1rwlbvi/gold_is_dropping_today_any_idea_why/,2026-03-17T23:15:57,"I noticed gold falling pretty aggressively last week. I’m trying to understand what’s driving the move. Is it mainly the stronger USD, bond yields going up, or was there some economic news that triggered it? Also curious how you guys are approaching it: - Are you buying the dip? - Waiting for a stronger support level? - Or staying out for now? Would like to hear different perspectives."
2026-03-17 19:29:41+00:00,2026-03-17,Reddit_r/Forex,LONG XAUUSD,https://www.reddit.com/r/Forex/comments/1rweych/long_xauusd/,2026-03-17T19:29:41,
2026-03-17 22:59:37+00:00,2026-03-17,Reddit_r/Forex,Any one discovered tips for filling more accurately on 1 minute time frame?,https://www.reddit.com/r/Forex/comments/1rwkvsr/any_one_discovered_tips_for_filling_more/,2026-03-17T22:59:37,"Hi guys. I’ve got a good strategy that has me funded and having success. But it involves limit orders bouncing off key levels and wicking back and another of my strategy’s is a break out of counter trend on the low time frame resuming the higher time frame trend then setting break even soon as the big candle has formed to avoid false break outs. My question is , is it inevitable to have lack of fill when price zips up to my order or a price that is past my order. The strategy is still profitab"
2026-03-17 08:37:25+00:00,2026-03-17,Reddit_r/Forex,Set up + Timing + Execution. 1 Hour Trades.,https://www.reddit.com/r/Forex/comments/1rw01bw/set_up_timing_execution_1_hour_trades/,2026-03-17T08:37:25,"When I first began Day trading on the Forex Market, I used to hold onto trades for HOURS! Hoping the market would go my way. That left opportunities for loss, doubt and fear to creep in. Overtime I learned that with the proper learning and education I was able to turn things around. I completely rewired my mindset. Proper Set Up + Timing + Execution = Profitability If you’re new to trading or find yourself not profitable… take the time to learn properly, find your strategy, be patient and"
2026-03-17 09:08:04+00:00,2026-03-17,Reddit_r/Forex,What are your thoughts on tomorrow's FOMC Statement and rates?,https://www.reddit.com/r/Forex/comments/1rw0inb/what_are_your_thoughts_on_tomorrows_fomc/,2026-03-17T09:08:04,
2026-03-17 14:32:13+00:00,2026-03-17,Reddit_r/Forex,Day 6 of the no BE challenge. Finally broke the losing streak,https://www.reddit.com/r/Forex/comments/1rw6mmp/day_6_of_the_no_be_challenge_finally_broke_the/,2026-03-17T14:32:13,"Day 6 update of the no BE challenge. For some context for those who didn’t see my previous posts: I’m currently in Phase 2 of a funded challenge, and I’m testing something on myself. Trying to remove emotional breakevens and letting trades run to full SL or full TP. Yesterday Monday started pretty strong. Caught a really nice sell on gold and it went into a full waterfall. I grabbed my 1:2 TP, which I’m happy with because it also broke my losing streak of 4 trades from last Thursday and Frida"
