date,date_only,source,title,link,published,summary,score,num_comments,upvote_ratio
2025-11-29 15:09:55+00:00,2025-11-29,Reddit_r/Forex,Are you new here? Want to know where to start? Don't understand why something happened? START HERE!,https://www.reddit.com/r/Forex/comments/1p9puuw/are_you_new_here_want_to_know_where_to_start_dont/,2025-11-29T15:09:55,"##Hello and welcome to The /r/Forex Trading Community! **Please do not post a new thread until you have read through our [WIKI/FAQ.](https://volatility.red/Forex)** It is highly likely that your questions are already answered there. All members are expected to follow our sidebar rules. Some rules have a zero tolerance policy, so be sure to read through them to avoid being perma-banned without the ability to appeal. (Mobile users, click the info tab at the stop of our subreddit to vie",20,0,0.91
2026-03-17 16:04:17+00:00,2026-03-17,Reddit_r/Forex,I DID IT!,https://www.reddit.com/r/Forex/comments/1rw9253/i_did_it/,2026-03-17T16:04:17,"I remember saying at the beginning of the month that I would withdraw in 2 weeks, that completely flopped as I didn't take into account how long I would go without trading. So many days of me just sitting on my hands and not making a move because my trading criteria wasn't met for me to take a trade. I also didn't account for the losses I would take so saying that I would withdraw in EXACTLY 2 weeks was silly, but ladies and gentleman we're back. 2k payout coming soon. I've got 2 other accounts",269,116,0.99
2026-03-18 03:48:46+00:00,2026-03-18,Reddit_r/Forex,Yesterday i calculated exactly how much money I lost not because of strategy. The number made me sick.,https://www.reddit.com/r/Forex/comments/1rwrz1v/yesterday_i_calculated_exactly_how_much_money_i/,2026-03-18T03:48:46,"I went through 8 months of my trade history last week. Filter for one specific reason — trades I take where my own notes and strategy said ""no clear setup"". 56 trades. All come out of boredom or impatience. Net result: -$2,340. My actual strategy give me in the same period? +$3,100. I was not a losing trader. I was a profitable trader who keep donating his profits to the market on days he had done nothing. The most expensive habit in the trading is not revenge trading. It's not overleverage. It'",9,2,1.0
2026-03-17 19:03:47+00:00,2026-03-17,Reddit_r/Forex,An indicator that helped me along my journey. Do what you please with this information.,https://www.reddit.com/r/Forex/comments/1rwe7bu/an_indicator_that_helped_me_along_my_journey_do/,2026-03-17T19:03:47,,21,30,0.8
2026-03-17 23:59:12+00:00,2026-03-17,Reddit_r/Forex,X-Man pattern Strategy!,https://www.reddit.com/r/Forex/comments/1rwmgur/xman_pattern_strategy/,2026-03-17T23:59:12,Best strategy so far if you see X you go all in With life savings,7,3,0.82
2026-03-18 05:22:30+00:00,2026-03-18,Reddit_r/Forex,Accepting the Reality of Losses,https://www.reddit.com/r/Forex/comments/1rwtyo9/accepting_the_reality_of_losses/,2026-03-18T05:22:30,"Accepting the Reality of Losses The first step in becoming a pro trader is radical acceptance: losses are not a sign of weakness, but a natural part of trading. Even the best traders in the world face losing streaks; some lose 5–10 trades in a row before a winning setup aligns. Why this matters: Fear of losses leads to revenge trading, over-leveraging, and strategy hopping. The moment you accept that a loss is neutral, not personal, not permanent, you stop giving emotion power over execution.",2,1,1.0
2026-03-17 19:39:50+00:00,2026-03-17,Reddit_r/Forex,is it wrong to set a daily goal of pips/points to hit ?,https://www.reddit.com/r/Forex/comments/1rwf9az/is_it_wrong_to_set_a_daily_goal_of_pipspoints_to/,2026-03-17T19:39:50,"100 / 200 / 150 or whatever you like Most of the days I aim to achieve my pips goal and leave the chart , and it ACTUALLY WORKS to me And here I am talking about 100$ profit on 0.1 lot is it 100 pips , points or whatever you like to call it I aim for 500 points a week, and for example if I hit 150 on Monday, I can leave with 50-70 on Tuesday The goal is to hit 500 pips a week (500 dollars on 0.1) My RR is 1:1 to 1:3 or even more but never less than 1:1 I do XAUUSD intraday and scalpin",5,21,1.0
2026-03-17 20:09:00+00:00,2026-03-17,Reddit_r/Forex,One common mistake traders make is entering too early.,https://www.reddit.com/r/Forex/comments/1rwg47j/one_common_mistake_traders_make_is_entering_too/,2026-03-17T20:09:00,"One common mistake traders make is **entering too early**. Just because you see a Fair Value Gap does not mean price will **react immediately**. The key is patience. Often the market will: • Sweep liquidity • Return into the FVG • Then continue in the direction of the Order Flow Leg Understanding timing is just as important as understanding the concept. In trading, **patience is a real edge.**",3,2,0.81
2026-03-17 11:13:09+00:00,2026-03-17,Reddit_r/Forex,XAUUSD H4,https://www.reddit.com/r/Forex/comments/1rw2hr4/xauusd_h4/,2026-03-17T11:13:09,,19,7,1.0
2026-03-17 15:15:21+00:00,2026-03-17,Reddit_r/Forex,AUD/CAD SCALP,https://www.reddit.com/r/Forex/comments/1rw7qc7/audcad_scalp/,2026-03-17T15:15:21,Looking at this quick scalp on the 1H for AUD/CAD.. I have highlighted some pretty well respected areas of interest aka support and resistance. Hopefully this will be a quick one! 🚀,7,4,0.9
2026-03-18 01:34:19+00:00,2026-03-18,Reddit_r/Forex,Trading,https://www.reddit.com/r/Forex/comments/1rwowfg/trading/,2026-03-18T01:34:19,,0,0,0.5
2026-03-17 07:54:16+00:00,2026-03-17,Reddit_r/Forex,Gold sell trade 🤔,https://www.reddit.com/r/Forex/comments/1rvzcfs/gold_sell_trade/,2026-03-17T07:54:16,,26,15,0.96
2026-03-17 11:41:55+00:00,2026-03-17,Reddit_r/Forex,Trading,https://www.reddit.com/r/Forex/comments/1rw307m/trading/,2026-03-17T11:41:55,"I’ve been trading for years and can confirm or boldly say, top down analysis will be the biggest game changer for anyone who trades whatever, Always use the higher time frame (1H and above) to pick a key point of interest. Check for resistance and highlight that point and use your strategy on lower time frames. Free game. Even a noob will see difference.",12,10,1.0
2026-03-17 21:00:48+00:00,2026-03-17,Reddit_r/Forex,Looking for an alternative Investment strategy,https://www.reddit.com/r/Forex/comments/1rwhltn/looking_for_an_alternative_investment_strategy/,2026-03-17T21:00:48,Any good Forex traders that are here in the United States?,2,2,1.0
2026-03-17 17:11:03+00:00,2026-03-17,Reddit_r/Forex,USD/JPY holding key resistance at 159 ahead of Fed &amp; BoJ... my levels + chart,https://www.reddit.com/r/Forex/comments/1rwaxp4/usdjpy_holding_key_resistance_at_159_ahead_of_fed/,2026-03-17T17:11:03,"USD/JPY is trading near 159.80 right now, sitting just under the key resistance level ahead of the Fed and BoJ meetings this week. Oil prices rose after more news on supply issues in the Middle East, pushing crude close to 100 dollars. The RBA raised its rate from 3.85% to 4.10% earlier today. Most other central banks including the Fed are expected to keep rates on hold. I put together this hourly chart with the 100-hour moving average shown in orange. Support sits at 158.80. On the weekly time",5,0,1.0
2026-03-18 00:04:39+00:00,2026-03-18,Reddit_r/Forex,Forex FA/Macro Backtesting Platform - Looking for feedback,https://www.reddit.com/r/Forex/comments/1rwmmhf/forex_famacro_backtesting_platform_looking_for/,2026-03-18T00:04:39,Hello! I wanted to share the project that I've been working on because I'm looking for fundamental traders which focus on global macro strategies to test it. The problem I was having (and am still having) is that I wanted to learn fundamental analysis properly but couldn't find a good way to practice it. Most backtesting platforms are geared towards T,0,0,0.5
2026-03-17 23:46:34+00:00,2026-03-17,Reddit_r/Forex,🚀 Tuesday Session Recap: Strong 3.9% Day Pushing Weekly and Monthly Gains,https://www.reddit.com/r/Forex/comments/1rwm4su/tuesday_session_recap_strong_39_day_pushing/,2026-03-17T23:46:34,"🚀 Tuesday Session Recap: Strong 3.9% Day Pushing Weekly and Monthly Gains Closed out Tuesday with a solid 3.9% gain on the 16 Setup System, fueled by exceptional performance on US500. The 1-minute setup absolutely delivered with an 8% return — one of those sessions where everything clicks and the system fires on all cylinders. US30 and US100 both contributed steady gains across their faster timeframes, with the 45-second setups leading the charge at 4.5% and 5% respectively. US2000 was the on",1,0,1.0
2026-03-17 23:15:57+00:00,2026-03-17,Reddit_r/Forex,Gold is dropping today. Any idea why?,https://www.reddit.com/r/Forex/comments/1rwlbvi/gold_is_dropping_today_any_idea_why/,2026-03-17T23:15:57,"I noticed gold falling pretty aggressively last week. I’m trying to understand what’s driving the move. Is it mainly the stronger USD, bond yields going up, or was there some economic news that triggered it? Also curious how you guys are approaching it: - Are you buying the dip? - Waiting for a stronger support level? - Or staying out for now? Would like to hear different perspectives.",1,15,0.67
2026-03-17 19:29:41+00:00,2026-03-17,Reddit_r/Forex,LONG XAUUSD,https://www.reddit.com/r/Forex/comments/1rweych/long_xauusd/,2026-03-17T19:29:41,,2,2,1.0
2026-03-17 22:59:37+00:00,2026-03-17,Reddit_r/Forex,Any one discovered tips for filling more accurately on 1 minute time frame?,https://www.reddit.com/r/Forex/comments/1rwkvsr/any_one_discovered_tips_for_filling_more/,2026-03-17T22:59:37,"Hi guys. I’ve got a good strategy that has me funded and having success. But it involves limit orders bouncing off key levels and wicking back and another of my strategy’s is a break out of counter trend on the low time frame resuming the higher time frame trend then setting break even soon as the big candle has formed to avoid false break outs. My question is , is it inevitable to have lack of fill when price zips up to my order or a price that is past my order. The strategy is still profitab",1,1,1.0
2026-03-17 08:37:25+00:00,2026-03-17,Reddit_r/Forex,Set up + Timing + Execution. 1 Hour Trades.,https://www.reddit.com/r/Forex/comments/1rw01bw/set_up_timing_execution_1_hour_trades/,2026-03-17T08:37:25,"When I first began Day trading on the Forex Market, I used to hold onto trades for HOURS! Hoping the market would go my way. That left opportunities for loss, doubt and fear to creep in. Overtime I learned that with the proper learning and education I was able to turn things around. I completely rewired my mindset. Proper Set Up + Timing + Execution = Profitability If you’re new to trading or find yourself not profitable… take the time to learn properly, find your strategy, be patient and",13,4,0.84
2026-03-17 09:08:04+00:00,2026-03-17,Reddit_r/Forex,What are your thoughts on tomorrow's FOMC Statement and rates?,https://www.reddit.com/r/Forex/comments/1rw0inb/what_are_your_thoughts_on_tomorrows_fomc/,2026-03-17T09:08:04,,9,6,1.0
2026-03-17 14:32:13+00:00,2026-03-17,Reddit_r/Forex,Day 6 of the no BE challenge. Finally broke the losing streak,https://www.reddit.com/r/Forex/comments/1rw6mmp/day_6_of_the_no_be_challenge_finally_broke_the/,2026-03-17T14:32:13,"Day 6 update of the no BE challenge. For some context for those who didn’t see my previous posts: I’m currently in Phase 2 of a funded challenge, and I’m testing something on myself. Trying to remove emotional breakevens and letting trades run to full SL or full TP. Yesterday Monday started pretty strong. Caught a really nice sell on gold and it went into a full waterfall. I grabbed my 1:2 TP, which I’m happy with because it also broke my losing streak of 4 trades from last Thursday and Frida",3,3,1.0
2026-03-17 11:26:20+00:00,2026-03-17,Reddit_r/Forex,Xau/Usd trades with Xau Ai Algo,https://www.reddit.com/r/Forex/comments/1rw2q8b/xauusd_trades_with_xau_ai_algo/,2026-03-17T11:26:20,"XAU AI is an AI based trading tool designed specifically for the gold market (XAUUSD). It analyzes market data, price action and volatility in real time to generate clear buy and sell signals. The main idea is to remove guesswork and emotional decision making from trading. Instead of constantly staring at charts or overthinking entries, traders can follow structured signals with defined risk and direction.",6,1,1.0
2026-03-17 11:25:26+00:00,2026-03-17,Reddit_r/Forex,XAUUSD (M15) Buy Setup Entry: 5011 Tg: 5065 Sl: 4994 Trendline Breakout Confirmed After Liquidity Sweep. Price Is Now Looking For A Bullish Expansion.,https://www.reddit.com/r/Forex/comments/1rw2pnq/xauusd_m15_buy_setup_entry_5011_tg_5065_sl_4994/,2026-03-17T11:25:26,,4,2,0.84
2026-03-17 16:47:32+00:00,2026-03-17,Reddit_r/Forex,My GOLD trades vs my BTC trades. I'm boutta crash out 💀,https://www.reddit.com/r/Forex/comments/1rwa9kd/my_gold_trades_vs_my_btc_trades_im_boutta_crash/,2026-03-17T16:47:32,What am I doing wrong on XAUSUD??,1,3,1.0
2026-03-17 09:29:40+00:00,2026-03-17,Reddit_r/Forex,Algo Back test Performance. Let me know what you think.,https://www.reddit.com/r/Forex/comments/1rw0ud9/algo_back_test_performance_let_me_know_what_you/,2026-03-17T09:29:40,I am running 2 strategies: Strategy A → Liquidity sweep reversal Strategy B → Trend continuation FVG The back test has been tailored for a FTMO 100k account for last 20 year 5min XAUUSD data. What do you think? https://preview.redd.it/p26hbkmigkpg1.png?width=1895&amp;format=png&amp;auto=webp&amp;s=c2c1ee97df749cc6d71ccfddd8a0773972486804,2,10,1.0
2026-03-17 12:31:39+00:00,2026-03-17,Reddit_r/Forex,want to connect with forex trading mentor,https://www.reddit.com/r/Forex/comments/1rw3ybl/want_to_connect_with_forex_trading_mentor/,2026-03-17T12:31:39,Hi! im a beginner trader from Vancouver. Looking for a mentor to learn trading. I know all the basic concepts of SMC. Want to refine my knowledge and learn how to put it all together and make a system.,0,12,0.5
2026-03-17 11:43:43+00:00,2026-03-17,Reddit_r/Forex,"“ forex is a scam “ “ you could never trade indices “ Ok sure lol SPX500 trade idea update Sniper entry and 1:2.5RR+ hit I can literally trade any market as long as it has market structure , poor ICT guys they really can’t find anything to hate on now",https://www.reddit.com/r/Forex/comments/1rw31br/forex_is_a_scam_you_could_never_trade_indices_ok/,2026-03-17T11:43:43,,0,18,0.48
2026-03-17 03:46:38+00:00,2026-03-17,Reddit_r/Forex,The5ers Phase 1 target reached but recognized profit not updating,https://www.reddit.com/r/Forex/comments/1rvupqr/the5ers_phase_1_target_reached_but_recognized/,2026-03-17T03:46:38,"I’m currently doing the 2-setps on The5ers and I think I reached the Phase 1 target, but the dashboard numbers look a bit confusing. My MT5 balance and equity are already above the required target, and I’ve also completed 3/3 profitable days. However, the dashboard still shows recognized profit lower than the required amount, even though the account balance clearly passed the target level. All trades are closed and there are no open positions. Has anyone experienced this before? Does the r",5,15,1.0
2026-03-17 17:26:34+00:00,2026-03-17,Reddit_r/Forex,If everything aligns then we could see gold crush in the coming months…….. below 2500.00 level,https://www.reddit.com/r/Forex/comments/1rwbdjm/if_everything_aligns_then_we_could_see_gold_crush/,2026-03-17T17:26:34,,0,31,0.37
2026-03-16 21:34:51+00:00,2026-03-16,Reddit_r/Forex,Tricky day today,https://www.reddit.com/r/Forex/comments/1rvldts/tricky_day_today/,2026-03-16T21:34:51,"I know some people would have struggled with the price action today. Even though I started off with a loss, I was still confident that price would eventually push to my level. I was originally targeting the daily imbalance, but given the choppy price action and unexpected volatility for a Monday with no major news, I decided to take profits a bit earlier. Price did eventually push into the daily imbalance during the PM session. Let’s see what happens tomorrow, but I will be watching closely to",7,3,0.9
2026-03-17 06:52:02+00:00,2026-03-17,Reddit_r/Forex,"I got tired of ""hoping"" I’d stay disciplined, so I’m building an engine to force it. Looking for the first 20 founding testers.",https://www.reddit.com/r/Forex/comments/1rvyb9r/i_got_tired_of_hoping_id_stay_disciplined_so_im/,2026-03-17T06:52:02,"https://preview.redd.it/j8vrpfy0ojpg1.png?width=2876&amp;format=png&amp;auto=webp&amp;s=9585eb59a1bd81de9434055a40bafea6e7e44f4f I’ve spent the last few months realising that my edge isn't my strategy it’s my ability to actually follow it. My P/L was fine, but my ""Rule Adherence"" was trash. I started with a complex Excel scoreboard to gamify my discipline (deducting points for over-trading, rewarding points for journaling). It worked so well for my own trading that I’m developing it into a sta",0,4,0.5
2026-03-16 17:57:08+00:00,2026-03-16,Reddit_r/Forex,Who here is unprofitable with less than one year of experience?,https://www.reddit.com/r/Forex/comments/1rvf48p/who_here_is_unprofitable_with_less_than_one_year/,2026-03-16T17:57:08,Comment below: what is your struggle?,10,40,0.86
2026-03-16 13:15:38+00:00,2026-03-16,Reddit_r/Forex,My first profirm result for today,https://www.reddit.com/r/Forex/comments/1rv7sdi/my_first_profirm_result_for_today/,2026-03-16T13:15:38,Started as a Loss. 💙 like Mumbai Indians,19,15,0.83
2026-03-16 17:43:53+00:00,2026-03-16,Reddit_r/Forex,📊 Monday Session Recap: Steady Green Day with 0.7% Gains,https://www.reddit.com/r/Forex/comments/1rveqm6/monday_session_recap_steady_green_day_with_07/,2026-03-16T17:43:53,"📊 Monday Session Recap: Steady Green Day with 0.7% Gains Closed out Monday up 0.7% on the 16 Setup System after a mixed morning across the indices. US500 carried the session with strong performance across all four timeframes — particularly the 1-minute and 45-second setups that both hit 4%+ gains. US100 struggled early with losses on the faster timeframes but recovered nicely on the 3-minute chart. US30 and US2000 were choppy, giving back some gains on certain setups but staying relatively f",3,0,0.81
2026-03-16 18:12:38+00:00,2026-03-16,Reddit_r/Forex,"If a trading bot is profitable, why don’t creators just give it away for free?",https://www.reddit.com/r/Forex/comments/1rvfklw/if_a_trading_bot_is_profitable_why_dont_creators/,2026-03-16T18:12:38,"Someone asked me something interesting recently: &gt;*If you're already making money of it why not give it free for others?* https://preview.redd.it/5mj5728nvfpg1.jpg?width=1080&amp;format=pjpg&amp;auto=webp&amp;s=f5fbb1e3dd5425a36330f7d71550f753005e313e My response is pretty simple. Building a trading system that actually works takes a lot of time, research, testing, and infrastructure. There’s data collection, backtesting, forward testing, debugging, optimization, and often years of itera",2,32,0.53
2026-03-16 23:19:28+00:00,2026-03-16,Reddit_r/Forex,We see mixed signals between spot and futures.,https://www.reddit.com/r/Forex/comments/1rvo9lu/we_see_mixed_signals_between_spot_and_futures/,2026-03-16T23:19:28,,1,0,1.0
2026-03-15 08:39:49+00:00,2026-03-15,Reddit_r/Forex,"As long as it has a chip, you could buy that dip. 🐸",https://www.reddit.com/r/Forex/comments/1ru7yyk/as_long_as_it_has_a_chip_you_could_buy_that_dip/,2026-03-15T08:39:49,,1114,31,0.98
2026-03-16 22:42:02+00:00,2026-03-16,Reddit_r/Forex,Should I buy Chinese yuan,https://www.reddit.com/r/Forex/comments/1rvn8yu/should_i_buy_chinese_yuan/,2026-03-16T22:42:02,Just curious with oil being bought in yuan,1,6,0.57
2026-03-16 08:30:34+00:00,2026-03-16,Reddit_r/Forex,This is going to be a interesting week in Forex,https://www.reddit.com/r/Forex/comments/1rv2xbr/this_is_going_to_be_a_interesting_week_in_forex/,2026-03-16T08:30:34,I will looking out for JPY pairs and AUD pairs. I have marked my areas of interest but will be waiting for the news on these pairs to come out later this week.,14,19,1.0
2026-03-16 16:00:57+00:00,2026-03-16,Reddit_r/Forex,Long Xauusd From 4997 to 5020,https://www.reddit.com/r/Forex/comments/1rvbuui/long_xauusd_from_4997_to_5020/,2026-03-16T16:00:57,,3,1,1.0
2026-03-16 10:21:22+00:00,2026-03-16,Reddit_r/Forex,Possible reversal on EUR USD if the trendline will be pierced strongly?,https://www.reddit.com/r/Forex/comments/1rv4nx6/possible_reversal_on_eur_usd_if_the_trendline/,2026-03-16T10:21:22,,8,6,1.0
2026-03-16 11:56:33+00:00,2026-03-16,Reddit_r/Forex,Trade,https://www.reddit.com/r/Forex/comments/1rv69ih/trade/,2026-03-16T11:56:33,This will most likely be a financial crisis if I don’t make 500k this week,4,0,0.84
2026-03-16 17:20:03+00:00,2026-03-16,Reddit_r/Forex,Usdt need,https://www.reddit.com/r/Forex/comments/1rve1pq/usdt_need/,2026-03-16T17:20:03,Usdt need allover india and dubai Dm with your rates cash deals,0,0,0.5
2026-03-16 17:09:19+00:00,2026-03-16,Reddit_r/Forex,I live for the chop,https://www.reddit.com/r/Forex/comments/1rvdqsk/i_live_for_the_chop/,2026-03-16T17:09:19,"Now, the reason for the choppy market sucks, but my strategy excels in this environment. This is my cash account, and it's the best first qtr I've ever had. I don't make many entries and exits, and I generally hold O/N on most trades, so this is not a strategy for most. Here's to hoping the kangaroo market continues. Best of luck to everyone.",1,1,0.56
2026-03-16 16:39:16+00:00,2026-03-16,Reddit_r/Forex,Just a begginer wanting to start,https://www.reddit.com/r/Forex/comments/1rvcw9j/just_a_begginer_wanting_to_start/,2026-03-16T16:39:16,Hi! I wanna start my forex trading journey. What platform/app can u recommend for Android,1,14,0.6
2026-03-15 23:00:42+00:00,2026-03-15,Reddit_r/Forex,insane roll over slippage,https://www.reddit.com/r/Forex/comments/1rur7hq/insane_roll_over_slippage/,2026-03-15T23:00:42,"can someone explain this please, usually i wouldn’t hold my positions over the weekend due to rollover, but this week i had no choice (i forgot to close my position before marley close). my SL was at my entry (BE) but ive somehow still lost 1% on my position that was up 3% before market close and price didn’t go anywhere near my SL The firm i’m trading with is QT and recently i have been noticing a lot of BS so it could be something to do with that",25,29,0.91
2026-03-16 12:27:33+00:00,2026-03-16,Reddit_r/Forex,Aquafunded account reset?,https://www.reddit.com/r/Forex/comments/1rv6u4l/aquafunded_account_reset/,2026-03-16T12:27:33,Hi I f*cked up and I need help. I have a 100k aquafunded account on evaluation phase but my last trades where so bad I almost maxed out my max drawdown. Is there is a possibility to reset the account or do something to get more drawdown marge?,0,3,0.5
2026-03-15 18:38:25+00:00,2026-03-15,Reddit_r/Forex,Trading choppy market. Avoid or embrace?,https://www.reddit.com/r/Forex/comments/1rukbqm/trading_choppy_market_avoid_or_embrace/,2026-03-15T18:38:25,"Hi, my trading strategy I am normally waiting for a consistent trend and enter when my strategy allows me to confirm. However some days the market can move linear but being extremely choppy. Is there a strategy i can do to tackle this or would it be best to avoid and wait until a clear and clean trend is forming? Sometimes I feel I miss out on a missing strategy to combat this but I avoid as this time. (1M time frame - usually use 5m for clean trends and strategy confirmation) Cheers",24,34,0.94
2026-03-16 07:20:32+00:00,2026-03-16,Reddit_r/Forex,Gold Traders: Is This a Sell Setup on XAUUSD?,https://www.reddit.com/r/Forex/comments/1rv1sdr/gold_traders_is_this_a_sell_setup_on_xauusd/,2026-03-16T07:20:32,,2,3,1.0
2026-03-16 01:07:02+00:00,2026-03-16,Reddit_r/Forex,XauUsd 🤔📊,https://www.reddit.com/r/Forex/comments/1ruu9hb/xauusd/,2026-03-16T01:07:02,,7,10,1.0
2026-03-16 06:25:49+00:00,2026-03-16,Reddit_r/Forex,Does win rate actually determine if you’ll be profitable in trading?,https://www.reddit.com/r/Forex/comments/1rv0uvf/does_win_rate_actually_determine_if_youll_be/,2026-03-16T06:25:49,"Something I’ve been thinking about lately. For the past 3 weeks I’ve been tracking my trades and the numbers actually look pretty decent. Week 1: 13 wins / 6 losses Week 2: 11 wins / 10 losses Week 3: 8 wins / 9 losses I’m not here to brag or anything, but it made me question something. Does win rate actually determine whether you’ll be profitable in trading? For context, I trade with around 1:2 risk reward. So technically it takes two losses to cancel one win, which on paper sounds pret",1,31,0.55
2026-03-16 02:24:50+00:00,2026-03-16,Reddit_r/Forex,😕,https://www.reddit.com/r/Forex/comments/1ruw06a/_/,2026-03-16T02:24:50,,4,2,0.75
2026-03-15 16:00:31+00:00,2026-03-15,Reddit_r/Forex,"My account condition right now, Do you guys think will the uptrend continues till i get a payout 🥹😅",https://www.reddit.com/r/Forex/comments/1rug8hf/my_account_condition_right_now_do_you_guys_think/,2026-03-15T16:00:31,Will it take liq or continue?😵‍💫🥀,27,33,0.94
2026-03-15 15:00:08+00:00,2026-03-15,Reddit_r/Forex,5 gold strategies. 7 years. Same $10K. ICT/SMC: $13K. Supply &amp; demand lost money. Price action: $14K. Buy-and-hold: $41K. One system: $107K.,https://www.reddit.com/r/Forex/comments/1ruerpz/5_gold_strategies_7_years_same_10k_ictsmc_13k/,2026-03-15T15:00:08,"Gold hit $5,300 in January then dropped $600 in one session. Most longs got stopped out. After the crash I ran 5 strategies on 7 years of gold data. $10K each. Same data. Supply and demand zones: $9,280. Lost money. 84 zone entries over 7 years too many false touches on daily gold. ICT/SMC (structure break + OTE pullback): $12,647. 63 trades. 26% in 7 years. ICT was built for intraday on daily bars the context isn't there. Price action (pin bars + engulfing + trend filter): $13,992. Bett",30,29,0.8
