date,date_only,source,title,link,published,summary,score,num_comments,upvote_ratio
2026-03-16 00:07:22+00:00,2026-03-16,Reddit_r/Forex,This wave count suggests a top may be in for the USD as long as 100.614 holds on DXY,https://www.reddit.com/r/Forex/comments/1rusubs/this_wave_count_suggests_a_top_may_be_in_for_the/,2026-03-16T00:07:22,,5,0,1.0
2026-03-16 04:39:10+00:00,2026-03-16,Reddit_r/Forex,Trading and managing different Funded account under different email one same device,https://www.reddit.com/r/Forex/comments/1ruyuwl/trading_and_managing_different_funded_account/,2026-03-16T04:39:10,i think this is one of the community which can help me with my issue i have two instant funding account atm and but someone i know i suggested them to buy and account from same prop firm now i want to trade and handle hes account as well how i can trade on both of the account on same device without getting banned or violate the rules is there any software of vpn i can use im so confused how i can do it,2,5,1.0
2026-03-16 07:10:13+00:00,2026-03-16,Reddit_r/Forex,Trade Idea – Bullish or Bearish? 🤔 a,https://www.reddit.com/r/Forex/comments/1rv1m8m/trade_idea_bullish_or_bearish_a/,2026-03-16T07:10:13,"If gold holds above $5,000, we could see a strong upside move. 📈 Buy zone: $5,000–$4,980 🎯 Targets: $5,115 / $5,140 / $5,340 🛑 SL: Below $4,940 📉 Bearish case: If price breaks below $4,950, next targets could be $4,860–$4,750. What’s your plan? Buying above $5K or waiting for the breakdown below $4,950? 📊",1,8,1.0
2026-03-16 11:55:30+00:00,2026-03-16,Reddit_r/Forex,Which is the best setup?,https://www.reddit.com/r/Forex/comments/1rv68uo/which_is_the_best_setup/,2026-03-16T11:55:30,Frankly speaking THE NO SL SETUP Have taken many trades and in most of them if i didnt keep an SL the trade would go to my direction But me being dumb would keep SL and it would tap and then fly in my direction So took a trade without SL Pray for me guys….😌,0,0,0.2
2026-03-15 04:13:41+00:00,2026-03-15,Reddit_r/Forex,Yall better listen to Alyssa,https://www.reddit.com/r/Forex/comments/1ru38sa/yall_better_listen_to_alyssa/,2026-03-15T04:13:41,,80,13,0.86
2026-03-14 19:11:25+00:00,2026-03-14,Reddit_r/Forex,Why Did the US Dollar Rally During a War?,https://www.reddit.com/r/Forex/comments/1rtqh49/why_did_the_us_dollar_rally_during_a_war/,2026-03-14T19:11:25,"Most traders were confused this week. The US dollar rallied while geopolitical conflict escalated. But macro analysis explains it easily. When uncertainty rises, investors move capital into safe-haven assets. And the US dollar is one of the biggest safe havens in the world. If you understand the market environment, you can anticipate these moves. Not react to them.",180,90,0.86
2026-03-15 22:34:32+00:00,2026-03-15,Reddit_r/Forex,Gold trade idea update,https://www.reddit.com/r/Forex/comments/1ruqjq8/gold_trade_idea_update/,2026-03-15T22:34:32,So last week I gave a gold trade idea and although we did see a nice bounce from our entry we failed to hold support and eventually broke down however we are still holding the trade and we can only hope for the market to recover before hitting the stop loss 😅 Quite unlikely to see a bounce now that we are only 19$ away from the stop. I will provide another trade idea this week if I do get one. Also I’m only posting this to document my trades to improve and become a better trader and I’m ope,0,4,0.4
2026-03-15 22:13:22+00:00,2026-03-15,Reddit_r/Forex,A single concept can help…,https://www.reddit.com/r/Forex/comments/1ruq00o/a_single_concept_can_help/,2026-03-15T22:13:22,A single concept can help… But **combining concepts creates precision.** One powerful combination is: **Liquidity Sweep + Fair Value Gap** Often the market will: 1️⃣ Take liquidity above highs or below lows 2️⃣ Move aggressively creating an FVG 3️⃣ Return to the imbalance before continuing This sequence reveals **intent and structure**. Professional traders don’t just look at where price is. They study **what the market has already done.**,1,3,1.0
2026-03-16 06:44:12+00:00,2026-03-16,Reddit_r/Forex,Elite Forex trades?,https://www.reddit.com/r/Forex/comments/1rv1660/elite_forex_trades/,2026-03-16T06:44:12,"I’ve been seeing that they’ve been quite reliable over the years; can anyone confirm or deny this? Also, I’ve checked out their prices and it looks a lot like I’m overpaying; anyone interested in sharing accounts and sharing buy ins?",0,7,0.22
2026-03-15 06:48:55+00:00,2026-03-15,Reddit_r/Forex,What is your trading plan strategy?,https://www.reddit.com/r/Forex/comments/1ru65z5/what_is_your_trading_plan_strategy/,2026-03-15T06:48:55,"So, I’ve been trading for the past 3 years. Making some extra cash on the side and putting it in my savings. I started with $10, making some risky trades on a micro account to withdraw my capital. Eventually I done that and drew up a 12 month trading plan based off 20 days per month. My RR is 5% risk to 10%(very risky for a $10 account)reward per setup trading at lowest lot size. As the months go along, I decrease the risk and reward percentage. Currently I’ve withdrawn roughly $900, with",14,14,1.0
2026-03-15 11:15:58+00:00,2026-03-15,Reddit_r/Forex,Trading journal platform,https://www.reddit.com/r/Forex/comments/1ruag87/trading_journal_platform/,2026-03-15T11:15:58,"I’m planning to build a simple trading journal web app for retail traders. The idea is a tool where traders can: - log trades quickly - track win rate, RR, and equity curve - analyze performance by session (London/NY) and strategy - upload trade screenshots for review The goal is to keep it very simple and affordable (~$2–$3/month) compared to most trading journals. Before building it, I’d love some feedback from traders here: What feature would actually make you pay for a trading journal?",5,9,0.86
2026-03-15 19:26:34+00:00,2026-03-15,Reddit_r/Forex,Binance P2P USD rate in UAE?,https://www.reddit.com/r/Forex/comments/1rullhj/binance_p2p_usd_rate_in_uae/,2026-03-15T19:26:34,"Hi guys, What is the current USDT/USD rate on Binance P2P in UAE (AED)? How much AED for 1 USDT / 1 USD these days? Also which payment method gives the best rate (bank transfer, cash deposit, etc.)?",1,0,1.0
2026-03-16 00:24:24+00:00,2026-03-16,Reddit_r/Forex,"Boom, $4,6xx Gold here we come",https://www.reddit.com/r/Forex/comments/1rut9c0/boom_46xx_gold_here_we_come/,2026-03-16T00:24:24,dump it,0,11,0.38
2026-03-15 08:19:04+00:00,2026-03-15,Reddit_r/Forex,USD JPY it is hitting a critical price,https://www.reddit.com/r/Forex/comments/1ru7nfk/usd_jpy_it_is_hitting_a_critical_price/,2026-03-15T08:19:04,"Price keeps going higher and higher but momentum is at 99 percent, meaning exhaustion. What is your take on this?",6,6,0.75
2026-03-15 16:58:12+00:00,2026-03-15,Reddit_r/Forex,Need advice on pnl statement.,https://www.reddit.com/r/Forex/comments/1ruhppa/need_advice_on_pnl_statement/,2026-03-15T16:58:12,[is this good for long term susatinment.?](https://preview.redd.it/rjpasw5id8pg1.png?width=318&amp;format=png&amp;auto=webp&amp;s=80cbc0d9353f7c7f3b952dcba57d6cc5b673246a),0,3,0.5
2026-03-15 16:33:21+00:00,2026-03-15,Reddit_r/Forex,Day 5 update of the no BE challenge… rough end of the week,https://www.reddit.com/r/Forex/comments/1ruh2u4/day_5_update_of_the_no_be_challenge_rough_end_of/,2026-03-15T16:33:21,"Day 5 update of the no BE full SL / full TP challenge. This is a late update since today is Sunday, so this is what happened on Friday. Honestly it was tough and rough. I actually had a sell setup, but it was very close to a news release, so I decided not to enter the trade. Turns out the trade went way past full TP after that. The counter trend buys I took later were completely cooked by the market. So yeah… not the best way to end the week. Started the week pretty good but ended the week bad",1,0,0.67
2026-03-15 16:01:19+00:00,2026-03-15,Reddit_r/Forex,Scam mentors,https://www.reddit.com/r/Forex/comments/1rug9cg/scam_mentors/,2026-03-15T16:01:19,Jackpot Richhydaforexking Jovier Keep the thread going,1,4,1.0
2026-03-14 10:01:52+00:00,2026-03-14,Reddit_r/Forex,I feel like I’m the only one who trades currency pairs on this Reddit lol,https://www.reddit.com/r/Forex/comments/1rtelyw/i_feel_like_im_the_only_one_who_trades_currency/,2026-03-14T10:01:52,,170,81,0.97
2026-03-15 04:46:24+00:00,2026-03-15,Reddit_r/Forex,NZDCAD Weekly,https://www.reddit.com/r/Forex/comments/1ru3voe/nzdcad_weekly/,2026-03-15T04:46:24,Closed out my Short on Friday and went Long.,3,1,1.0
2026-03-15 05:10:51+00:00,2026-03-15,Reddit_r/Forex,Gold next week,https://www.reddit.com/r/Forex/comments/1ru4cvk/gold_next_week/,2026-03-15T05:10:51,,0,15,0.48
2026-03-14 12:49:39+00:00,2026-03-14,Reddit_r/Forex,trading anxiety,https://www.reddit.com/r/Forex/comments/1rtheln/trading_anxiety/,2026-03-14T12:49:39,"For the past month, ive been stuck in a consistent losing streak. Im not here to ask for new strategies; im looking for perspective from traders who have hit this wall and climbed over it. Looking back at my recent trades is honestly embarrassing. More than that, i’m experiencing intense anxiety about getting back into the market. Just the thought of placing my next trade triggers a fear of losing that i can't seem to shake. Its becoming a constant, uncomfortable loop in my head. How did you b",21,26,1.0
2026-03-14 21:30:53+00:00,2026-03-14,Reddit_r/Forex,Carry Trade?,https://www.reddit.com/r/Forex/comments/1rtu1bl/carry_trade/,2026-03-14T21:30:53,"Is anyone currently working a carry trade? If so, which pairs? Interest rates seem a little all over the place for this to work right now.",4,5,1.0
2026-03-14 10:56:34+00:00,2026-03-14,Reddit_r/Forex,Simple Strategy,https://www.reddit.com/r/Forex/comments/1rtfgby/simple_strategy/,2026-03-14T10:56:34,,17,15,0.88
2026-03-14 21:26:01+00:00,2026-03-14,Reddit_r/Forex,"GBPCAD Long Opportunity (H1, Daily, M5)",https://www.reddit.com/r/Forex/comments/1rttwxs/gbpcad_long_opportunity_h1_daily_m5/,2026-03-14T21:26:01,,2,0,0.75
2026-03-13 22:07:51+00:00,2026-03-13,Reddit_r/Forex,Talk about inverse yourself. 🎻🥺,https://www.reddit.com/r/Forex/comments/1rszszu/talk_about_inverse_yourself/,2026-03-13T22:07:51,,148,34,0.94
2026-03-14 19:58:04+00:00,2026-03-14,Reddit_r/Forex,Silver,https://www.reddit.com/r/Forex/comments/1rtro9j/silver/,2026-03-14T19:58:04,,2,0,0.75
2026-03-14 03:36:59+00:00,2026-03-14,Reddit_r/Forex,Funded FTMO ACCOUNT,https://www.reddit.com/r/Forex/comments/1rt7og1/funded_ftmo_account/,2026-03-14T03:36:59,What up yall I’m currently in profit on my 2 funded ftmo accounts. 1 one step and 1 two step. I’m 10 and 11 days away from being eligible for a payout. I’m stuck between just cashing out both or just trading 1. What y’all think ?,29,27,0.91
2026-03-13 15:52:42+00:00,2026-03-13,Reddit_r/Forex,Second profit on gold ✅,https://www.reddit.com/r/Forex/comments/1rspgvm/second_profit_on_gold/,2026-03-13T15:52:42,,249,42,0.96
2026-03-14 22:43:58+00:00,2026-03-14,Reddit_r/Forex,Gold will keep blowing so many accounts for a long time until the market settles down. For a M5 candle that continuously prints 500pips…,https://www.reddit.com/r/Forex/comments/1rtvuzw/gold_will_keep_blowing_so_many_accounts_for_a/,2026-03-14T22:43:58,,0,2,0.25
2026-03-14 11:26:35+00:00,2026-03-14,Reddit_r/Forex,"Hey guys, I love my trading, but there are times when you just want to give up everything and go somewhere. How do you deal with the fact that you can't do anything for a long time?",https://www.reddit.com/r/Forex/comments/1rtfy9j/hey_guys_i_love_my_trading_but_there_are_times/,2026-03-14T11:26:35,"Hey guys, I love my trading, but there are times when you just want to give up everything and go somewhere. How do you deal with the fact that you can't do anything for a long time? Do you give up halfway or do you want to achieve your goals at any cost? I'm all for achieving what you want at any cost, are you too?",3,9,1.0
2026-03-14 17:15:15+00:00,2026-03-14,Reddit_r/Forex,Automated gold trading bot,https://www.reddit.com/r/Forex/comments/1rtngy8/automated_gold_trading_bot/,2026-03-14T17:15:15,I've been testing an automated gold trading bot lately. Not selling anything but the results have been interesting. Anyone else experimenting with algo trading?,0,17,0.5
2026-03-14 11:11:33+00:00,2026-03-14,Reddit_r/Forex,Great week of trading,https://www.reddit.com/r/Forex/comments/1rtfp7n/great_week_of_trading/,2026-03-14T11:11:33,Things seemed better this week for the forex swing traders. Trends are starting to look better.,3,7,1.0
2026-03-14 16:01:12+00:00,2026-03-14,Reddit_r/Forex,Model Retraining,https://www.reddit.com/r/Forex/comments/1rtlmf3/model_retraining/,2026-03-14T16:01:12,"Something that surprised me while retraining my trading models: • Retraining matters more than I expected. Markets are non-stationary (a well-established concept in quantitative finance), meaning statistical relationships drift over time. Static training datasets can become outdated faster than we think. • I originally trained on 2022–2025 data and the backtests looked great, but the model started breaking around Feb–March. My dataset is fairly diverse, combining technical indicators and derived",0,1,0.5
2026-03-14 15:48:40+00:00,2026-03-14,Reddit_r/Forex,Thinking of Creating a community for UJ traders / Asian session traders,https://www.reddit.com/r/Forex/comments/1rtlbm9/thinking_of_creating_a_community_for_uj_traders/,2026-03-14T15:48:40,"Hey all, I was thinking of creating a community for traders who prefer or want to trade in Asian session or is trading UJ, share your thoughts !!",1,2,0.67
2026-03-14 08:11:34+00:00,2026-03-14,Reddit_r/Forex,How do you think gold will move on Monday?,https://www.reddit.com/r/Forex/comments/1rtcttg/how_do_you_think_gold_will_move_on_monday/,2026-03-14T08:11:34,"with the attack on kharg island, it seems like it will go down quite a bit",3,6,0.67
2026-03-13 22:47:52+00:00,2026-03-13,Reddit_r/Forex,Weekend hold on XAUUSD buy — 0.4 lot +$250 profit... what do you think the Monday gap will be? Buy or sell gap risk?,https://www.reddit.com/r/Forex/comments/1rt0uf2/weekend_hold_on_xauusd_buy_04_lot_250_profit_what/,2026-03-13T22:47:52,"Hey everyone, I've got a 0.4 lot Buy position open on XAUUSD that I'm holding through the weekend. Currently sitting at around $250 in profit. My main concern is the Sunday gap — with everything going on macro-wise, I'm not 100% sure which direction it'll push. What do you guys think? Are you expecting a bullish or bearish gap on gold when the market opens Sunday? Would love to hear how other traders are positioning themselves this weekend. Account balance 3000$",12,25,0.83
2026-03-14 10:07:03+00:00,2026-03-14,Reddit_r/Forex,Thoughts on the 'world class edge' strategy by Patrick Nill?,https://www.reddit.com/r/Forex/comments/1rteov2/thoughts_on_the_world_class_edge_strategy_by/,2026-03-14T10:07:03,What do you guys objectively think about Patrick nill from the World Class Edge? Their claim to fame has always been their World trading championship (WTC) wins and I initially thought this definitely showed some real skill and legitimacy But I've also recently learned you can open multiple accounts in the competition and only report the winning ones which really shatters any credibility that the title brings Also on their website they claim to have 'Institutional-level trading with,0,3,0.5
2026-03-13 08:04:12+00:00,2026-03-13,Reddit_r/Forex,Bought Gold and Silver at the last Minute,https://www.reddit.com/r/Forex/comments/1rsgdib/bought_gold_and_silver_at_the_last_minute/,2026-03-13T08:04:12,,77,13,1.0
2026-03-13 22:48:38+00:00,2026-03-13,Reddit_r/Forex,Update from yesterday buys and todays shorts XAUUSD and XAGUSD trades,https://www.reddit.com/r/Forex/comments/1rt0v56/update_from_yesterday_buys_and_todays_shorts/,2026-03-13T22:48:38,Feel free to ask me any questions!,6,3,0.8
2026-03-13 18:21:07+00:00,2026-03-13,Reddit_r/Forex,Damn,https://www.reddit.com/r/Forex/comments/1rstjs0/damn/,2026-03-13T18:21:07,Imagine if I won two in a row,11,17,0.87
2026-03-13 23:59:21+00:00,2026-03-13,Reddit_r/Forex,Kubloweee,https://www.reddit.com/r/Forex/comments/1rt2n0r/kubloweee/,2026-03-13T23:59:21,Whats the fastest time you've blown an account?,2,1,1.0
2026-03-13 20:01:49+00:00,2026-03-13,Reddit_r/Forex,AUD/CAD,https://www.reddit.com/r/Forex/comments/1rswe24/audcad/,2026-03-13T20:01:49,"Had a nice big trade yesterday and unfortunately let my ego get the best of me today 🤦🏽‍♂️😂 This was my first trade with profit over $1,000 usd and I acted a fool today. Should’ve stuck to my trading plan and not entered a trade because I basically blew all that today revenge trading. Here’s to holding each other accountable in 2026 🤙🏽",3,0,1.0
2026-03-13 10:46:11+00:00,2026-03-13,Reddit_r/Forex,Gold TP ✅,https://www.reddit.com/r/Forex/comments/1rsiyad/gold_tp/,2026-03-13T10:46:11,Always the same simple but effective strategy.,16,13,1.0
2026-03-13 04:53:38+00:00,2026-03-13,Reddit_r/Forex,Im in this now.,https://www.reddit.com/r/Forex/comments/1rscyiw/im_in_this_now/,2026-03-13T04:53:38,,45,53,0.93
2026-03-13 21:42:16+00:00,2026-03-13,Reddit_r/Forex,Not too bad for a weekend of practice. Just looking for Liquidities,https://www.reddit.com/r/Forex/comments/1rsz4ap/not_too_bad_for_a_weekend_of_practice_just/,2026-03-13T21:42:16,,0,2,0.2
2026-03-13 20:42:54+00:00,2026-03-13,Reddit_r/Forex,Day 4 update of the no BE challenge… this one didn’t go well,https://www.reddit.com/r/Forex/comments/1rsxia2/day_4_update_of_the_no_be_challenge_this_one/,2026-03-13T20:42:54,"Day 4 update of the no BE full SL / full TP challenge. As you guys can see… today did not turn out well. For some context, this is Phase 2 of the funded challenge and this is day 4 of removing breakeven from my trading to see if trusting the strategy works better. Here’s how the story went today. First trade actually had good confluence and was in profit, so I moved to BE. Price ended up coming back to BE and ran almost 1300 pips on gold like a waterfall. Unfortunately I didn’t capture that",1,0,1.0
2026-03-13 17:55:30+00:00,2026-03-13,Reddit_r/Forex,"📊 Daily Recap: Friday, March 13th, 2026",https://www.reddit.com/r/Forex/comments/1rsstha/daily_recap_friday_march_13th_2026/,2026-03-13T17:55:30,"📊 Daily Recap: Friday, March 13th, 2026 Closed out the week with a modest +0.1% gain today, keeping the momentum steady. Over the past 7 days we're sitting at -0.3%, but zooming out to the 30-day view shows a strong +12.3% climb. March is tracking at +1.1% so far, reflecting consistent execution through the first half of the month. Friday's session delivered mixed results across the board. US30 showed resilience with wins on the 1-minute (+0.5%) and 2-minute (+2.0%) setups, while the 45-se",1,0,0.67
2026-03-13 15:19:45+00:00,2026-03-13,Reddit_r/Forex,Trading idea - what am I doing wrong?,https://www.reddit.com/r/Forex/comments/1rsolxb/trading_idea_what_am_i_doing_wrong/,2026-03-13T15:19:45,"Hey traders/trading enthusiasts, I’m an Econ student and I have access to Bloomberg terminal through my uni. I’m working on a USDMXN trade idea, and I want to sanity-check my process with you guys. Here’s my approach: (1) I form a macro view by layering Banxico rates, tariff scenarios, and nearshoring data. (2) I check USDMXN spot, carry, and implied volatility. (3) I read major banks’ views to see consensus positioning. (4) I try to identify if the market’s mispricing something. My",1,5,0.67
2026-03-17 09:00:35+00:00,2026-03-17,Reddit_r/investing,"Daily General Discussion and Advice Thread - March 17, 2026",https://www.reddit.com/r/investing/comments/1rw0efl/daily_general_discussion_and_advice_thread_march/,2026-03-17T09:00:35,Have a general question? Want to offer some commentary on markets? Maybe you would just like to throw out a neat fact that doesn't warrant a self post? Feel free to post here! Please consider consulting our FAQ first - [https://www.reddit.com/r/investing/wiki/faq](https://www.reddit.com/r/investing/wiki/faq) And our [side bar](https://www.reddit.com/r/investing/about/sidebar) also has useful resources. If you are new to investing - please refer to Wiki - [Getting Started](https://www.reddit.co,3,0,0.72
2026-01-01 14:02:21+00:00,2026-01-01,Reddit_r/investing,Investing and Trading Scam Reminder,https://www.reddit.com/r/investing/comments/1q13q10/investing_and_trading_scam_reminder/,2026-01-01T14:02:21,"For those new to Reddit and to investing and trading - please be aware that social media platform like Reddit, Discord, etc. can be a vector for scams and fraud. Offers to DM should be viewed as suspicious. Social media platforms continue to be a common method to recruit new investors to scams. - do not assume that an offer to ""help"" is legitimate. There are many dozens of types of scams - a list of scam types can be found in r/scams in the master list here: [/r/Scams Common Scam Master](ht",46,14,0.91
2026-03-17 16:23:59+00:00,2026-03-17,Reddit_r/investing,How big of a deal is the Strait of Hormuz actually? Feels like this could spiral into a global economic problem,https://www.reddit.com/r/investing/comments/1rw9m88/how_big_of_a_deal_is_the_strait_of_hormuz/,2026-03-17T16:23:59,"I keep seeing coverage of the Middle East escalation, but not enough focus on the Strait of Hormuz itself, which seems like the real pressure point. A huge portion of global oil supply runs through that route, and it sounds like even partial disruption (not a full blockade) could spike energy prices pretty quickly. That feeds directly into inflation, which then puts central banks in a tough spot if growth starts slowing at the same time. So you end up with a potential stagflation scenario, w",338,393,0.83
2026-03-17 22:40:58+00:00,2026-03-17,Reddit_r/investing,AST SpaceMobile's 2026 targets,https://www.reddit.com/r/investing/comments/1rwkdtj/ast_spacemobiles_2026_targets/,2026-03-17T22:40:58,"I like AST SpaceMobile but their 2026 targets are a bit optimistic. I have a small position, but nothing substanial. They’re hoping to launch 45–60 satellites by the end of the year. So far there’s only 6 in orbit, with the last launch in December. They haven't launched anything yet this year and its mid March (supposedly one is coming soon however). Getting to 50 in less than a year seems almost impossible without everything going perfectly. Also it’s kind of weird how hard it is to find a cl",9,13,0.8
2026-03-17 15:01:46+00:00,2026-03-17,Reddit_r/investing,Oklo Announces DOE Approval for Nuclear Safety Design Agreement of Aurora Powerhouse at Idaho National Laboratory,https://www.reddit.com/r/investing/comments/1rw7dlr/oklo_announces_doe_approval_for_nuclear_safety/,2026-03-17T15:01:46,"Oklo announced that the U.S. Department of Energy has approved a Nuclear Safety Design Agreement (NSDA) for the Aurora Powerhouse at Idaho National Laboratory. This is a key regulatory milestone that validates the safety design approach for its first reactor under the DOE’s accelerated authorization pathway. The NSDA is part of the DOE’s Reactor Pilot Program, which allows companies like Oklo to move faster than the traditional NRC-only process by advancing design, construction, and operational",26,4,0.79
2026-03-18 03:41:43+00:00,2026-03-18,Reddit_r/investing,Structural Asymmetry in Digital Valuations: Evaluating Perion Network’s (PERI) 79% EV-Based FCF Yield and a $32.60 Target Price,https://www.reddit.com/r/investing/comments/1rwrtgs/structural_asymmetry_in_digital_valuations/,2026-03-18T03:41:43,"Liquidity and Balance Sheet Assessment According to the most recent SEC filings, Perion holds an exceptionally strong $313 million in net cash. Evaluated at a current equity pricing of $9.00 per share, with 40.43 million shares outstanding, the total market capitalization equates to approximately $364 million. Consequently, the cash reserve accounts for 86% of the firm's total equity value. This mathematically compresses the enterprise value (EV) of the underlying operational business to a mere",0,0,0.5
2026-03-17 21:00:16+00:00,2026-03-17,Reddit_r/investing,App/website to see watchlist + 1-year charts for all stocks on one page?,https://www.reddit.com/r/investing/comments/1rwhl6q/appwebsite_to_see_watchlist_1year_charts_for_all/,2026-03-17T21:00:16,"Hi everyone, I’m looking for an app or website where I can add my stock watchlist and see the 1-year price chart for all of them on a single page (like a grid of charts). Ideally something where I can quickly compare performance without clicking into each ticker individually. Does anyone know a tool that can do this? I’ve looked at some platforms like TradingView and others, but I’m not sure if they support a full watchlist chart overview in one screen. Any recommendations would be apprecia",3,2,0.8
2026-03-17 16:51:14+00:00,2026-03-17,Reddit_r/investing,SATS and XOVR SpaceX IPO Proxy Strategy?,https://www.reddit.com/r/investing/comments/1rwad9b/sats_and_xovr_spacex_ipo_proxy_strategy/,2026-03-17T16:51:14,"With SpaceX reportedly targeting a June 2026 IPO at a $1.75 trillion valuation, Looking into this I’ve found 2 proxies: $SATS (EchoStar) and $XOVR (ERShares Crossover). The part I can’t wrap my head around is the massive valuation gap between where these two are buying in and the projected IPO price. Am I missing something, or is this a blatant arbitrage play? The $SATS Math: EchoStar just closed a spectrum deal where they received $11.1 billion in SpaceX equity. Here’s the kicker, at the ti",5,2,0.69
