date,date_only,source,title,link,published,summary,score,num_comments,upvote_ratio
2026-03-13 10:12:28+00:00,2026-03-13,Reddit_r/investing,Strange time for European investors and US stocks,https://www.reddit.com/r/investing/comments/1rsiek2/strange_time_for_european_investors_and_us_stocks/,2026-03-13T10:12:28,"I had been keeping some cash on the side in a HYSA since it was obvious the war with Iran would happen (first carrier on the way there) to invest in the S&amp;P when it went down but somehow the opportunity isn't happening. The USD recovery (at least vs EUR) matches perfectly the drop of the index itself and we are exactly where we were before this started, even after a 5% drop on the S&amp;P. Is this tendency likely to change? Would further drops on the S&amp;P be followed by further USD re",73,36,0.85
2026-03-13 16:32:02+00:00,2026-03-13,Reddit_r/investing,A D.C. energy expert's analysis when the Strait will re-open,https://www.reddit.com/r/investing/comments/1rsqir8/a_dc_energy_experts_analysis_when_the_strait_will/,2026-03-13T16:32:02,"Thought this was a great interview between an ex-Milennium PM and an MD of a major energy-specific investment research firm. Struggling to find anything better than MSNBC, CNN or tilted newspaper articles. Found it funny that the guy said the bars he takes politicians to in DC is considered a ""trade secret"". [https://youtu.be/cku1zwxJ4pE?si=fgAtDl19gGHzrOf1](https://youtu.be/cku1zwxJ4pE?si=fgAtDl19gGHzrOf1)",16,10,0.7
2026-03-14 15:26:34+00:00,2026-03-14,Reddit_r/investing,Would your capital allocation change if you had access to 8-9% risk free time deposits?,https://www.reddit.com/r/investing/comments/1rtksti/would_your_capital_allocation_change_if_you_had/,2026-03-14T15:26:34,"So I’ve been dumping all my investments into US/Global index funds and have zero exposure to bonds or bond-like instruments aside from my EF sitting in a HYSA. In the country I’m in, the proliferation of digital banks have brought about 12 month time deposits offering 8-9% nominal returns, effectively risk free since it’s insured by the government up to a certain amount (yes I know it isn’t 100% risk free). Removing emotions and feelings, is it worth allocating up to that “certain amount” or i",0,21,0.37
2026-03-14 14:45:00+00:00,2026-03-14,Reddit_r/investing,"21m, looking for your opinions",https://www.reddit.com/r/investing/comments/1rtjtc8/21m_looking_for_your_opinions/,2026-03-14T14:45:00,"Hi guys! I've been thinking the past days hoe should i make my investing strategy. The first thing is that i want to accumulate atleast 0.05 bitcoin, but my goal is 0.1. Than i want to invest into the stock market and i thought this might be good. -60% webn, which is an all country world etf -20% xnas which is a nasdaq etf -20% tdiv, which is like a schd. The reasoning behind this is that the most part i want to have an engine that is growing, this is the all world. Then i want to have a more",0,17,0.31
2026-03-14 08:02:17+00:00,2026-03-14,Reddit_r/investing,Why does nobody talk about the securities lending market even though it's huge?,https://www.reddit.com/r/investing/comments/1rtcnwz/why_does_nobody_talk_about_the_securities_lending/,2026-03-14T08:02:17,"I’ve been reading more about how institutional markets actually work behind the scenes, and one thing that surprised me is how big the securities lending market is. Most retail investors talk about buying stocks, holding stocks, or short selling. But there’s this entire infrastructure where large institutions are constantly lending and borrowing securities between each other. Pension funds, asset managers, and banks lend shares to hedge funds or brokers, usually in exchange for collateral and",0,11,0.48
2026-03-13 13:05:53+00:00,2026-03-13,Reddit_r/investing,ONDS is turning into a defense robotics play with big growth targets,https://www.reddit.com/r/investing/comments/1rslhs9/onds_is_turning_into_a_defense_robotics_play_with/,2026-03-13T13:05:53,"Ondas Inc. (ONDS) is one of those small-cap tech stocks that quietly shifted its business model over the last few years. What started as an industrial wireless network company is now positioning itself as a defense robotics and autonomous systems platform. The company operates through its Ondas Autonomous Systems division, which develops drone platforms, counter-drone defense systems, and tactical ground robots used by military and security customers. Their portfolio includes systems like the O",16,7,0.86
2026-03-14 02:50:51+00:00,2026-03-14,Reddit_r/investing,What insights would you try to extract from a large dataset of SEC comment letters?,https://www.reddit.com/r/investing/comments/1rt6oix/what_insights_would_you_try_to_extract_from_a/,2026-03-14T02:50:51,"I’ve been working on aggregating SEC comment letters and company responses from EDGAR into a dataset so they’re easier to analyze. The filings are public, but they’re scattered and not particularly easy to explore systematically. When I first started digging into the data, I expected there might be some obvious patterns like certain sectors getting far more scrutiny than others. But at a high level it mostly seems to correlate with the number of companies in each sector. Bigger sectors naturall",0,1,0.5
2026-03-13 14:52:43+00:00,2026-03-13,Reddit_r/investing,Defense Spending Is Quietly Becoming a Major Driver of Copper Demand,https://www.reddit.com/r/investing/comments/1rsnx15/defense_spending_is_quietly_becoming_a_major/,2026-03-13T14:52:43,"Most conversations about copper focus on electric vehicles, renewable energy, and power grid expansion. Those are clearly major demand drivers. But another sector is quietly emerging as an important source of copper consumption: defense. Global military spending has been rising steadily and is projected to accelerate significantly over the next decade. According to recent projections, global defense spending could grow from about $2.1 trillion in 2010 to nearly $6 trillion by 2040. Much of that",8,3,0.68
2026-03-13 11:10:52+00:00,2026-03-13,Reddit_r/investing,I Analysed top 100 Software Companies By Earnings So You Dont Have To,https://www.reddit.com/r/investing/comments/1rsjd46/i_analysed_top_100_software_companies_by_earnings/,2026-03-13T11:10:52,"In my research of finding great companies below fair value I went through the top 100 companies that sell software by earnings. Software companies are cheap right now even though they are great companies, because of AI disruption fears. But as long as AI has not proven any real large scale value, we should value the “disruption” as such. If you follow this idea, it should be clear that the sell off for software companies is unjustified, and it is a good opportunity to get great companies for g",14,55,0.59
2026-03-14 08:24:21+00:00,2026-03-14,Reddit_r/investing,Ai funds or just stick to index?,https://www.reddit.com/r/investing/comments/1rtd1e6/ai_funds_or_just_stick_to_index/,2026-03-14T08:24:21,"I am interested in investing in ai funds, like ""Allianz Global Artificial Intelligence EUR"" but i feel the cost of the fund is a little to much, is it worth it in the long run, since it most likely will be increasing over the years? Or would just a normal index fund with lower cost/ tech fund be better?",0,23,0.22
2026-03-14 04:17:07+00:00,2026-03-14,Reddit_r/investing,Does closing an old position to open a new one cancel out the extra tax hit from short term vs long term gains tax?,https://www.reddit.com/r/investing/comments/1rt8j18/does_closing_an_old_position_to_open_a_new_one/,2026-03-14T04:17:07,"I bought ASTS calls last September and my position was 70 calls of $12.5 1/15/2027 expiration. I've been selling calls on these calls throughout and today my position got closed by Robinhood because my short strike was $87 (and I suppose Robinhood thought there was risk even though ASTS closed below $85). In any case, this is not the point of my post. The Delta on my 1/15/2027 was pretty much shares, at 0.98690. I made around 400K from this trade, thus I owe a boatload of short term capital gai",0,7,0.35
2026-03-13 04:06:08+00:00,2026-03-13,Reddit_r/investing,Nervous about divesting from real estate,https://www.reddit.com/r/investing/comments/1rsbzqe/nervous_about_divesting_from_real_estate/,2026-03-13T04:06:08,"I purchased a duplex in 2020 and was owner-occupying one side and renting the other at the time. 3.5% mortgage, mostly paid by the tenants. At the end of last year I relocated for my partner's job to another state and rented my side as well. Net income after expenses (yard work, utilities) is $1400/month. Roughly $700k in equity. The problem is, I don't think I'll be moving back. In fact, I'm hoping to retire early in the EU, in the next 5 years. I also know I need to sell within 3 years to tak",15,24,0.75
2026-03-12 19:37:48+00:00,2026-03-12,Reddit_r/investing,Should i stop contributing to Roth 401k? and Make all future contributions to Trad 401k?,https://www.reddit.com/r/investing/comments/1rrz4b6/should_i_stop_contributing_to_roth_401k_and_make/,2026-03-12T19:37:48,"I was working on my taxes and i realized something crazy. Houshold income approx 230k. Both of us contributed below for 2025. we are maxing out in 2026 and going forward mostly. 1. Trad 401k - 13k + 13k 2. Roth 401k - 8k + 8k when i was doing taxes i owe approximately 3000$, So i was playing aournd with W2 numbers in tax software and realized that if i would have just made that 16k to trad 401k, i am getting a 2k refund. So thats like a 5k savings. My thought process for roth 401k",42,101,0.76
2026-03-13 01:39:48+00:00,2026-03-13,Reddit_r/investing,Is EWY still a good investment?,https://www.reddit.com/r/investing/comments/1rs8pcc/is_ewy_still_a_good_investment/,2026-03-13T01:39:48,Since the war South Korea markets have been getting cooked and I want to hear others opinions if it was overvalued due to AI hype in the first place. Is it worth cutting my losses after putting money in recently and moving it into VT instead? I don’t mind risk but don’t want to have money in there doing nothing or going negative when I could put it somewhere else.,16,8,0.86
2026-03-13 09:00:56+00:00,2026-03-13,Reddit_r/investing,"Daily General Discussion and Advice Thread - March 13, 2026",https://www.reddit.com/r/investing/comments/1rsha94/daily_general_discussion_and_advice_thread_march/,2026-03-13T09:00:56,Have a general question? Want to offer some commentary on markets? Maybe you would just like to throw out a neat fact that doesn't warrant a self post? Feel free to post here! Please consider consulting our FAQ first - [https://www.reddit.com/r/investing/wiki/faq](https://www.reddit.com/r/investing/wiki/faq) And our [side bar](https://www.reddit.com/r/investing/about/sidebar) also has useful resources. If you are new to investing - please refer to Wiki - [Getting Started](https://www.reddit.co,3,9,0.81
2026-03-12 08:17:38+00:00,2026-03-12,Reddit_r/investing,Nvidia keeps writing $2B checks across the AI ecosystem,https://www.reddit.com/r/investing/comments/1rrk1ah/nvidia_keeps_writing_2b_checks_across_the_ai/,2026-03-12T08:17:38,"Saw this breakdown of Nvidia’s latest $2B investment into Nebius, which sent the stock up about 16%. What stood out to me is that this isn’t a one-off, Nvidia has been making multiple $2B investments recently (CoreWeave, Lumentum, Coherent, Synopsys, and now Nebius). From what I understand, these deals usually involve: * Early access to Nvidia’s next-gen hardware * Collaboration on AI infrastructure / “AI factories” * Huge deployment targets (Nebius reportedly aiming for 5 GW of Nvidia systems",265,61,0.95
2026-03-13 22:21:58+00:00,2026-03-13,Reddit_r/investing,Closest way to mimic a QQQ put without options or leverage?,https://www.reddit.com/r/investing/comments/1rt06hl/closest_way_to_mimic_a_qqq_put_without_options_or/,2026-03-13T22:21:58,"I generally buy QQQ puts to hedge my tech portfolio, 8-12 months out usually which works very well. Hypothetical question: For whatever reason, options/leveraged short ETFs are not in consideration. What would be the next best mimic to a QQQ put? I understand the daily reset on even a 1x Inverse ETF like PSQ since you're buying into a more complex derivative structure (my understanding is swaps). I am not sure about the daily reset bit as compared theta decay on an 8–12-month QQQ put.",0,21,0.2
2026-03-13 02:00:42+00:00,2026-03-13,Reddit_r/investing,What would you do for your kids to start them off when they start working to help them out when they are older.,https://www.reddit.com/r/investing/comments/1rs970g/what_would_you_do_for_your_kids_to_start_them_off/,2026-03-13T02:00:42,I was thinking of doing something for my kids when they start working to help them save for the future. Like tell the to pay me like $20 or something each week and I Match it and invest it over time. I was thinking like 20+ years or more. So any good idea that guys have done for four/with your Kids? What’s a good long term Investment like this,7,37,0.73
2024-09-26 18:48:09+00:00,2024-09-26,Reddit_r/economics,[Meta] Rules II &amp; III: Policy Proposals and Non-economists,https://www.reddit.com/r/Economics/comments/1fq0up7/meta_rules_ii_iii_policy_proposals_and/,2024-09-26T18:48:09,"Hi all, In light of an exceeding amount of rulebreaking posts, the r/economics modteam wanted to both clarify the rules and provide some clear examples of rule breaking. As part of this post, please find links to the [Rule II Roundtable](https://www.reddit.com/r/Economics/comments/7x14px/meta_rules_roundtable_2_submissions_and_rii/?utm_source=share&amp;utm_medium=web3x&amp;utm_name=web3xcss&amp;utm_term=1&amp;utm_content=share_button) and [Rule III Roundtable](https://www.reddit.com/r/Economics",190,20,0.97
2025-10-13 11:49:41+00:00,2025-10-13,Reddit_r/economics,"2025 Nobel Prize in Economics awarded to Joel Mokyr, Philippe Aghion and Peter Howitt",https://www.reddit.com/r/Economics/comments/1o5fegr/2025_nobel_prize_in_economics_awarded_to_joel/,2025-10-13T11:49:41,"The Sveriges Riksbank Prize in Economic Sciences in Memory of Alfred Nobel 2025 was awarded ""for having explained innovation-driven economic growth"" with one half to Joel Mokyr ""for having identified the prerequisites for sustained growth through technological progress"" and the other half jointly to Philippe Aghion and Peter Howitt ""for the theory of sustained growth through creative destruction."" #### Nobel Prize Committee * [Video announcement](https://www.youtube.com/watch?v=EajZObplJ8U) *",245,36,0.97
2026-03-17 22:28:12+00:00,2026-03-17,Reddit_r/economics,"World Trade Without the US | As the US embraces tariffs, the rest of the world lowers trade barriers, signs new agreements, and reroutes around American protectionism.",https://www.reddit.com/r/Economics/comments/1rwk18v/world_trade_without_the_us_as_the_us_embraces/,2026-03-17T22:28:12,,1308,73,0.99
2026-03-17 22:00:26+00:00,2026-03-17,Reddit_r/economics,US Diesel Tops $5 a Gallon as War Disrupts Supply Chains,https://www.reddit.com/r/Economics/comments/1rwj9ry/us_diesel_tops_5_a_gallon_as_war_disrupts_supply/,2026-03-17T22:00:26,,818,41,1.0
2026-03-18 00:13:55+00:00,2026-03-18,Reddit_r/economics,How many rate cuts? Iran war upends Federal Reserve's next steps,https://www.reddit.com/r/Economics/comments/1rwmvcf/how_many_rate_cuts_iran_war_upends_federal/,2026-03-18T00:13:55,,208,16,0.99
2026-03-18 02:35:32+00:00,2026-03-18,Reddit_r/economics,BP Whiting refinery initiates lockout after failed contract negotiations with USW members,https://www.reddit.com/r/Economics/comments/1rwqbu9/bp_whiting_refinery_initiates_lockout_after/,2026-03-18T02:35:32,,99,16,0.99
2026-03-17 15:19:50+00:00,2026-03-17,Reddit_r/economics,"Iran targets UAE energy infrastructure as gas field set ablaze, tanker struck near Strait of Hormuz",https://www.reddit.com/r/Economics/comments/1rw7up0/iran_targets_uae_energy_infrastructure_as_gas/,2026-03-17T15:19:50,,634,48,1.0
2026-03-17 20:28:34+00:00,2026-03-17,Reddit_r/economics,"At the beginning of the 20th century, Argentina was one of the richest countries in the world.",https://www.reddit.com/r/Economics/comments/1rwgoim/at_the_beginning_of_the_20th_century_argentina/,2026-03-17T20:28:34,,215,14,0.98
2026-03-18 03:12:38+00:00,2026-03-18,Reddit_r/economics,New Report by Economists Reveals that India Overestimated Its Annual Economic Growth Between 2012 and 2023,https://www.reddit.com/r/Economics/comments/1rwr641/new_report_by_economists_reveals_that_india/,2026-03-18T03:12:38,,37,4,0.85
2026-03-17 18:05:19+00:00,2026-03-17,Reddit_r/economics,NIH pivots away from agency-directed science,https://www.reddit.com/r/Economics/comments/1rwchia/nih_pivots_away_from_agencydirected_science/,2026-03-17T18:05:19,,69,4,0.97
2026-03-18 02:22:09+00:00,2026-03-18,Reddit_r/economics,Strong travel demand lifts US airlines despite fuel price surge,https://www.reddit.com/r/Economics/comments/1rwq0wb/strong_travel_demand_lifts_us_airlines_despite/,2026-03-18T02:22:09,,16,3,0.82
2026-03-17 20:36:43+00:00,2026-03-17,Reddit_r/economics,The Fed issues its latest interest rate decision Wednesday. Here's what to expect,https://www.reddit.com/r/Economics/comments/1rwgwsj/the_fed_issues_its_latest_interest_rate_decision/,2026-03-17T20:36:43,,39,1,0.89
2026-03-17 21:52:22+00:00,2026-03-17,Reddit_r/economics,Tyler Cowen and Alex Tabarrok revisit Fischer Black's 1970 argument that we're moving toward a world where people hold financial assets instead of money,https://www.reddit.com/r/Economics/comments/1rwj1ox/tyler_cowen_and_alex_tabarrok_revisit_fischer/,2026-03-17T21:52:22,,29,22,0.95
2026-03-17 11:18:58+00:00,2026-03-17,Reddit_r/economics,Oil prices keep rising as Trump seeks coalition to reopen Strait of Hormuz | US-Israel war on Iran News,https://www.reddit.com/r/Economics/comments/1rw2lh6/oil_prices_keep_rising_as_trump_seeks_coalition/,2026-03-17T11:18:58,,192,12,0.98
2026-03-16 19:44:13+00:00,2026-03-16,Reddit_r/economics,"A 'Debt Spiral,' Before a Fiscal Crisis: Interest on the National Debt Will be Growing Faster Than GDP in Just 5 Years, Warns Nonpartisan Committee for a Responsible Federal Budget",https://www.reddit.com/r/Economics/comments/1rvi7jm/a_debt_spiral_before_a_fiscal_crisis_interest_on/,2026-03-16T19:44:13,,2548,180,0.98
2026-03-17 11:18:58+00:00,2026-03-17,Reddit_r/economics,The real fallout of Trump’s tariffs,https://www.reddit.com/r/Economics/comments/1rw2lhe/the_real_fallout_of_trumps_tariffs/,2026-03-17T11:18:58,,142,18,0.97
2026-03-17 04:34:48+00:00,2026-03-17,Reddit_r/economics,Amazon overtakes US Postal Service as largest parcel carrier,https://www.reddit.com/r/Economics/comments/1rvvq6k/amazon_overtakes_us_postal_service_as_largest/,2026-03-17T04:34:48,,191,10,0.93
2026-03-17 02:32:19+00:00,2026-03-17,Reddit_r/economics,"OneMain sued by US states for saddling subprime borrowers with add-ons, fees",https://www.reddit.com/r/Economics/comments/1rvt110/onemain_sued_by_us_states_for_saddling_subprime/,2026-03-17T02:32:19,,187,4,0.98
2026-03-16 18:03:57+00:00,2026-03-16,Reddit_r/economics,World's Top Aluminium Smelter Cuts Output Due to Shipping Chaos,https://www.reddit.com/r/Economics/comments/1rvfbg7/worlds_top_aluminium_smelter_cuts_output_due_to/,2026-03-16T18:03:57,,869,27,0.99
2026-03-17 17:50:14+00:00,2026-03-17,Reddit_r/economics,Europe Can Regain Its Productivity Edge by Scaling Up,https://www.reddit.com/r/Economics/comments/1rwc1sj/europe_can_regain_its_productivity_edge_by/,2026-03-17T17:50:14,,9,1,0.77
2026-03-17 13:29:51+00:00,2026-03-17,Reddit_r/economics,Bank profits down 33% in 2025 in Latvia,https://www.reddit.com/r/Economics/comments/1rw55ut/bank_profits_down_33_in_2025_in_latvia/,2026-03-17T13:29:51,,18,1,0.78
2026-03-18 02:40:09+00:00,2026-03-18,Reddit_r/economics,China’s Unemployment Rate Reaches 6-Month High but Overlooks Many: Analysts,https://www.reddit.com/r/Economics/comments/1rwqfjs/chinas_unemployment_rate_reaches_6month_high_but/,2026-03-18T02:40:09,,0,18,0.48
2026-03-17 02:45:19+00:00,2026-03-17,Reddit_r/economics,"Inside an Old Newspaper Building, Wyoming Is Stashing 2,312 Ounces of Gold",https://www.reddit.com/r/Economics/comments/1rvtbuc/inside_an_old_newspaper_building_wyoming_is/,2026-03-17T02:45:19,,76,7,0.93
2026-03-17 19:19:40+00:00,2026-03-17,Reddit_r/economics,World Population Projections by Country Income Group Between 2024 and 2100,https://www.reddit.com/r/Economics/comments/1rweo0y/world_population_projections_by_country_income/,2026-03-17T19:19:40,,5,1,0.72
2026-03-16 12:10:13+00:00,2026-03-16,Reddit_r/economics,"3,800 workers are set to strike Monday at one of the nation's largest meatpacking plants",https://www.reddit.com/r/Economics/comments/1rv6ime/3800_workers_are_set_to_strike_monday_at_one_of/,2026-03-16T12:10:13,,723,11,0.98
2026-03-17 10:56:06+00:00,2026-03-17,Reddit_r/economics,Oil Back at Center of Macro as Energy Costs Reprice,https://www.reddit.com/r/Economics/comments/1rw270p/oil_back_at_center_of_macro_as_energy_costs/,2026-03-17T10:56:06,,7,1,0.89
2026-03-16 17:44:23+00:00,2026-03-16,Reddit_r/economics,Two-Thirds of Gen Z Rely on Social Media for Financial Advice,https://www.reddit.com/r/Economics/comments/1rver2t/twothirds_of_gen_z_rely_on_social_media_for/,2026-03-16T17:44:23,,164,40,0.95
2026-03-16 15:23:49+00:00,2026-03-16,Reddit_r/economics,The US is facing the threat of stagflation. What kind of stagflation?,https://www.reddit.com/r/Economics/comments/1rvauve/the_us_is_facing_the_threat_of_stagflation_what/,2026-03-16T15:23:49,,191,14,0.98
2026-03-18 00:26:12+00:00,2026-03-18,Reddit_r/economics,Does Chinese investment in US clean energy sectors help or hurt America?,https://www.reddit.com/r/Economics/comments/1rwn7a3/does_chinese_investment_in_us_clean_energy/,2026-03-18T00:26:12,,0,11,0.4
2026-03-16 11:02:08+00:00,2026-03-16,Reddit_r/economics,How inequality caused America's affordability crisis,https://www.reddit.com/r/Economics/comments/1rv5bv7/how_inequality_caused_americas_affordability/,2026-03-16T11:02:08,,279,14,0.94
2026-03-16 18:42:08+00:00,2026-03-16,Reddit_r/economics,How Inequality Caused America’s Affordability Crisis,https://www.reddit.com/r/Economics/comments/1rvgfm5/how_inequality_caused_americas_affordability/,2026-03-16T18:42:08,,46,1,0.87
2026-03-15 22:04:26+00:00,2026-03-15,Reddit_r/economics,[The Economist] China’s hereditary elite is taking shape: The Communist Party is afraid to tax inherited wealth,https://www.reddit.com/r/Economics/comments/1ruprj1/the_economist_chinas_hereditary_elite_is_taking/,2026-03-15T22:04:26,,1773,292,0.96
2026-03-16 14:23:53+00:00,2026-03-16,Reddit_r/economics,"Easy A’s, Less Pay: The Long-Term Effects of Grade Inflation",https://www.reddit.com/r/Economics/comments/1rv9bss/easy_as_less_pay_the_longterm_effects_of_grade/,2026-03-16T14:23:53,,68,6,0.86
2026-03-15 23:29:27+00:00,2026-03-15,Reddit_r/economics,"To Address Farm Labor Shortage, Trump Administration Turns to Migrant Workers",https://www.reddit.com/r/Economics/comments/1rurx7k/to_address_farm_labor_shortage_trump/,2026-03-15T23:29:27,,806,64,0.98
2026-03-16 00:46:32+00:00,2026-03-16,Reddit_r/economics,Oil Industry Warns Trump Administration Fuel Crunch Will Likely Worsen,https://www.reddit.com/r/Economics/comments/1ruts33/oil_industry_warns_trump_administration_fuel/,2026-03-16T00:46:32,,514,46,0.99
2026-03-16 01:01:55+00:00,2026-03-16,Reddit_r/economics,Oil company shares soar to all-time highs as Middle East war turbocharges price per barrel,https://www.reddit.com/r/Economics/comments/1ruu591/oil_company_shares_soar_to_alltime_highs_as/,2026-03-16T01:01:55,,314,39,0.99
2026-03-15 14:26:36+00:00,2026-03-15,Reddit_r/economics,"To Address Farm Labor Shortage, Trump Administration Turns to Migrant Workers",https://www.reddit.com/r/Economics/comments/1rue0j7/to_address_farm_labor_shortage_trump/,2026-03-15T14:26:36,,1670,170,0.98
2026-03-16 06:58:35+00:00,2026-03-16,Reddit_r/economics,US Shale Producers Could See $63B Extra This Year Amid Rising Oil Prices,https://www.reddit.com/r/Economics/comments/1rv1ew4/us_shale_producers_could_see_63b_extra_this_year/,2026-03-16T06:58:35,,79,5,0.96
2026-03-17 14:14:37+00:00,2026-03-17,Reddit_r/economics,De-dollarisation is just fashionable debate. Every global crisis sends world back to dollar,https://www.reddit.com/r/Economics/comments/1rw6792/dedollarisation_is_just_fashionable_debate_every/,2026-03-17T14:14:37,,0,9,0.4
2026-03-16 00:36:21+00:00,2026-03-16,Reddit_r/economics,Canada's top exchange pushes to end quarterly reporting for all firms,https://www.reddit.com/r/Economics/comments/1rutjcx/canadas_top_exchange_pushes_to_end_quarterly/,2026-03-16T00:36:21,,178,35,0.97
2026-03-15 19:36:04+00:00,2026-03-15,Reddit_r/economics,Energy Secretary Says ‘No Guarantees’ Oil Prices Will Fall Soon,https://www.reddit.com/r/Economics/comments/1ruluio/energy_secretary_says_no_guarantees_oil_prices/,2026-03-15T19:36:04,,422,39,0.98
2026-03-16 06:14:53+00:00,2026-03-16,Reddit_r/economics,"Fitch Ratings has stated that major uncertainties related to US tariffs and trade policy, the sustainability of market and funding conditions, geopolitical risks and fiscal economic policy remain (in the evaluation of our current AA+ National Credit Rating)",https://www.reddit.com/r/Economics/comments/1rv0o10/fitch_ratings_has_stated_that_major_uncertainties/,2026-03-16T06:14:53,,41,6,0.93
2026-03-16 07:59:10+00:00,2026-03-16,Reddit_r/economics,Germany's IfW institute lowers economic growth forecast on high commodity prices,https://www.reddit.com/r/Economics/comments/1rv2f4l/germanys_ifw_institute_lowers_economic_growth/,2026-03-16T07:59:10,,26,2,0.91
2026-03-16 19:40:34+00:00,2026-03-16,Reddit_r/economics,Adam Smith on Today’s Global Economy,https://www.reddit.com/r/Economics/comments/1rvi3r4/adam_smith_on_todays_global_economy/,2026-03-16T19:40:34,,2,13,0.55
