date,date_only,source,title,link,published,summary,score,num_comments,upvote_ratio
2026-03-18 01:45:29+00:00,2026-03-18,Reddit_r/investing,This Cleveland triplex looks solid at first but I’m not convinced,https://www.reddit.com/r/investing/comments/1rwp63o/this_cleveland_triplex_looks_solid_at_first_but/,2026-03-18T01:45:29,"Was looking at this triplex in Cleveland and wanted to get some opinions: 1374 E 115th St , $230K , 3 units / 7 beds total Rents look something like: $900 , $1,200 , $850 (one unit vacant) So call it around $2,900/month if fully rented. At first glance it actually looks pretty decent for the price. Rough math puts it around a \~5% gross yield, which usually catches my attention. But when I started thinking about it more, I’m not sure it’s as good as it looks: Older property (1900 build) → pr",1,11,0.52
2026-03-18 01:23:54+00:00,2026-03-18,Reddit_r/investing,Thoughts on investing in energy companies,https://www.reddit.com/r/investing/comments/1rwonjc/thoughts_on_investing_in_energy_companies/,2026-03-18T01:23:54,"As AI and token generation is growing exponentially (it seems), there will be more demand for energy to supply all the data centers and compute. I imagine there will be companies that will tap into this demand. What are your thoughts on investing in the companies that are supplying this?",1,5,0.56
2026-03-16 20:42:09+00:00,2026-03-16,Reddit_r/investing,gold and commodities down? Why gold?,https://www.reddit.com/r/investing/comments/1rvjw7y/gold_and_commodities_down_why_gold/,2026-03-16T20:42:09,"I guess I dont understand the elusive mojo for gold. Gold has gone down since the Iran war started and the dollar has gone up. Commodities have gone down. Why? I see the war as harmful. SO: I can understand commodities, because the war is reducing consumption. So copper ect is down. Right? But gold? I would think: war drives up deficit=insecurity in US and buy gold. Also oil war = inflation=rising gold. I do see a correlation of the dollar increasing and gold decreasing. But why is this happe",154,97,0.88
2026-03-17 05:21:13+00:00,2026-03-17,Reddit_r/investing,"RSU vests at ATH. Sell-to-cover executes down 15%; is marked as wash sale. What is my tax liability, and how badly did I get hosed?",https://www.reddit.com/r/investing/comments/1rvwnog/rsu_vests_at_ath_selltocover_executes_down_15_is/,2026-03-17T05:21:13,"I've done a bit of research into this, but this is a challenging problem to wrap my head around. This is my second RSU vesting event. The company didn't sell-to-cover last year, and the stock price back then was super low so I didn't really worry about the taxes anyway. I got a couple thousand which is less than my OT which doesn't get withheld correctly anyway, so I'm ready for it. Otherwise, I generally have not triggered any wash sales on my other trades so I'm not well-versed in the mecha",15,31,0.64
2026-03-16 16:39:07+00:00,2026-03-16,Reddit_r/investing,Are we starting to see retail access to private markets becoming a real thing?,https://www.reddit.com/r/investing/comments/1rvcw3y/are_we_starting_to_see_retail_access_to_private/,2026-03-16T16:39:07,"Something I’ve been noticing lately is more structures that give public market investors exposure to late stage private companies. VCX lists tomorrow and it includes positions in companies like OpenAI, SpaceX, Anthropic, Databricks, and Anduril. Normally those kinds of companies are basically impossible to touch until an IPO. Not saying it changes anything immediately, but it does feel like the line between venture capital and public markets might be starting to blur a little. Curious if peop",126,48,0.88
2026-03-17 17:58:27+00:00,2026-03-17,Reddit_r/investing,Advice about Sharetracker/Bulk Transaction Input,https://www.reddit.com/r/investing/comments/1rwca7d/advice_about_sharetrackerbulk_transaction_input/,2026-03-17T17:58:27,I have no affiliation with Sharetracker and am only seeking information from those with experience of the app. Does Sharetracker allow bulk transaction input either from a broker generated CSV or JSON file or direct access to a broker website? Any opinions about the app?,0,2,0.5
2026-03-17 12:18:00+00:00,2026-03-17,Reddit_r/investing,What’s Actually Working in Crude Oil Trading Right Now?,https://www.reddit.com/r/investing/comments/1rw3owa/whats_actually_working_in_crude_oil_trading_right/,2026-03-17T12:18:00,"The crude oil market has been moving aggressively lately, and I’m trying to figure out what strategies are still effective. Are you guys finding success with trend-following, or is mean reversion working better right now? Also, do you rely more on fundamentals (like inventory reports) or pure price action?",3,8,0.61
2026-03-17 12:53:03+00:00,2026-03-17,Reddit_r/investing,How useful are weekly unemployment claims for investment decisions?,https://www.reddit.com/r/investing/comments/1rw4dhz/how_useful_are_weekly_unemployment_claims_for/,2026-03-17T12:53:03,"I’ve been trying to understand how much weight investors give to weekly unemployment claims data. From what I see, higher claims can signal a weaker economy, while lower claims may suggest stability. But since this data comes out every week and can be volatile, I’m unsure how reliable it is for actual decision-making. Do you factor this into your strategy, or focus more on longer-term indicators like inflation, earnings, and rates? Would like to understand how others here approach it.",1,4,0.57
2026-03-17 16:26:10+00:00,2026-03-17,Reddit_r/investing,eTrade Rollover IRA - ELI5,https://www.reddit.com/r/investing/comments/1rw9of3/etrade_rollover_ira_eli5/,2026-03-17T16:26:10,"Recently terminated from my job, and since I already had an etrade account, I opened a Rollover IRA to rollover my 401k from the job. Now my question is, how do I invest it at eTrade? Do I need to invest the IRA into a fund (i.e. I had the 401k in a conservative retirement fund). Wasn't sure what the next step was, if I can invest the IRA in whatever I like, or if they have target year retirement funds? Just needing some help with the next step",0,3,0.25
2026-03-18 01:01:06+00:00,2026-03-18,Reddit_r/investing,I'm getting a lot less bullish on Apple,https://www.reddit.com/r/investing/comments/1rwo3fe/im_getting_a_lot_less_bullish_on_apple/,2026-03-18T01:01:06,"I pulled this together using a prediction market aggregator that tracks stock price ranges and company-specific events, and the current setup on Apple is pretty interesting. The short version is that the market seems to be converging on **AAPL staying stuck around $250–$260 by month-end** rather than breaking out higher. A few things stood out to me: * There’s about a **61% chance Apple closes between $250 and $260** by the end of the month * The single most likely band is **$250–$255** at **",0,17,0.32
2026-03-17 18:03:27+00:00,2026-03-17,Reddit_r/investing,Need advice on my company stocks and what to do,https://www.reddit.com/r/investing/comments/1rwcfjr/need_advice_on_my_company_stocks_and_what_to_do/,2026-03-17T18:03:27,"I am working as a software engineer and got RSU (shares) as part of my CTC. But over last 2 years their value has dropped by 50% . It’s a bug tech firm and I know it won’t go busy but still I feel very uncomfortable in its value. I was hoping at time if joining that it would have risen significantly. But now a large portion of my net worth is really down. Given the market situation, should I take a large portion of it out and invest somewhere else or should I wait For context I have 50k USD s",0,15,0.22
2026-03-17 19:36:31+00:00,2026-03-17,Reddit_r/investing,Why Inflation is Underestimated,https://www.reddit.com/r/investing/comments/1rwf5og/why_inflation_is_underestimated/,2026-03-17T19:36:31,"Inflation has been averaging close to 3% for the past couple of decades which is 50% higher than the federal reserve’s 2% targeted goal. In my opinion the real inflation rate could be double what the reported inflation rate is, so it could have been averaging closer to 6% annually. This is partly why asset prices have done so well in the past couple decades. The reason for this is because the way inflation is calculated doesn’t give a real picture in most people’s lives. They simply remove so",0,64,0.41
2026-03-17 05:55:27+00:00,2026-03-17,Reddit_r/investing,enterprise tax package questions,https://www.reddit.com/r/investing/comments/1rvxaye/enterprise_tax_package_questions/,2026-03-17T05:55:27,"so earlier today one of my investments enterprise products (epd) sent me a tax package that includes a k-1 form (no idea what that is) and says i also have to go to the website to get something called a k-3. im not sure what either of those are as ive never gotten this b4 so if someone could explain what i have to do that'd be great. do i just file it with the rest of my taxes? also, if i have the k-1 do i acutally need to get the k-3 from the website? my dad usually helps with my taxes so id li",0,3,0.4
2026-03-17 02:02:46+00:00,2026-03-17,Reddit_r/investing,Thoughts on the GOOP ETF?,https://www.reddit.com/r/investing/comments/1rvscaz/thoughts_on_the_goop_etf/,2026-03-17T02:02:46,"No, not the Gwyneth Paltrow garbage, the ETF . I have read the profile of it half a dozen times and still can't figure out what the heck it is other than it is tangentially related to Google and has a dividend of 12%. Does anyone know more? Any help is appreciated, lorem ipsum yadda blah etc 250 character limit",2,10,0.56
2026-03-16 20:24:39+00:00,2026-03-16,Reddit_r/investing,Hypothetical - how to position investments for a global debt crisis?,https://www.reddit.com/r/investing/comments/1rvje76/hypothetical_how_to_position_investments_for_a/,2026-03-16T20:24:39,"Hypothetical because I'm mostly a passive index investor and will likely continue doing what I do either way. But I'm curious what opportunities, or simply safe havens, investors are considering during a sudden global unwinding of the insane levels of personal, private, institutional, and government debt. How would you want to allocate pre-crisis and then how would you deploy? What do you want to be in and what do you NOT want to have exposure to?",4,18,0.61
2026-03-15 19:58:17+00:00,2026-03-15,Reddit_r/investing,Are markets being too complacent about the Iran war?,https://www.reddit.com/r/investing/comments/1rumfhs/are_markets_being_too_complacent_about_the_iran/,2026-03-15T19:58:17,"*In fact, this is the case across several big strains in financial markets today. “In geopolitics, this is not the 1970s,” said Anton Eser, chief investment officer at Dutch asset manager Robeco. “In AI, this is not the dotcom boom. In private credit, this is not 2008.” He’s right. But we do have, he said, “a bit of each . . . That’s still not great.”* A senior bond trader in London admitted something unusual to me the other day: he’s scared. It takes a lot to spook really seasoned bankers who",447,191,0.9
2026-03-15 20:13:35+00:00,2026-03-15,Reddit_r/investing,Dumping Unprofitable Startups onto Pensions at Inflated Valuations (SpaceX/OpenAI),https://www.reddit.com/r/investing/comments/1rumu62/dumping_unprofitable_startups_onto_pensions_at/,2026-03-15T20:13:35,"Dumping on Index Investors Both SpaceX and OpenAI are pushing Nasdaq and S&amp;P and Russel/FTSE index providers to waive their listing requirements (including free float market cap, and seasoning) for an expedited listing on all indices. This would mean that instead of allowing several months/a year for 'seasoning' where price discovery takes place and the stock post-IPO finds a fair pricing, index investors would instead be forced to automatically buy these megacap stocks right at IPO with al",419,93,0.95
2026-03-17 07:52:27+00:00,2026-03-17,Reddit_r/investing,What’s your daily and weekly routine?,https://www.reddit.com/r/investing/comments/1rvzbf0/whats_your_daily_and_weekly_routine/,2026-03-17T07:52:27,"Hi. I’m CANSLIM trader. I’d like to know your daily and weekly routine. My daily routine is to check the market, review my watchlist and buy list that I screened over the weekend, and go through charts and news for the stocks in my portfolio. On weekends, I run screenings to find new candidates. Since I just started and I’m using free tools, I use Finviz to screen for stocks with over 20% year-over-year revenue growth, over 20% EPS growth, and over 17% ROE. If I tighten the criteria further",0,5,0.43
2026-03-17 12:07:27+00:00,2026-03-17,Reddit_r/investing,Are AI portfolio assistants actually useful yet or still mostly marketing?,https://www.reddit.com/r/investing/comments/1rw3hii/are_ai_portfolio_assistants_actually_useful_yet/,2026-03-17T12:07:27,"Over the past year I’ve noticed more investment platforms launching AI assistants that analyze your portfolio and provide insights about diversification, risk exposure, and market events. On paper it sounds useful. If an AI can quickly identify things like sector concentration or overlapping holdings, that could save a lot of time compared to manually reviewing allocations. At the same time, I’m skeptical about how much value these tools actually provide once you understand the basics of portfo",0,9,0.23
2026-03-17 14:03:26+00:00,2026-03-17,Reddit_r/investing,I want to invest 100k up to 1 million USD into these. I want both growth and dividend (monthly income) what do you guys think?,https://www.reddit.com/r/investing/comments/1rw5xer/i_want_to_invest_100k_up_to_1_million_usd_into/,2026-03-17T14:03:26,"These are the ones that stood out to me from my research As I don’t want only growth and only dividend but a mix of both so I get the best of both worlds. I do want a monthly income though. I have looked into Irish equivalents of these because of the 15% withholding tax as opposed to 30% GPIX, JEPG.L, XYLP.L, IDVO, JEPQ.L",0,8,0.33
2026-03-17 00:33:27+00:00,2026-03-17,Reddit_r/investing,Regular Vanguard S&amp;P 500 vs Paris-Aligned S&amp;P 500 ETF?,https://www.reddit.com/r/investing/comments/1rvq7ed/regular_vanguard_sp_500_vs_parisaligned_sp_500_etf/,2026-03-17T00:33:27,"If you had to choose between a plain S&amp;P 500 ETF and a Paris-Aligned Climate S&amp;P 500 ETF for long-term investing, which would you pick and why? I’m trying to balance returns with being at least somewhat ethical, and I’m wondering if the climate-screened version is worth it or if the regular S&amp;P 500 is just the smarter move. I’m not asking which one is “morally perfect.” I’m more trying to understand: - Whether the Paris-Aligned version is meaningfully worse for returns over time",1,4,0.53
2026-03-15 19:18:15+00:00,2026-03-15,Reddit_r/investing,Salesforce generates more free cash flow than ServiceNow and Workday combined. So why does it trade at one-third of their valuation?,https://www.reddit.com/r/investing/comments/1ruldl4/salesforce_generates_more_free_cash_flow_than/,2026-03-15T19:18:15,I have been trying to understand why this stock is down 28% while the business looks like this. $14.4 billion in free cash flow. $72 billion in contracted future revenue. An AI product that went from zero to $800 million ARR in 18 months. The CEO just raised $25 billion in debt specifically to buy back 26% of the company at current prices. And yet it trades at 13x free cash flow. ServiceNow is at 38x. Microsoft at 36x. Workday at 25x. Salesforce generates more free cash flow than ServiceNow an,194,61,0.91
2026-03-16 22:06:46+00:00,2026-03-16,Reddit_r/investing,"Moving USCRX to SCHD, but cannot decide",https://www.reddit.com/r/investing/comments/1rvma1d/moving_uscrx_to_schd_but_cannot_decide/,2026-03-16T22:06:46,"I want to move my IRA (USCRX) because of its high expense ratio, and becase I don't think it's performing that well. But more I look more I get confused and cannot decide. Currently, I am thinking SCHD. Will it be safer option or am I missing something?",1,4,0.6
2026-03-15 13:32:05+00:00,2026-03-15,Reddit_r/investing,Does anyone else feel like stagflation risk is creeping back?,https://www.reddit.com/r/investing/comments/1rucv3f/does_anyone_else_feel_like_stagflation_risk_is/,2026-03-15T13:32:05,"It kind of feels like the market isn’t really afraid of just one thing right now, It’s more the combination of inflation staying high while growth starts slowing down. That’s usually the kind of environment that makes investors uneasy because it puts central banks in a tough spot. Curious if others are seeing the same thing, or if this is just macro noise.",240,212,0.84
2026-03-16 18:54:03+00:00,2026-03-16,Reddit_r/investing,Is the current geopolitical tension around oil creating value opportunities?,https://www.reddit.com/r/investing/comments/1rvgrvi/is_the_current_geopolitical_tension_around_oil/,2026-03-16T18:54:03,"I don’t usually post long threads here, but the recent developments around the Strait of Hormuz and oil supply risks made me start thinking about something from a value investing perspective. A lot of discussion in trading communities right now is focused on **short-term oil price spikes**, but I’m more curious about whether this situation could create **longer-term mispricing in certain sectors**. For context, roughly **14 million barrels of oil pass through the Strait of Hormuz every day**,",0,15,0.46
2026-03-15 21:09:42+00:00,2026-03-15,Reddit_r/investing,Investing in SP500 when new additions come in,https://www.reddit.com/r/investing/comments/1ruoavg/investing_in_sp500_when_new_additions_come_in/,2026-03-15T21:09:42,"So I do invest in SP500 though I like talking about individual stocks. But I look at the news and I see that SpaceX, OpenAI, Anthropic and other companies are expected to join soon. My worry is they will have PE more in line with Tesla or Palantir, and be very overvalued. So what are you planning on doing? Continue investing in SP500 and let them sort it out, or change your portfolio to equal weight or midcaps or something else?",47,45,0.87
2026-03-15 15:10:10+00:00,2026-03-15,Reddit_r/investing,"J.P. Morgan, 1 day before the war started: ""we do not anticipate protracted oil supply disruptions""",https://www.reddit.com/r/investing/comments/1ruf0n6/jp_morgan_1_day_before_the_war_started_we_do_not/,2026-03-15T15:10:10,"[https://www.jpmorgan.com/insights/global-research/commodities/oil-prices](https://www.jpmorgan.com/insights/global-research/commodities/oil-prices) Probably the worst prediction of 2026 so far Article posted on 27th of February (1 day before the war started): &gt;**Oil price forecast: A bearish outlook for Brent in 2026** \[...\] &gt;Despite a recent spike in oil prices, J.P. Morgan Global Research expects to see Brent crude averaging around $60/bbl in 2026. \[...\] &gt;More recently, ma",137,44,0.85
2026-03-17 02:01:39+00:00,2026-03-17,Reddit_r/investing,Alternatives to receiving a K1?,https://www.reddit.com/r/investing/comments/1rvsbez/alternatives_to_receiving_a_k1/,2026-03-17T02:01:39,Considering buying a 1% stake in a local small business and would receive a K1 with my share of the LLC’s annual profit/loss. I don’t have anything I could write off the losses against and obviously would prefer not to have to report the income. Is there another way I could structure this investment so that I don’t receive a K1? Maybe the deal could be structured in a way that I only report gains on investor distributions or upon liquidation/exit?,0,7,0.22
2026-03-17 06:24:42+00:00,2026-03-17,Reddit_r/investing,Earning well at 26 but still not managing money properly - where do I start?,https://www.reddit.com/r/investing/comments/1rvxu0x/earning_well_at_26_but_still_not_managing_money/,2026-03-17T06:24:42,"I’m 26 and earning around ₹1.7L/month, but I haven’t really built any solid savings or investments yet. Most of my income goes into regular expenses and a bit of travel, so nothing much is left at the end. Now I feel like I should get more serious about my finances. Not sure if I should start SIPs directly or first build an emergency fund. How would you approach this if you were in my place?",0,14,0.22
2026-03-17 01:02:33+00:00,2026-03-17,Reddit_r/investing,Bad advice coming from family,https://www.reddit.com/r/investing/comments/1rvqx3k/bad_advice_coming_from_family/,2026-03-17T01:02:33,"I work in public accounting on the audit side, but during my time of also studying for the CPA exams I have learned and researched tax laws and implications of such laws. I just found out from my mom, that her sister, who is about 64 is going to eventually sell their home while currently building one. well apparently the 1st payment is coming up on the build and it’s going to be close to $60k, and she told my mom that “she will just draw from her 401k because the stock market isn’t doing so hot",0,18,0.44
2026-03-15 20:45:54+00:00,2026-03-15,Reddit_r/investing,The Year of IPOs. A Deep Dive.,https://www.reddit.com/r/investing/comments/1runodp/the_year_of_ipos_a_deep_dive/,2026-03-15T20:45:54,"Hey Guys :) With multiple record breaking IPOs happening this year, I thought I would take a few hours to publish a piece about IPOs. In the end, it took me dozens of hours to research, write and edit. I would greatly appreciate if you guys read and give thoughts, sorry about the lack of pictures and graphs, and a bunch of footnotes are missing as it is originally written for Substack. Think it has some valuable content about whether this years IPOs are a good potential investment! Thank y",25,22,0.76
2026-03-15 02:48:27+00:00,2026-03-15,Reddit_r/investing,"Why the SpaceX IPO should be concerning to passive investors tracking the NASDAQ-100 index, and other indexes",https://www.reddit.com/r/investing/comments/1ru1gw4/why_the_spacex_ipo_should_be_concerning_to/,2026-03-15T02:48:27,"SpaceX (which has acquired xAI, which itself has acquired X) is looking to list on the NASDAQ. aiming for a valuation of around $1.75 trillion. However, SpaceX is insisting that NASDAQ changes its rules for inclusion in the NASDAQ-100 index, as a condition for listing. The NASDAQ-100 rule changes would, effectively, allow SpaceX to very quickly get included on the NASDAQ-100, which then forces any index fund tracking the NASDAQ-100 to buy SpaceX stocks based on SpaceX's market capitalisation.",596,160,0.92
2026-03-16 20:52:58+00:00,2026-03-16,Reddit_r/investing,Any other companies like MSTR?,https://www.reddit.com/r/investing/comments/1rvk7bf/any_other_companies_like_mstr/,2026-03-16T20:52:58,"I’m trying to find companies that own assets that are valued higher than their current market cap. For example, MSTR owns 761,068 BTC which is valued today at $56 billion but their market cap is only $49 billion. Any other examples of companies that own more stuff than what the whole company is worth?",0,6,0.29
2026-03-16 19:32:48+00:00,2026-03-16,Reddit_r/investing,Been investing for 2 years and finally think I am ready to start opening positions in indivisible stocks,https://www.reddit.com/r/investing/comments/1rvhvrr/been_investing_for_2_years_and_finally_think_i_am/,2026-03-16T19:32:48,"I’m 27, for the last 2 years I’ve been 100% indexes, I’m starting to think I’m doing myself a bit of a disservice for not taking a bit more risk, I think with this market pull back maybe is a good time to get into individual stocks in my ROTH IRA. I’m mainly looking at the high quality companies that are going at a discount rn like googl, msft amzn etc. What’s your thoughts on rddt? I’ve followed the stock for a while seems to be undervalued Edit: pls excuse spelling error in title smh",0,36,0.42
2026-03-16 22:38:23+00:00,2026-03-16,Reddit_r/investing,How Are People Getting Exposure to Greenland Minerals Right Now?,https://www.reddit.com/r/investing/comments/1rvn57t/how_are_people_getting_exposure_to_greenland/,2026-03-16T22:38:23,been reading a lot about the push into greenland recently and wondering if anyone has found a good way to actually invest in it. between the tariffs on russian palladium and all the talk about arctic resources i feel like there has to be some kind of play here but i cant figure out where most of the greenland mining stuff seems to be either private or listed on exchanges i dont really use. is there anything on nasdaq or nyse that gives exposure to greenland specifically? or am i stuck looking a,0,3,0.22
2026-03-16 18:45:50+00:00,2026-03-16,Reddit_r/investing,"33 years old, $50 every week into SWPPX. Mutual fund Bad idea?",https://www.reddit.com/r/investing/comments/1rvgjia/33_years_old_50_every_week_into_swppx_mutual_fund/,2026-03-16T18:45:50,"“Mutual funds are open-ended, which means the fund company creates or cancels shares based on investor demand. The challenge is capital gains distributions. In a high-turnover mutual fund, or one that realizes gains and losses throughout the year, investors can receive a capital gains tax bill even if they never sold their own shares.” I use Charles Schwab and started “auto investing” this week into schwabs s&amp;p 500 fund of SWPPX. And want to keep it going but read the info above. This is a",0,14,0.22
2026-03-16 09:00:48+00:00,2026-03-16,Reddit_r/investing,"Daily General Discussion and Advice Thread - March 16, 2026",https://www.reddit.com/r/investing/comments/1rv3e3v/daily_general_discussion_and_advice_thread_march/,2026-03-16T09:00:48,Have a general question? Want to offer some commentary on markets? Maybe you would just like to throw out a neat fact that doesn't warrant a self post? Feel free to post here! Please consider consulting our FAQ first - [https://www.reddit.com/r/investing/wiki/faq](https://www.reddit.com/r/investing/wiki/faq) And our [side bar](https://www.reddit.com/r/investing/about/sidebar) also has useful resources. If you are new to investing - please refer to Wiki - [Getting Started](https://www.reddit.co,1,15,0.6
