source,title,link,published,summary,date,date_only
ForexLive,Australian bank analysts are piling on to forecast an RBA rate hike next week,https://investinglive.com/centralbank/australian-bank-analysts-are-piling-on-to-forecast-an-rba-rate-hike-next-week-20260311/,"Wed, 11 Mar 2026 01:54:06 GMT","Hauser’s hawkish inflation warnings have pushed markets toward expecting a possible RBA rate hike as soon as the March meeting.RBA policymaker Hauser says oil price and Middle East volatility is a ""genuine challenge""ICYMI: RBA’s Hauser warns oil price risks could intensify rate rise debate (March 17 live)Summary:RBA Deputy Governor Andrew Hauser warned oil price shocks pose upside risks to inflation amid uncertainty tied to the Iran conflict.He said there will be “genuine policy debate” at the next RBA board meeting, with arguments on both sides.Market pricing now implies roughly a 70% chance of a rate hike at the March 17 meeting.Westpac, NAB, Citi and Deutsche Bank now expect hikes in March and May.Bank of America, UBS and Capital Economics also forecast a hike at next week’s meeting.Reserve Bank of Australia Deputy Governor Andrew Hauser’s latest remarks have sharpened expectations that the central bank’s upcoming policy meeting could be more consequential than previously assumed, with markets now increasingly pricing in the possibility of a near-term rate hike.Speaking on Tuesday, Hauser highlighted the inflation risks stemming from surging oil prices tied to geopolitical tensions involving Iran, while emphasising that the central bank’s response will depend on how persistent the shock proves to be.“Our response depends on the size and persistence of the price shock,” he said, noting that the outlook remains uncertain given rapidly evolving geopolitical developments.Despite that uncertainty, Hauser’s tone underscored the RBA’s continued focus on preventing inflation expectations from becoming unanchored. He warned that failing to act decisively if inflation proves persistent would risk repeating the damaging experience of the recent inflation surge.“If we fail to act decisively enough to prevent inflation staying high or even rising and expectations of inflation disanchor… it will be bad for everyone,” he said, describing inflation as “toxic” for the economy.Hauser also pointed to signs that Australia’s economy is operating close to its limits, noting that recent data has reinforced the view that spare capacity in the economy is limited. Annual GDP growth of 2.6% exceeds the RBA’s estimate of roughly 2% sustainable growth, suggesting demand may still be running ahead of the economy’s underlying capacity.While he acknowledged some areas of the economy have been softer — particularly household consumption — Hauser said the broader economic picture remains solid.“The Australian economy in many ways is in good shape,” he said.The remarks have triggered a noticeable shift in market expectations around the RBA’s next move. Interest-rate markets now imply roughly a 70% probability of a rate hike at the March 17 policy meeting, compared with far lower odds before Hauser’s comments.Several major banks have also adjusted their forecasts. Westpac, National Australia Bank, Citi and Deutsche Bank now expect the RBA to deliver rate hikes in both March and May. Meanwhile, Bank of America, UBS and Capital Economics have recently moved to predict a rate increase at next week’s meeting.Before the latest developments, many analysts had expected the RBA to remain on hold in March, partly because policymakers had emphasised the importance of monitoring further inflation data before adjusting policy.However, the sharp rise in global oil prices linked to the Middle East conflict has complicated that outlook. Higher energy costs pose a clear upside risk to inflation, though Hauser noted that Australia’s status as a net energy exporter could provide some offsetting support to economic activity through stronger export demand.With the RBA’s next decision approaching, policymakers now appear to face a delicate balancing act between managing geopolitical inflation risks and ensuring monetary policy remains appropriately calibrated to domestic economic conditions.This article was written by Eamonn Sheridan at investinglive.com.",2026-03-11 01:54:06+00:00,2026-03-11
ForexLive,Weak yen and oil shock cloud Japan inflation outlook -- PPI recap,https://investinglive.com/news/weak-yen-and-oil-shock-cloud-japan-inflation-outlook-ppi-recap-20260311/,"Wed, 11 Mar 2026 01:30:13 GMT","Japan’s wholesale inflation cooled in February but rising oil prices from the Iran conflict threaten to push price pressures higher again.Summary:Japan’s corporate goods price index (CGPI) rose 2.0% y/y in February, below the 2.1% forecast.Wholesale inflation slowed from January’s 2.3% rise, marking a third straight month of easing.Government fuel subsidies helped offset rising commodity costs, cushioning price pressures.Import prices jumped 2.8% y/y, the fastest pace since July 2024, reflecting a weaker yen.Economists warn the Middle East oil shock could soon push wholesale inflation higher again.Japan’s wholesale inflation slowed for a third consecutive month in February as government fuel subsidies helped cushion companies from rising commodity costs, though economists warn the respite could prove temporary amid surging oil prices linked to Middle East tensions.Data released Wednesday showed the corporate goods price index (CGPI), which measures the prices companies charge one another for goods and services, rose 2.0% from a year earlier, slowing from 2.3% in January and coming in slightly below the 2.1% median forecast.The moderation in wholesale inflation suggests that government policies aimed at stabilising energy costs have helped dampen some of the impact from higher global commodity prices.However, the figures largely pre-date the escalation of conflict involving Iran that began on February 28, meaning the data do not fully capture the inflationary effects of the latest surge in oil prices.A Bank of Japan official noted that even before the latest geopolitical developments, price pressures were building in some areas, including a rise in nonferrous metal prices driven by geopolitical risk.At the same time, Japan’s yen-based import price index rose 2.8% in February from a year earlier, accelerating from a revised 0.7% increase in January and marking the strongest gain since July 2024. The rise reflects the continued weakness of the yen, which increases the cost of imported goods and raw materials.Economists say volatile energy markets could soon feed through to domestic prices with a lag.“Wholesale inflation is likely to re-accelerate as surging crude oil prices from the Middle East conflict push up fuel costs,” said Masato Koike, senior economist at Sompo Institute Plus. He added that the weak yen will also keep import costs elevated said Reuters.However, Koike said such price increases would largely reflect cost-push inflation, which may complicate the Bank of Japan’s policy decisions.“At least in the short run, it could serve as a hurdle for additional rate hikes by the BOJ, which focuses more on trend inflation,” he said.The data underscore the difficult balancing act facing the BOJ. The central bank ended more than a decade of ultra-loose policy in 2024 and has gradually raised interest rates since then, including a move in December that lifted the policy rate to 0.75%, the highest level in roughly 30 years.Governor Kazuo Ueda has signalled that the BOJ is prepared to tighten policy further if inflation stabilises around its 2% target, supported by stronger wage growth and domestic demand.But rising oil prices tied to geopolitical tensions risk creating a complicated mix of slower growth and higher costs, leaving policymakers weighing whether inflation pressures reflect durable demand or temporary external shocks.---Earlier:ICYMI: Debate grows over political influence on Bank of Japan policyBoJ meet next week:This article was written by Eamonn Sheridan at investinglive.com.",2026-03-11 01:30:13+00:00,2026-03-11
ForexLive,PBOC sets USD/ CNY central rate at 6.8917 (vs. estimate at 6.8824),https://investinglive.com/centralbank/pboc-sets-usd-cny-central-rate-at-68917-vs-estimate-at-68824-20260311/,"Wed, 11 Mar 2026 01:15:21 GMT","The PBOC allows the yuan to fluctuate within a +/- 2% range, around this reference rate.more to comeThis article was written by Eamonn Sheridan at investinglive.com.",2026-03-11 01:15:21+00:00,2026-03-11
FXStreet_News,Gold: Recovery builds with easing Dollar – OCBC,https://www.fxstreet.com/news/gold-recovery-builds-with-easing-dollar-ocbc-202603111215,"Wed, 11 Mar 2026 12:15:10 Z",OCBC strategists Christopher Wong and Sim Moh Siong highlight that Gold has extended its recovery as the Dollar and Oil prices retreat and risk sentiment stabilises on signs the Iran conflict may be nearing an end.,,
FXStreet_News,Oil: Reserve release and conflict-driven supply risks – MUFG,https://www.fxstreet.com/news/oil-reserve-release-and-conflict-driven-supply-risks-mufg-202603111204,"Wed, 11 Mar 2026 12:04:29 Z","MUFG’s Head of Research Derek Halpenny reports that the IEA has proposed a record Oil reserve release of 300–400 million barrels, potentially covering 15–20 days of Strait of Hormuz flows and easing supply constraints for several weeks.",,
FXStreet_News,"Gold stalls below $5,200 as markets brace for US inflation data",https://www.fxstreet.com/news/gold-stalls-below-5-200-as-markets-brace-for-us-inflation-data-202603111159,"Wed, 11 Mar 2026 11:59:04 Z","Gold (XAU/USD) trades with a mild downside bias on Wednesday, failing to build on the previous day’s gains as the US Dollar (USD) rebounds and Treasury yields edge higher ahead of the US inflation data at 12:30 GMT.",,
FXStreet_News,Euro area: Iran conflict may force ECB to act – Nomura,https://www.fxstreet.com/news/euro-area-iran-conflict-may-force-ecb-to-act-nomura-202603111155,"Wed, 11 Mar 2026 11:55:48 Z","Nomura’s Global Markets Research team revises its Euro area HICP projections higher on updated Oil and gas assumptions. The bank now sees HICP at 2.7% in 2026 and 2.2% in 2027, with inflation above target in early 2026.",,
FXStreet_News,US CPI set to hold steady in February as Oil price volatility clouds inflation outlook,https://www.fxstreet.com/news/us-cpi-data-seen-steady-in-february-as-markets-assess-fed-policy-outlook-202603110400,"Wed, 11 Mar 2026 11:45:00 Z","The US Bureau of Labor Statistics (BLS) will publish the February Consumer Price Index (CPI) data on Wednesday. The report is expected to show a stabilization in inflation, still above the Federal Reserve’s (Fed) 2% target.",,
FXStreet_News,EUR/USD: Capped by 200dma before US CPI – Societe Generale,https://www.fxstreet.com/news/eur-usd-capped-by-200dma-before-us-cpi-societe-generale-202603111139,"Wed, 11 Mar 2026 11:39:51 Z","Societe Generale analysts describe EUR/USD as quiet within its recent range, with spot capped by the 200‑day moving average at 1.1676 ahead of US CPI. They flag support at 1.1560 and resistance at 1.1735, alongside sizeable nearby option expiries.",,
FXStreet_News,US: CPI focus and rates reaction – TD Securities,https://www.fxstreet.com/news/us-cpi-focus-and-rates-reaction-td-securities-202603111123,"Wed, 11 Mar 2026 11:23:48 Z","TD Securities’ Global Strategy Team highlights that recent geopolitical tensions and a weaker 3-year auction pushed US rates higher, with attention now turning to February CPI.",,
FXStreet_News,USD: Mixed oil signals limit downside – ING,https://www.fxstreet.com/news/usd-mixed-oil-signals-limit-downside-ing-202603111115,"Wed, 11 Mar 2026 11:15:17 Z","ING’s Francesco Pesole notes the Dollar remains closely tied to Oil volatility, with recent Brent swings driven by conflicting headlines on Middle East tensions and a potential record IEA reserve release.",,
FXStreet_News,Oil: Shipping risks and IEA supply plans – BBH,https://www.fxstreet.com/news/oil-shipping-risks-and-iea-supply-plans-bbh-202603111110,"Wed, 11 Mar 2026 11:10:55 Z",Brown Brothers Harriman’s (BBH) Elias Haddad notes that crude Oil prices are firmer as markets focus on security of shipping through the Strait of Hormuz.,,
FXStreet_News,"Japan, Germany release Oil reserves ahead of IEA decision, WTI drops",https://www.fxstreet.com/news/japan-germany-release-oil-reserves-ahead-of-iea-decision-wti-drops-202603111109,"Wed, 11 Mar 2026 11:09:53 Z","According to Reuters, the International Energy Agency (IEA) is set to announce a recommendation regarding the potential release of emergency Oil reserves at 13:00 GMT. The move comes as governments seek to ease pressure on energy markets and contain rising fuel costs.",,
FXStreet_News,US: Markets likely to look through CPI data – BBH,https://www.fxstreet.com/news/us-markets-likely-to-look-through-cpi-data-bbh-202603111101,"Wed, 11 Mar 2026 11:01:18 Z","Brown Brothers Harriman’s (BBH) Elias Haddad notes that US February CPI is due, with headline and core expected to remain at 2.4% and 2.5% year-on-year, while super core services stays stuck at 2.7%.",,
FXStreet_News,"WTI Oil gains on Middle East turmoil while G7, IEA weigh strategic reserve measures",https://www.fxstreet.com/news/wti-oil-gains-on-middle-east-turmoil-while-g7-iea-weigh-strategic-reserve-measures-202603111034,"Wed, 11 Mar 2026 10:34:31 Z","West Texas Intermediate (WTI) US Oil trades around $86.30 on Wednesday at the time of writing, up 1.20% on the day as markets remain focused on escalating geopolitical tensions in the Middle East and potential policy responses aimed at stabilizing global energy supply.",,
FXStreet_News,GBP: Yield support and resilience versus energy shock – MUFG,https://www.fxstreet.com/news/gbp-yield-support-and-resilience-versus-energy-shock-mufg-202603110958,"Wed, 11 Mar 2026 09:58:15 Z","MUFG’s Head of Research Derek Halpenny highlights that the Pound is currently the third best performing G10 currency since the conflict began, supported by a sharp 35 bps jump in UK 2-year yields and reduced BoE rate-cut pricing.",,
FXStreet_News,US CPI: Energy shock complicates Fed path – Deutsche Bank,https://www.fxstreet.com/news/us-cpi-energy-shock-complicates-fed-path-deutsche-bank-202603110950,"Wed, 11 Mar 2026 09:50:23 Z","Deutsche Bank’s US economists flag February CPI as a key release for Federal Reserve expectations after the recent Oil shock delayed rate-cut pricing. They anticipate tariff-related strength in core goods and higher energy costs lifting headline inflation, while core CPI is seen steady.",,
FXStreet_News,ECB: Oil shock and hawkish signals shape hike bets – Nomura,https://www.fxstreet.com/news/ecb-oil-shock-and-hawkish-signals-shape-hike-bets-nomura-202603110945,"Wed, 11 Mar 2026 09:45:14 Z","Nomura’s Senior European Economist Andrzej Szczepaniak notes that traders have increased pricing for European Central Bank rate hikes after hawkish comments from ECB members Kazimir, Kazaks.",,
FXStreet_News,SEK: Riksbank to watch risks before easing – Commerzbank,https://www.fxstreet.com/news/sek-riksbank-to-watch-risks-before-easing-commerzbank-202603110932,"Wed, 11 Mar 2026 09:32:22 Z",Commerzbank’s Antje Praefcke expects Swedish inflation to stay below target and sees little chance of a near-term Riksbank cut.,,
FXStreet_News,"Silver price today: Silver falls, according to FXStreet data",https://www.fxstreet.com/news/silver-price-today-silver-falls-according-to-fxstreet-data-202603110930,"Wed, 11 Mar 2026 09:30:09 Z","Silver prices (XAG/USD) fell on Wednesday, according to FXStreet data. Silver trades at $86.96 per troy ounce, down 0.25% from the $87.18 it cost on Tuesday.",,
FXStreet_News,USD/INR steadies as Indian Rupee pressure offsets improved sentiment,https://www.fxstreet.com/news/indian-rupee-steadies-amid-lower-oil-prices-202603110431,"Wed, 11 Mar 2026 09:27:02 Z","USD/INR moves little as the Indian Rupee (INR) pressure from hedging demand and foreign outflows offsets improved sentiment, boosted by easing oil prices. Oil prices decline after reports that the International Energy Agency (IEA) may release record oil reserves to stabilize markets.",,
FXStreet_News,AUD/USD: Bullish breakout targets higher levels – Societe Generale,https://www.fxstreet.com/news/aud-usd-bullish-breakout-targets-higher-levels-societe-generale-202603110913,"Wed, 11 Mar 2026 09:13:17 Z","Societe Generale analysts highlight that AUD/USD has broken out of consolidation and is in a steady uptrend, supported by its 50‑DMA. The bank notes bullish momentum with a potential return towards 0.72 and upside targets at 0.7220/0.7250 and 0.7400.",,
FXStreet_News,EUR/USD: Hawkish ECB talk meets Oil risk – ING,https://www.fxstreet.com/news/eur-usd-hawkish-ecb-talk-meets-oil-risk-ing-202603110906,"Wed, 11 Mar 2026 09:06:38 Z","ING’s Francesco Pesole highlights that hawkish comments from ECB officials, including President Lagarde and Peter Kazimir, have reinforced market pricing for a rate hike within six months, though ING still sees this as a lower-probability scenario.",,
FXStreet_News,Silver Price Forecast: XAG/USD hovers around $87.00 as sentiment improves,https://www.fxstreet.com/news/silver-price-forecast-xag-usd-hovers-around-8700-as-sentiment-improves-202603110906,"Wed, 11 Mar 2026 09:06:30 Z","Silver price (XAG/USD) remains flat after experiencing modest volatility, trading around $87.20 per troy ounce during the European hours on Wednesday. The safe-haven Silver may lose ground amid optimism that the Middle East conflict may have a smaller impact on inflation than initially feared.",,
FXStreet_News,US: CPI and limited Fed tools – UBS,https://www.fxstreet.com/news/us-cpi-and-limited-fed-tools-ubs-202603110856,"Wed, 11 Mar 2026 08:56:22 Z",UBS Chief Economist Paul Donovan notes that US February CPI data predates recent market volatility but remains important for Federal Reserve policy. He expects underlying inflation pressures to be benign and argues central banks should only react to broad price increases.,,
FXStreet_News,Brent: Volatile slide after conflict headlines – Deutsche Bank,https://www.fxstreet.com/news/brent-volatile-slide-after-conflict-headlines-deutsche-bank-202603110846,"Wed, 11 Mar 2026 08:46:32 Z","Deutsche Bank analysts describe a sharp reversal in Brent Oil as optimism over Iran-related supply risks grows. They highlight an -11% one-day drop in Brent, further weakness overnight, and swings driven by Saudi Aramco pipeline news, US political statements, and potential IEA reserve releases.",,
FXStreet_News,"Gold weakens further below $5,200, refreshes daily low as traders await US CPI",https://www.fxstreet.com/news/gold-holds-above-5-200-as-middle-east-tensions-and-weak-usd-support-ahead-of-us-cpi-202603110422,"Wed, 11 Mar 2026 08:44:48 Z","Gold (XAU/USD) extends its steady intraday descent below the $5,200 mark and touches a fresh daily low during the first half of the European session on Wednesday. The US Dollar (USD) attracts some dip-buyers and looks to build on the overnight bounce from a one-week low, undermining the commodity.",,
FXStreet_News,USD: Inflation focus and energy shock scenarios – MUFG,https://www.fxstreet.com/news/usd-inflation-focus-and-energy-shock-scenarios-mufg-202603110841,"Wed, 11 Mar 2026 08:41:00 Z","MUFG’s Head of Research Derek Halpenny notes that the proposed IEA-coordinated Oil reserve release could temporarily offset supply disruption in the Strait of Hormuz, but markets are shifting focus to US inflation.",,
FXStreet_News,Japanese Yen struggles as BoJ policy outlook remains uncertain,https://www.fxstreet.com/news/japanese-yen-holds-losses-due-to-uncertainty-surrounding-boj-policy-outlook-202603110834,"Wed, 11 Mar 2026 08:34:50 Z","USD/JPY gains ground for the second successive session, trading around 158.30 during the European hours on Wednesday. The pair appreciates as the Japanese Yen (JPY) struggles due to uncertainty surrounding the Bank of Japan (BoJ) policy outlook.",,
FXStreet_News,NOK: Oil and conflict overshadow Norges Bank path – Commerzbank,https://www.fxstreet.com/news/nok-oil-and-conflict-overshadow-norges-bank-path-commerzbank-202603110829,"Wed, 11 Mar 2026 08:29:57 Z",Antje Praefcke at Commerzbank notes that Norwegian inflation fell in February but remains too strong for an imminent policy shift.,,
FXStreet_News,USD/CAD: Strong loonie could test 1.35 – ING,https://www.fxstreet.com/news/usd-cad-strong-loonie-could-test-135-ing-202603110815,"Wed, 11 Mar 2026 08:15:02 Z","ING’s Francesco Pesole points out the Canadian Dollar is the best-performing G10 currency since the conflict started, supported by resilient equities and Canada’s energy exporter status.",,
FXStreet_News,DXY: Real rate ceiling caps Dollar upside – DBS,https://www.fxstreet.com/news/dxy-real-rate-ceiling-caps-dollar-upside-dbs-202603110801,"Wed, 11 Mar 2026 08:01:48 Z","DBS Group Research strategist Philip Wee argues that the DXY Index’s failed breach of 99.7 signals a turning point for 2026 risk sentiment, as the fading ""energy apocalypse"" trade and G7/IEA actions reduce safe-haven demand for the Dollar.",,
FXStreet_News,EUR/USD: Pair steady as markets eye US CPI – Danske Bank,https://www.fxstreet.com/news/eur-usd-pair-steady-as-markets-eye-us-cpi-danske-bank-202603110749,"Wed, 11 Mar 2026 07:49:03 Z","Danske Research Team observes that EUR/USD is little changed below 1.1650, with 2‑year Bund and US Treasury yields slightly lower.",,
Yahoo_Finance,"Nike Leads Dow On Upgrade, Analyst Sees 30% Premium",https://www.investors.com/news/nike-stock-dow-jones-upgrade-target-hike-turnaround-efforts-nke-stock/?src=A00220&yptr=yahoo,2026-03-11T12:34:19Z,,,
Yahoo_Finance,"Stock market today: Dow, S&P 500, Nasdaq futures waver amid continued Iran fallout, with CPI on deck",https://finance.yahoo.com/news/live/stock-market-today-dow-sp-500-nasdaq-futures-waver-amid-continued-iran-fallout-with-cpi-on-deck-231325631.html,2026-03-10T23:13:25Z,,,
Yahoo_Finance,"Earnings live: Oracle stock jumps on upbeat outlook, Campbell's slides on cautious guidance",https://finance.yahoo.com/news/live/earnings-live-oracle-stock-jumps-on-upbeat-outlook-campbells-slides-on-cautious-guidance-123156046.html,2026-03-11T12:31:56Z,,,
Yahoo_Finance,"Volkswagen to cut 50,000 jobs in Germany by 2030 as profits fall",https://finance.yahoo.com/news/volkswagen-cut-50-000-jobs-123055122.html,2026-03-11T12:30:55Z,,,
Yahoo_Finance,Here’s an Analysis of the Ongoing Case of Unifirst Corp (UNF),https://finance.yahoo.com/news/analysis-ongoing-case-unifirst-corp-122858047.html,2026-03-11T12:28:58Z,,,
Yahoo_Finance,Technical Assessment: Bullish in the Intermediate-Term,https://finance.yahoo.com/research/reports/ARGUS_46390_TechnicalAnalysis_1773228097000?yptr=yahoo&ncid=yahooproperties_plusresear_nm5q6ze1cei,2026-03-11T11:21:37Z,,,
Yahoo_Finance,CPI Inflation Report Due As Oil Prices Replace Tariff Threat (Live Coverage),https://www.investors.com/news/economy/cpi-inflation-oil-prices-tariffs-federal-reserve-sp-500/?src=A00220&yptr=yahoo,2026-03-11T12:27:04Z,,,
Yahoo_Finance,Jim Cramer Highlights the Possible Struggles of Lamb Weston Holdings,https://finance.yahoo.com/news/jim-cramer-highlights-possible-struggles-120648307.html,2026-03-11T12:06:48Z,,,
Yahoo_Finance,Jim Cramer Explains Why Match Group Was Expelled from the S&P 500,https://finance.yahoo.com/news/jim-cramer-explains-why-match-120646331.html,2026-03-11T12:06:46Z,,,
Yahoo_Finance,"I’d Own VGT for the Next 30 Years, And Never Look Back",https://finance.yahoo.com/news/d-own-vgt-next-30-123006542.html,2026-03-11T12:30:06Z,,,
Yahoo_Finance,Jim Cramer Says “The Market Dramatically Underappreciated the Value of EchoStar’s Spectrum Assets”,https://finance.yahoo.com/news/jim-cramer-says-market-dramatically-120645336.html,2026-03-11T12:06:45Z,,,
Yahoo_Finance,Daily – Vickers Top Buyers & Sellers for 03/11/2026,https://finance.yahoo.com/research/reports/ARGUS_46387_TopBottomInsiderActivity_1773223751000?yptr=yahoo&ncid=yahooproperties_plusresear_nm5q6ze1cei,2026-03-11T10:09:11Z,,,
Yahoo_Finance,Jim Cramer Discusses the Massive Rally and S&P 500 Addition of Lumentum,https://finance.yahoo.com/news/jim-cramer-discusses-massive-rally-120643501.html,2026-03-11T12:06:43Z,,,
Yahoo_Finance,Jim Cramer on Coherent Corp.: “I Think This Company’s Just Terrific”,https://finance.yahoo.com/news/jim-cramer-coherent-corp-think-120642517.html,2026-03-11T12:06:42Z,,,
Yahoo_Finance,"Jim Cramer on Vertiv Holdings: “What a Stock, What a Company”",https://finance.yahoo.com/news/jim-cramer-vertiv-holdings-stock-120640667.html,2026-03-11T12:06:40Z,,,
Yahoo_Finance,"Stellantis, Oshkosh, and Mastercraft: 3 Vehicle Manufacturers Worth Watching",https://finance.yahoo.com/news/stellantis-oshkosh-mastercraft-3-vehicle-122653379.html,2026-03-11T12:26:53Z,,,
Yahoo_Finance,"Jim Cramer on Molina Healthcare: “Lots of Exposure to Medicare and Medicaid, the Weakest Part of a Weak Business”",https://finance.yahoo.com/news/jim-cramer-molina-healthcare-lots-120639552.html,2026-03-11T12:06:39Z,,,
Yahoo_Finance,Daily – Vickers Top Insider Picks for 03/11/2026,https://finance.yahoo.com/research/reports/ARGUS_46386_InsiderActivity_1773223751000?yptr=yahoo&ncid=yahooproperties_plusresear_nm5q6ze1cei,2026-03-11T10:09:11Z,,,
Yahoo_Finance,"Dow Jones Futures Fall, Oracle Jumps On Earnings; Oil Swings With Reserves Release Plan Due",https://www.investors.com/market-trend/stock-market-today/dow-jones-futures-oil-price-swings-ai-stocks-oracle-earnings/?src=A00220&yptr=yahoo,2026-03-11T12:05:03Z,,,
