source,title,link,published,summary,date,date_only
Yahoo_Finance,Stock Market Today: Dow Wavers Ahead Of CPI Inflation Data; AI Giant Oracle Surges On Earnings (Live Coverage),https://www.investors.com/market-trend/stock-market-today/dow-jones-sp500-nasdaq-cpi-inflation-data-oracle-orcl/?src=A00220&yptr=yahoo,2026-03-11T12:03:39Z,,,
Yahoo_Finance,"Oil Prices Rise, S&P 500 Futures Fall As Reserve Plans Offset Mine Fears",https://www.investors.com/news/oil-prices-sp-500-crude-reserve-release-strait-hormuz-mines/?src=A00220&yptr=yahoo,2026-03-11T12:02:41Z,,,
Yahoo_Finance,Oracle Saves The “Magnificent Seven”,https://finance.yahoo.com/news/oracle-saves-magnificent-seven-122621005.html,2026-03-11T12:26:21Z,,,
Yahoo_Finance,"Dow Jones Defense Giant Boeing, AT&T In Or Near Buy Zones Amid Market Volatility",https://www.investors.com/stock-lists/stocks-near-a-buy-zone/dow-jones-boeing-stock-ba/?src=A00220&yptr=yahoo,2026-03-11T12:01:54Z,,,
Yahoo_Finance,Crocs Stock: How To Find & Own America's Greatest Opportunities,https://www.investors.com/how-to-invest/crocs-stock-crox-americas-greatest-opportunities/?src=A00220&yptr=yahoo,2026-03-11T12:01:52Z,,,
Yahoo_Finance,IPO Leader Set To Launch Breakout As Top Funds Jump In. Impact Of Iran War Raises Questions.,https://www.investors.com/research/breakout-stocks-technical-analysis/karman-stock-targets-breakout-best-mutual-funds-bet-big/?src=A00220&yptr=yahoo,2026-03-11T12:01:51Z,,,
Yahoo_Finance,How Stocks Tend to Behave After Large Weekly Oil Gains,https://finance.yahoo.com/news/stocks-tend-behave-large-weekly-120004758.html,2026-03-11T12:00:04Z,,,
Yahoo_Finance,T-Mobile’s Customer Machine vs. Vodafone’s Restructuring Gamble vs. SK Telecom’s Surprise Rally: One Clear Winner Emerges,https://finance.yahoo.com/news/t-mobile-customer-machine-vs-122503339.html,2026-03-11T12:25:03Z,,,
Yahoo_Finance,I pay my ex’s mortgage to protect my kids. Will lenders count that against me?,https://finance.yahoo.com/news/pay-ex-mortgage-protect-kids-113000542.html,2026-03-11T11:30:00Z,,,
Yahoo_Finance,Mexico truck production plunges nearly 50% in February,https://finance.yahoo.com/news/mexico-truck-production-plunges-nearly-113000620.html,2026-03-11T11:30:00Z,,,
Yahoo_Finance,Jim Cramer on AppLovin: “Too Much Risk There”,https://finance.yahoo.com/news/jim-cramer-applovin-too-much-112804330.html,2026-03-11T11:28:04Z,,,
Yahoo_Finance,Jim Cramer on Arm Holdings: “I Think There’s Just a Lot of Good Stuff Happening”,https://finance.yahoo.com/news/jim-cramer-arm-holdings-think-112802060.html,2026-03-11T11:28:02Z,,,
Yahoo_Finance,Have $500? 2 Absurdly Cheap Stocks Long-Term Investors Should Buy Right Now.,https://finance.yahoo.com/news/500-2-absurdly-cheap-stocks-122500527.html,2026-03-11T12:25:00Z,,,
Yahoo_Finance,Jim Cramer on Agilent Technologies: “I Don’t Think You Need It”,https://finance.yahoo.com/news/jim-cramer-agilent-technologies-don-112801605.html,2026-03-11T11:28:01Z,,,
Yahoo_Finance,"Jim Cramer on Hamilton Lane Incorporated: “No, Because the Company Is Way Too Levered to Private Credit”",https://finance.yahoo.com/news/jim-cramer-hamilton-lane-incorporated-112757396.html,2026-03-11T11:27:57Z,,,
Yahoo_Finance,Jim Cramer on nVent Electric: “It’s Like a Mini Vertiv”,https://finance.yahoo.com/news/jim-cramer-nvent-electric-mini-112759110.html,2026-03-11T11:27:59Z,,,
Yahoo_Finance,Jim Cramer Notes “It’s Been a Good Year for Realty Income”,https://finance.yahoo.com/news/jim-cramer-notes-good-realty-112756672.html,2026-03-11T11:27:56Z,,,
Yahoo_Finance,Clarivate: The Data Intelligence Company Flying Under the Radar,https://finance.yahoo.com/news/clarivate-data-intelligence-company-flying-122418344.html,2026-03-11T12:24:18Z,,,
Yahoo_Finance,"Jim Cramer on Coinbase Global: “What I Would Suggest You Do Is Just Buy Bitcoin, It’s Cleaner”",https://finance.yahoo.com/news/jim-cramer-coinbase-global-suggest-112754762.html,2026-03-11T11:27:54Z,,,
Yahoo_Finance,Jim Cramer on Capital One: “I Think It’s Just a Solid Buy”,https://finance.yahoo.com/news/jim-cramer-capital-one-think-112753789.html,2026-03-11T11:27:53Z,,,
Yahoo_Finance,"Jim Cramer on Robinhood Ventures Fund I: “Clearly, People Aren’t That Enthused About These Venture Capital-Backed Startups”",https://finance.yahoo.com/news/jim-cramer-robinhood-ventures-fund-112751944.html,2026-03-11T11:27:51Z,,,
Yahoo_Finance,Jim Cramer on Costco: “I Think It Can Head to New Highs”,https://finance.yahoo.com/news/jim-cramer-costco-think-head-112749505.html,2026-03-11T11:27:49Z,,,
Yahoo_Finance,"IAG, easyJet and Ryanair; which European airlines are investors selling as Iran burns?",https://finance.yahoo.com/news/iag-easyjet-ryanair-european-airlines-115200396.html,2026-03-11T12:23:00Z,,,
Yahoo_Finance,"Jim Cramer on Bunge Global: “I Don’t Want You to Buy More, I Want You to Hold on to It”",https://finance.yahoo.com/news/jim-cramer-bunge-global-don-112748331.html,2026-03-11T11:27:48Z,,,
Yahoo_Finance,"Jim Cramer Says “e.l.f. Beauty Is Erratic Right Now, But I Have Faith That It Can Go higher”",https://finance.yahoo.com/news/jim-cramer-says-e-l-112746941.html,2026-03-11T11:27:46Z,,,
Yahoo_Finance,"Jim Cramer Says “Oracle Has Made Itself the King of the Data Center, It’s the Fastest-Growing In the Space”",https://finance.yahoo.com/news/jim-cramer-says-oracle-made-112744447.html,2026-03-11T11:27:44Z,,,
Google_News_Forex,EUR/USD Analysis: The euro attempts to recover amid persistent tensions - FOREX.com,https://news.google.com/rss/articles/CBMitwFBVV95cUxQTmJncFNvcUlfNV9qdDgtc3VnQ1g2WWRlRTVseS15Y3FJR1ZHYk5kREl5UjJhQlpDMzRfMThXT1lsTW1saDRuUnctZDZ3NDRCTFI0TUd0VThqamlOMDFnRHZqal8yNllDeFJia2JROWo1ZEtLWHVia2F0d1RtWjR2dTVzSnBHMm1tUG4tanl6ZzBWdnRTWkVZMXJGQm50OU54MkJuT3JJcDRKR25LWkhzLVVkVnVydDDSAcMBQVVfeXFMUEJ0Sjd0X2hLSjdrLUtCbWlpSEg3VnNmbWo2NUVqWnpNTFVGU3didm5DcVc3YWladF8yUXY5QzhCQnVlb0Jkbks4ekdLMHRVTVZ0ZlBMMmVIdENobW03cGZ6MFhPS3RCWnZtN1IzRVBtaHB4ekgtR0RSNDl3TEIzRUQtZkwxTHFpbl9GemZSREhsbThNWkg5Wm5sV1JyaHN6NmpGd3BjREI2dFZEZVVqMl9BdTFtZjI4cTFnbFc1Q2d6LW13?oc=5,"Mon, 09 Mar 2026 18:28:59 GMT",EUR/USD Analysis: The euro attempts to recover amid persistent tensionsFOREX.com,2026-03-09 18:28:59+00:00,2026-03-09
Google_News_Forex,EUR/USD outlook: Crude oil remains the key driving force for now - FOREX.com,https://news.google.com/rss/articles/CBMirwFBVV95cUxQMVVLaFZjTnlaSXljNEF0Y3l2R3FlM2RuLW9SanVuY3E1TzBtekUxeWtwUkk3YVlzVUFGSW1mNXBZSnZNQ1dhVDFZaWhkcEZMaTdxRmxaVlljY05TaHMtWGh3bkplSE5HVWw1MjVQbU1uWHFzQlcyS2FVZEdMakxack9vYkpZNWV5Znd1ZldxMng5NTZCMEh5cWo0Ul9XUHhlN2UzbEdNRDhiaEYtTGVJ0gG7AUFVX3lxTE5ocHVsbTNJdXk5VHpOZjNCRGdudjZWRGphRnJzaFJRcEgtSTZoM3Q4UGJuUEtZbUQtQTVEZFlWdmowU19BTzI4QWZ4YTBON3N2SzVQMy1xUHUybTFTazdwSEltTjFmLVNDOGI0T3A5TDJCalNQWkZDX09nazJ5X1o1TzdkTE4zS0JuY2l5SHNuWkl3UDVORWlGSktITzllS09jTlBQZEU4RFNRcDRtdkxLVkdMNDNCQjk3dUU?oc=5,"Tue, 10 Mar 2026 13:47:00 GMT",EUR/USD outlook: Crude oil remains the key driving force for nowFOREX.com,2026-03-10 13:47:00+00:00,2026-03-10
Google_News_Forex,Euro Outlook: EUR/USD squeeze risk grows on TACO trade - FOREX.com,https://news.google.com/rss/articles/CBMiogFBVV95cUxPVmttSU0ycEFwUDlnbjlOLTFWOHVlOEZBcldsdzRHLXpJWGdXWDNzdkFtT1pfOHZGNVV3WXVmLWpkVzFNaEM4TllweVBtT3lyVUpsVlpFRXJyeEJNSktOWVRLUWJmVDEyanR0T0o5NzRkU0RBRHJmOTZDSXhhUHMxelN2bEtsZFNKU1c3RkRnYVZYVk5FNEIzakMxQnZlem91cEHSAa4BQVVfeXFMUEUtNGE5UzNlN19pY191R3ZDV21hLXdUVHdBanZLZTktTkV1ZzJOZFVyRUR2X3VlU2lEenMtbnY0UExfTERvRUdPMlJQOWZ4eFZhazUtYUtDM3VvRXdxNDdVaXFNb3VNNThmd25zSjgwcnZHSnd4ZGlXbEQ5dUp2RjZRMTJpWl9wZXkySEpHZ3Uxd3pYTDBQZXpXMl9OdEZjODF2MGFXWWpiajBUaDV3?oc=5,"Mon, 09 Mar 2026 22:15:27 GMT",Euro Outlook: EUR/USD squeeze risk grows on TACO tradeFOREX.com,2026-03-09 22:15:27+00:00,2026-03-09
Google_News_Forex,Euro FX EUR/USD Futures Overview - CME Group,https://news.google.com/rss/articles/CBMiYkFVX3lxTE1Ia3l5aDN1d2dNSk53N05JM3lJcGVUYlEzMGIzSXBNaEFDSm9VUlh5dXcwWnpQdy1EbmZOVnBvZnBIdlRkRHNwR1RQRlJiSjBWQjUtZi1Ka1NHZmplb0tkQmdR?oc=5,"Fri, 06 Mar 2026 08:00:00 GMT",Euro FX EUR/USD Futures OverviewCME Group,2026-03-06 08:00:00+00:00,2026-03-06
Google_News_Forex,EUR/USD and crude oil forecast: Will NFP matter? | Forex Friday - FOREX.com,https://news.google.com/rss/articles/CBMiqgFBVV95cUxPam96VlhLUVlnNTdOUXNWYU85NjMwdHZYMnJGQTlMc2UxaGFtTU4xdXE1LUpwaldLWlZyZzAyZktNUUVQaU1BbWs0Q3pLMHowcnRKcjdLXy1OY1ZodU1RLWx2TG1WUnBIcndpNjJ4RkJvTG1ieXFTTFgweUM4MVRrLWlBTzM2eTNGT21XdzNvT2o3eFRJTXhyRTczM1FGRFk0elR4SUNkT05QUdIBtgFBVV95cUxOVDMtSDdqWEhuTEdBQUxFRFk1V2I0OGpGZVhFMjlEWlU5dExhOHpwb1JQcHZ1Z0hXYld2NWhjekxQOXNodGt6NkxTckFNSl91ejhqRUtIMVNVWG03WEo4Snpsa1h1NjNZc3ZpeDFvcTEzOEtVZFVVTm1pOHFuU3l5ak1YdWJFOUJ2YkFvNk10bEdzUWFtdS00d0puQk1ZREczMmdPenJOOU11dVRvTFFKaHBXUXhEQQ?oc=5,"Fri, 06 Mar 2026 12:59:29 GMT",EUR/USD and crude oil forecast: Will NFP matter? | Forex FridayFOREX.com,2026-03-06 12:59:29+00:00,2026-03-06
Google_News_Forex,EUR/USD Daily Outlook - Action Forex,https://news.google.com/rss/articles/CBMimwFBVV95cUxOQUNNVjl2NGFTSms4M0hLc0t1R3g0b0RlcnhRQzdWUVFValFWdzN3WnZhVTVEbmZoTmpsQjFIMEpBNVVNZmdZOGZ0X3lKd0JETVZzdE10Y1I4U2JDQ0dMZGxfMFB3NE9SWlBTdVVJLWc0SVZ3ZEZMNFlzaDNfNWNkYmc2Z2JPc3R1Z3lYb1kyd2R3S0htZ0xoWGk1bw?oc=5,"Wed, 11 Mar 2026 06:23:52 GMT",EUR/USD Daily OutlookAction Forex,2026-03-11 06:23:52+00:00,2026-03-11
Google_News_Forex,EUR/USD Reclaims Ground While USD/JPY Momentum Fades - Action Forex,https://news.google.com/rss/articles/CBMivAFBVV95cUxPb1VjbnhoSDFxSXItZXJxLWhjbXRQQXBSS3d0ZWIxX014V3NERjhSb0tTYjFyXzJhc2tVaUp0cjZmOVVPZTFIbTJaUE93ZTdueXJXRXBuSFZsTmZKQkxYd2VpX3l0OTlfeFpVRWVsVS1ocWowam9INXhMLUtxUlB1TjZIUkZ6djQyYnJES0FHOEVaOHY4cmJTNnRzRG1CS0gwLVhTNGEwazAyOTRuYTM0dlNSUVNSWUItMVN3SA?oc=5,"Wed, 11 Mar 2026 11:05:16 GMT",EUR/USD Reclaims Ground While USD/JPY Momentum FadesAction Forex,2026-03-11 11:05:16+00:00,2026-03-11
Google_News_Forex,EUR/USD: Bearish Below $1.1600 - Forex Factory,https://news.google.com/rss/articles/CBMid0FVX3lxTE81QmZVRnRfSktZejVBZWNaVS1ubmozUlU2NzBUR3RVeXZZSEV1cE52TGZjMktxRENnWDU0eUQ4Z0pGY2YwOUtuNmpVeEVyWHQ4dkw2UWgzY2IzTVZRTGRza2tPSUdIVnhkdUZZMVFEakl5TUpVSmE4?oc=5,"Wed, 11 Mar 2026 09:23:00 GMT",EUR/USD: Bearish Below $1.1600Forex Factory,2026-03-11 09:23:00+00:00,2026-03-11
Google_News_Forex,"EUR/USD Bullish Reversal, Watch The 1.1673 Upside Trigger Level As U.S. CPI Looms - Seeking Alpha",https://news.google.com/rss/articles/CBMisgFBVV95cUxPVlU3clVuR24xazNEZ01pY3l0S1psbEJ1OWRub0o0WlJ2NGdhSWlMdF9idmRCWmlHMjNfTkdNU09vS21nLWJuOS1GWk80V1pvT3EzUEV0Ujk1U3piU19pdGdJb2p0VzN0TUFZTE8yWEJLUVliUFZybVQ5cl9ZcHJXS3JTX3Vhc3Rlc2stTGxFZ0JlQTBIUnNKdUMxaGJMMFNDLXlCamcwQXVfQTAyN0F3ZVJn?oc=5,"Wed, 11 Mar 2026 12:30:00 GMT","EUR/USD Bullish Reversal, Watch The 1.1673 Upside Trigger Level As U.S. CPI LoomsSeeking Alpha",2026-03-11 12:30:00+00:00,2026-03-11
Google_News_Forex,EUR/USD Forex Signal 09/03: Bearish Outlook Ahead of US Infl - DailyForex,https://news.google.com/rss/articles/CBMimAFBVV95cUxPZ20zQTRSUG40bjNPd2Z1RW1ZUENBZDNYTEtHRWMwdWdRQVdsUVVNMXBkeHhWZ2NKUVRjbW9lZHlsRVhpclNDczlTWlZYTThtUHRRVGdHREdFRWNiVTNJZ0lqUEU2SF9JbjQ5RVJ3N3NsaVZuY3RKelV4Mlk3ZGdSUTBEdzB0WXRUN1RMMXQ3S3VTalpxamdYYQ?oc=5,"Mon, 09 Mar 2026 07:39:48 GMT",EUR/USD Forex Signal 09/03: Bearish Outlook Ahead of US InflDailyForex,2026-03-09 07:39:48+00:00,2026-03-09
Google_News_Forex,EUR/USD Forex Forecast 08/03: Hammer Candle Points - DailyForex,https://news.google.com/rss/articles/CBMiowFBVV95cUxPb1RwNEhpbl9JMlhwT0ZjS0NLcWk2OVhPWlpfOWhqaExZYnFrT1o3R0dmRDZWaUFIdlgxck5KQTZPRGg1aGRtQUhaSjR6QTJMREJvOFBNUzU4c1BpMUhURUtHQVVTbEs0bGJEOVhlRG4tMW1KM0xxcHM1VTg1ZzFUQzgxbF8zc3F4U1RNdFRsRHBWakh0Q3RSOEFmWklWc1JHZDVF?oc=5,"Sun, 08 Mar 2026 13:03:47 GMT",EUR/USD Forex Forecast 08/03: Hammer Candle PointsDailyForex,2026-03-08 13:03:47+00:00,2026-03-08
Google_News_Forex,Euro Technical Forecast: EUR/USD Drops to Pivotal Support – Breakdown Risk Builds - FOREX.com,https://news.google.com/rss/articles/CBMizAFBVV95cUxNSU02WEpOYWxydmFxUFZGZlhYRldoS0diWWpob2Z1dTVfMW5USDluUXRQaUE3eF8wSnVrdlgtcXhEdkVVdmVkNXBlOVpQY0doRlFmX3VCaXg3QXdiMjgxTTVXQnNzNElBM3ZMOU9TNnEtVFZmZl9BVUFIVElXTXQ1VjhMbjI3aDdoV3h4aGNWT1BFZ3dpenh6M1NFN0VVZFEzd05NRTJDcWc4aWVsb001ZzR0azdEY2diTnN1M3BlcnlpcExjcl9lV1lrSWk?oc=5,"Sat, 21 Feb 2026 08:00:00 GMT",Euro Technical Forecast: EUR/USD Drops to Pivotal Support – Breakdown Risk BuildsFOREX.com,2026-02-21 08:00:00+00:00,2026-02-21
Google_News_Forex,"EURUSD stabilises on more optimistic news, but downside risks remain - investingLive",https://news.google.com/rss/articles/CBMirgFBVV95cUxOU2dpSWlpUmhNUk91dE9vdEh0bS13Sm1ZTi1reHN2NmZtNklHX0dtWjlwVDRIUmY5SmVzaDAydzJ2MWpqemJrSWh1R0R0ZWtsUWpYN1N5UWxWZy1Bb2xOdFc5VXRkTnhZYldwaWc1MEZNWFUySGxyb2VfTmNzbmdFaHR4aG5HXy11U3ljT1BwV2dQNG9xMEZmQmwwMmE1WmVlSWNpdWtwRFVOS3NJNmfSAbMBQVVfeXFMUGFYS0h5YkwtVGk0MGtZQ1B2UUs3M281SGEyUXVfcmlhOUZOVXI3TlJTU0NuNWliZ0JydjVNNUxjZXpuajJLN3MtTjNmZEtXOEFtUDh2aXNBeVk0ZklvRW9LTXZxZ0wtS3NuNm52RFUwTHpfR3ZiS29xSjVmcERNdmZudDFnRlFVQUdmaEU4dnFrcFYxdDlfUl85Tnhsb2dTWWc5MUUyRkdXUko1Z0tVUDRoXzQ?oc=5,"Wed, 11 Mar 2026 11:37:14 GMT","EURUSD stabilises on more optimistic news, but downside risks remaininvestingLive",2026-03-11 11:37:14+00:00,2026-03-11
Google_News_Forex,"EUR/USD Forecast: Euro fails to benefit from mixed ECB commentary, eyes on US CPI - FXStreet",https://news.google.com/rss/articles/CBMixAFBVV95cUxPakktekttWHJ1enptckctSTlSdjVKbVRXUFlnRHMwTWtNNFZKY29GYV9hNzB4U2diOU83TG83ZzNzb0EtQm5sbnN5Tno2aGZoOXVHb2NpZHFBM0NBczUwOC1faUJ2TVhLODQ2cnRsSmt0b0NoWlJfRE02bzdJeUlLbXlrSzZpbWtkdElVT0JkZ2RUS0M4RUcwbk5SM21WeDgtdFhvZW1QM3cyVmhURE16UjR2ZC0zdDNkSkpvaEVCbW9DVjlh0gHKAUFVX3lxTE5SRko4b1lzeUE2QUZxNl9QSVNVU0MwU1UyZjlTcFhkYXFkTEFzYTBWSm90LWZLWlRVN1JyY2VGVF9pblBjdXo4RkxSTXk4MFhWcmwtSENYQTRRSGIxSTFycmJUU0tLMXBvODdrOHNLT1l5YzJPOGRJT0E0NUNRU3Q2a0dORFZHcFBUa3dSWld0TF9WcFh3STMzUXl0NGM0RVBVRlFSaTI1UGdYRFpuSVlPbGl4TXVGbHF4MmtwcjItV3hobnFpNkFiUEE?oc=5,"Wed, 11 Mar 2026 08:49:51 GMT","EUR/USD Forecast: Euro fails to benefit from mixed ECB commentary, eyes on US CPIFXStreet",2026-03-11 08:49:51+00:00,2026-03-11
Google_News_Forex,EUR/USD Outlook: The dollar regains strength amid escalating geopolitical tensions - FOREX.com,https://news.google.com/rss/articles/CBMixgFBVV95cUxOTC1ScDV4MHZyX3p6QmVJNzRJWDVHdm5GTG9ITW12dm0wOVBMMW9ub1lEamNMdUpFX1o5LXFDcVZkYWM3MGJEWUNtM25pdHQ5R2tROEstd3VPSVQtSXlSLWpyZC00M3Z1TC1JQ0c2WlJpbmRnZi1aQ01RaXRIekhOLURNcERtM29nb1VKMGdGS09GNEVOY0VSdjZRMFBHSXJvd2VXRjEyWC1KbDF2UDlWRUNlUzBUZVhoNk9GaVpQcTZ3ZHA3NVHSAdIBQVVfeXFMTlZMSzkybHJvVl9BV2sxQVJlMG9mZHhWM0dkdTk0enF4ZHZhd28zVGN0cGpueUVURFNYTmppU2p5eWZNYndCV2otaEIyNXk5VmdyRG15bmVueWNoZktFLThQampMdl9lMFk5ZGFZejA2R1ZZU3FxRlpoeE1nenZaMXc0UnBEaVZ6NHc1d09jSDBiLTNjaDBlWWl5cGtQTm5kZ1JVam1VWlJSckpPSThnQWE1ZU1QNnhiSEw4MzdhM0dBX1lBRWwxS0ZzTUwyeFZBVUpn?oc=5,"Mon, 02 Mar 2026 17:04:09 GMT",EUR/USD Outlook: The dollar regains strength amid escalating geopolitical tensionsFOREX.com,2026-03-02 17:04:09+00:00,2026-03-02
Google_News_Forex,"EUR/USD forecast: Energy shock, Fed pricing and key data in focus - FOREX.com",https://news.google.com/rss/articles/CBMirwFBVV95cUxOaF9tdUY4ZDBoUUN6S3ViQS1nYnhnRDlSbC1mbEtub2VvYmUzY0RGN1BHMDhGVHlJaXNGMHdRUXJiM0MySW1qVEdkRmxiUlFlX1ZtTTZTZklGWkF4T0ViQ09iTk1abW0wX0VVcmVyckl0al9rQ09qSHJkTUpMb3NtYjBzenluV0xaeTFtNDdVd1BOOXVCTWFnaHhEYWwxSFVwLU9rbFpzcHY2V1F2Nko40gG7AUFVX3lxTE14bkhEVzVGNW1KVUZBWHRoYzVqc0hnRTlLUTUyOVhuT2ZGOEZ6am1vc0NoU3c1ODlnM2NIMjY0QVM0U0o5TS1IM2ZVU0ZYUVN5bDBMT3A2SURhY0tieW0zenhzSkRJZENEZWtRNi1tb0NoRTdjTV80TE9fUWdGWmpOdWFoRVEyQXlBNUNOS2Z0Q0dLQVg2bnZ6M1R3cXFIY1pmY2FVeTg4dVRwd0dxZ05uZ3EyWTdQWVloLXc?oc=5,"Wed, 04 Mar 2026 12:03:16 GMT","EUR/USD forecast: Energy shock, Fed pricing and key data in focusFOREX.com",2026-03-04 12:03:16+00:00,2026-03-04
Google_News_Forex,EUR/USD Price Forecast: Eyes 1.1650 barrier near nine-day EMA - FXStreet,https://news.google.com/rss/articles/CBMipAFBVV95cUxNZDNCY1F4Um9CYmF0WGlXWDRhN2c2LWZTM1psZmhYRG9yQnhvTXN2VkItdWZ2MURsQ0lMOElOT2NrMEZhcGhyZW1yb2hyOHBPem5ZZDNPZnl0QkhLV3BZUHZGNGdXR3hGQXJTQW9DQTB2X3dQell1aVJBRkc0NkpOR2lsVk9VQlR0RWlwVW1lQ09qYURxVnhfZU1ZaTQzVUpuWkJsRdIBqgFBVV95cUxNcmwzdDJYNGxyVXU1RURBS0lQR0VNWnRGOWw4N0RSSjU3Q3RkcHZrNHVKLTRwS1hXTy1jNzRSbU0wZmdpSTdwSF8tX2k5aUZzZnYzVFN1UDNFWkE0dGpjQU9sNFZVZmZxaUdLMFRYYVRxZHg0WjA4ZUdzMDZpU2tqNDF3MjJtUXc5MjhtLWlaNnBaektuVUlnanM2Z1d2aE1LT3hiWGFXWDc1QQ?oc=5,"Wed, 11 Mar 2026 04:50:15 GMT",EUR/USD Price Forecast: Eyes 1.1650 barrier near nine-day EMAFXStreet,2026-03-11 04:50:15+00:00,2026-03-11
Google_News_Forex,EUR/USD: Hawkish ECB talk meets Oil risk – ING - FXStreet,https://news.google.com/rss/articles/CBMijwFBVV95cUxOT2NwN3lTa0hQZVkxNm4wV2dhaFBoc1IwdU5JQUY0b2xsTi1VYWhrQ3ZTbnkwNU9hNTJBWEViblktWTlnWF9TdG96TlREa3B5UV9IaW9HbW9nZENicTZ3Zm1tZGlVWTA5Y3JBVF9qUjBQTmNuX1VjcWtoTGIzVVI3YkZZZ3RwRXFiSkRNRTU3MA?oc=5,"Wed, 11 Mar 2026 09:06:38 GMT",EUR/USD: Hawkish ECB talk meets Oil risk – INGFXStreet,2026-03-11 09:06:38+00:00,2026-03-11
Google_News_Forex,EUR/USD forecast: Will US dollar resume lower? - FOREX.com,https://news.google.com/rss/articles/CBMilgFBVV95cUxQc2JEaG1LSGhNMWxvVFloZXlKTkFjaW5kZUs2Q3lmWW1XU05JYXdvVVN5aXZPVVBfNFlSQUVmTS1TWlg3SVBVODZWOUxTemtrcS1NRzZLRzhETy1RNjVQR3AwNHhVdGVJVUFEZ0JxMi1TbUpvZVlVaDFxNDQwM0NGaENpd25NRUFvNWNBS2VTZzBRdWhDQ3fSAaIBQVVfeXFMTkgwTEdDUDl6YzFuT0R6WWRCWGNOTG5pRnRaUG14WVFXVmdQSlVGQXByakUtdFlmdFJwV2VuVkNRVGJ1SkNvVVlvdU44ZmlXZXRXcVh2U21CQ3hLMVl1cUFLcnp2bWtQUkVCZDU1QVJTRTQ2TWpsb3l3T3JMUmwzY0lJS1A3ZWtxTE5wLWVVcXFobkNHNXBFT2RPXy1oa0VPZVl3?oc=5,"Wed, 18 Feb 2026 08:00:00 GMT",EUR/USD forecast: Will US dollar resume lower?FOREX.com,2026-02-18 08:00:00+00:00,2026-02-18
Google_News_Forex,EUR/USD forecast: Oil shock deepens economic concerns – Currency Pair of the Week - FOREX.com,https://news.google.com/rss/articles/CBMiwwFBVV95cUxOOHRkdFk1U0QtelpaZjZYNTVudjhNdlJPSVN1QVpSNUdOUXJCOHdwcmNKQmc3YWliZ08ydUkzOFIzTVc4cTJlYlFhVVhnUWo0MEdid3E5b2c4QXpKUnRyN3ZRWkl2RjBmM1R4WEdWaXZ0eUUwWWtMcjJqY2VnYUFiVGNGUk9KV1RNUHcwV1ZNSDNLdkFxQVlvUjFHYlpCYl95U1RHUVVuQURlb0l3a2NvOXlkYjAwajRxOXlzNlNMdzZ6SjjSAc8BQVVfeXFMTlQyb3lRT1Z1RFdyMExJNFVHb1pOYW9LcnVnTFd5c0JzNHM0Rk5sZlFoU0xIM3NZcDBVc1VmZmJpNldKdnF6WW8ycE5oNnV0ZUdLdXJMVDRvU0lvT0E5eE00aWRwMWduSkV4N1NSb0lmQk9RSC1reVRqcjZQN1BHMWlGT3pBTENFNlpDU0tnTGxTYWFCVmI2QnNyeDNZWE1QeDJWMEJjWVRNZjhYMTdBaUlYV2NNejdqY1Q4LVRDN3YyN1g1LVV4MDB0clpJWHFn?oc=5,"Mon, 09 Mar 2026 15:13:19 GMT",EUR/USD forecast: Oil shock deepens economic concerns – Currency Pair of the WeekFOREX.com,2026-03-09 15:13:19+00:00,2026-03-09
Google_News_Forex,EUR/USD Analysis: The euro approaches the end of the week with a consistent neutral bias - FOREX.com,https://news.google.com/rss/articles/CBMizgFBVV95cUxOX25NVDZiRE5MUjFtRlBfQU00ekpENW95TmV5TmdRd216dXRmYkhsWER5ZE9WYU9BS3RheVl5Yk5OWjNrR21oUl9ROXRIbjRKWXNYeUxNby1SOHduc1dLS3paV1llUXNtMTdXancwRHpIZ3ZxRlBxamJGY2FuQ2YtOWxRV2hrUF9DNFBiV04wNzFyYXc1R2l5ckZEamEza1hReXZNQ0k5cEVmY1kzcU1xYk1mbUhiX2xWTEVEbHFhRkQzSWhhWkxjYjdRNDZhd9IB2gFBVV95cUxOd2VwT19VRlI3S3hHSTRqdkFpaVc3OGFYdlFmWUo0VTdnRUt2OVBfOGc3cFBkcVJQclN3MDhaYVJWYjEwTlNONFNZcWdyNGJIZ0lmYlY1NUdoVnZoRDlWdk9DTUtQZENiR3hwdjczY083OTQ2T3BYb0tLR1BrdlplNHJuc2tiTVRkV1hicTdPckcwZU9iTmU4WVpwUHlqcE9xR3hjczZza3I3MTNjN2ZFYVF6Q3JhanpUem11WDhZbGpIalVHVEUzX2Jhb3c3aHBZWEJ4TVBKMWhzZw?oc=5,"Thu, 26 Feb 2026 16:31:21 GMT",EUR/USD Analysis: The euro approaches the end of the week with a consistent neutral biasFOREX.com,2026-02-26 16:31:21+00:00,2026-02-26
Google_News_Forex,"EUR/USD forecast: Forex Friday | January 16, 2026 - FOREX.com",https://news.google.com/rss/articles/CBMilwFBVV95cUxQZEY0SHY4eW8ybGk2bnpxdW5ETUc2WWNDU0JuQ0prVUZJbXJqT3FxMTMwN2RNRHBkcFNDWEZrMlNocFZfUU8wR3NwdENWYXN1UlZ0dGlQSHF3T1lzSlRiOWpzeElka3RWT2ZCaUR4WENsZ2M4ay1UUkUtY0FTT2NDZ04yN1ZBc0dKbmtpMi1vYzBfR0w3dmxN0gGjAUFVX3lxTFB0RjRLX290Nk9aRE9taHdrMzR1NUhpbDI4Zk5qaEZZV2xWZ2p5SWM2QWplb09pa0YtaDY3RlQ1eEZreUFac0VBLXZGS1p2MVpVTXZrbG9udXR4OFBTcTZiY2VNWU9wdHhseGtjaGg1cnhMM0FLOWZzZENUS0c5LXJQTnVxN1FwUUQ0TW9PTEZxTWpwZUZyV0NFM0lTdmFmS0IyR1E?oc=5,"Fri, 16 Jan 2026 08:00:00 GMT","EUR/USD forecast: Forex Friday | January 16, 2026FOREX.com",2026-01-16 08:00:00+00:00,2026-01-16
Google_News_Forex,EUR/USD update – Euros look under pressure - FXStreet,https://news.google.com/rss/articles/CBMikAFBVV95cUxQenpkN21NOGE3UTc2M1VtQkowU3Nxc05Xbm5xQ0gxWkJrOS1kNzAwWV9QdlB2SFZNbWpTLWx4YUgxd1h3TW5pSVpwM0FMandoU3pDRXpMQlBHaW8zOHNrY3E3SUZrWUJtSGpad2o2NzVqUHU3NGFEUXNwb2d1MERqdF83UENueTk5bF9lSURMVzg?oc=5,"Wed, 11 Mar 2026 05:35:18 GMT",EUR/USD update – Euros look under pressureFXStreet,2026-03-11 05:35:18+00:00,2026-03-11
Google_News_Forex,Euro Analysis 11/03: Price – The Euro is Trying to Turn Thin - DailyForex,https://news.google.com/rss/articles/CBMinAFBVV95cUxOcEJmVmRIdjNVR2s2NExjMk9fc3hEN094aDktN0xMY0pNdGNxOHF0aEJCdkF2N285cEpaNG1KZ3hCc1VzZVFJZVVrVF84WXQ5VV82enFnbkF0bm5UbzlvYkQ3aVlGeXU5MmlyVjgwb3hoTEdJQ2o5amNUZUVFelc3T3VvN2pKQjZNRHY1RjYxaWNNZHpSbmVJQjFwcTM?oc=5,"Wed, 11 Mar 2026 07:50:08 GMT",Euro Analysis 11/03: Price – The Euro is Trying to Turn ThinDailyForex,2026-03-11 07:50:08+00:00,2026-03-11
Google_News_Forex,"Gold, USD Price Action Setups: USD/JPY, EUR/USD, GBP/USD - FOREX.com",https://news.google.com/rss/articles/CBMioAFBVV95cUxNTnc0Z1RxenJPcFJDb21QN0wtZVFwS25HTG9yanhib0Mzb0Z6akNoQVkxemdkdkNGTkJXa3ZZUmJiM3I5MnprMVhIci1XTzgwUWd0c1doZGhXeXVyZGVNRE10V1pMcTNZVkZuZENtZm9aUFlqZkRoMzVMcGduR2lzRndFSy1VWUxZajhWOXVrV3BicFd3R2RKZFlCd0o2bzhT0gGsAUFVX3lxTE4xN2NLY0Z4bGw1UWk0cFBxeTFUNm1lSWt1QVF5S0FYek80cndKcG5PY3JtR1BXaGRYa1NWdkUxVFhOUl9sWW13SlFia2FZV3c2blZEdG5WejctTFpJZ3k4U2xpa0I3aDVJdlhjRjI1OGFaczU4dHhkTEwtRzM4ZldsYzcwVUJVR0Fza0ZLd1F0WFNYM05fakw3b1pVbkIyRWVkT0otcTk2akJhTk8?oc=5,"Tue, 24 Feb 2026 19:19:49 GMT","Gold, USD Price Action Setups: USD/JPY, EUR/USD, GBP/USDFOREX.com",2026-02-24 19:19:49+00:00,2026-02-24
Google_News_Forex,"Euro Bounce after EUR/USD Fibonacci Support Test, Falling Wedge Build - FOREX.com",https://news.google.com/rss/articles/CBMitgFBVV95cUxOek9WemZDLWZlektseUZDTmdGVlctSmlKbGZwZlUxQjJRN2RjdVZiWHpWaG1xVDNaZjNpUGN1ZlFHY0JIUXQxTERXbldaeWVtX1Z2MzdfNmFrUnE2UnJ1VWF4Y2o5WG9pdkd4S1Bqc2RLZ3ZYQVVyRWFZZUNfSGVjdFpJb0M2SGlkby1RZFFKbGNxREgzQ0k3djZ5SHhITHRBN3VmakRtS29ub3VJZS1oWUlvaUJDd9IBwgFBVV95cUxOQVRhR3NkVTlsYU1DQ2VQUEx4YnBhNXRMQTRDb2Z5WEZkbVkwV2RzbExoZzh2THBibUZTV202bnUwQVJ0VjFkWHNyUVVwbmZGLUh5cmZaQWZhbGZ4dDdxWU1NaDlUZGhpZEZmUFBnTzRrTTF3OXNsMHRrN2RsNWZxZFpNaGk2ZDc4el9LdnNla1pxa2w3VVltcFEydW00X1I2MXluVjRFQlMxemtEQkxZZmQ4dlVHTm04SmpHRDN4S0xmdw?oc=5,"Mon, 23 Feb 2026 16:54:10 GMT","Euro Bounce after EUR/USD Fibonacci Support Test, Falling Wedge BuildFOREX.com",2026-02-23 16:54:10+00:00,2026-02-23
Google_News_Forex,EUR/USD Forex Signal 10/03: Bearish Outlook After Losing Key - DailyForex,https://news.google.com/rss/articles/CBMimgFBVV95cUxNSldXZW1mRkItNlgtVUphZVZ5VlFTVmMtOTZiYkdTbXZiWko3S0tSWWdPeHZmV0FvUFpMNkFtcVpONm5tald2dVY5Vm02VTgtLS1NdWM1M1hCSTVwNWl5UTNNNlVtOGNKTkJkaE11YXpBQ3owZ0pZVm5PdzJYTndfakFJam9pUFQ2SDBWSWVLUnBCSTR6d0txRm13?oc=5,"Tue, 10 Mar 2026 07:47:38 GMT",EUR/USD Forex Signal 10/03: Bearish Outlook After Losing KeyDailyForex,2026-03-10 07:47:38+00:00,2026-03-10
Google_News_Forex,"USD/JPY, EUR/USD Forecast: Dollar finds a floor as policy pushback emerges - FOREX.com",https://news.google.com/rss/articles/CBMiuwFBVV95cUxObTJrQTVORFEtaHNMQmc0Mk00QXBkbmNsNUVGYVBZcUtYbHFYdkdtYXhrVHcxd0hxVUZ0bmRsWG5SbkxWNDRTRWNLX2tFVmVaeS14Q2lndncwZmhxLTItcGRld0dkaEVSazJJYWRxZ0N6UVgtc0ZBZkpGeVVVZVlfNVlkb3FwUXhjZEhDcW1uWmI2c3dpVjd0SWZpVmxEY1FNWHN0ZkgwT0VWNlVWTURHTjVxQmozbHdNQ21J0gHHAUFVX3lxTE1tVHJaYmZlUC1sSWdjV0VUUG12UWljNlN3NE4xeUxudzZxQjJYdS1vYjdCWlF0Yk8yZm44b1FfNWd0N3lpSHcyYmVjRVVZbHo2NEtHYVhFZUxDdm1JZnJCQ2FhMHdVUTNoWWxBVUtzNHdlVFRHekNjbFVWa0xFUjdvVXV1ZC1BXzVzT0RaelFJRlNfd2k5c3pNV291N3RXTkxYeFNvWVZlcTJGZVdaMkxQQ0xrQmNya3VyNll2UkY2bF9tLXZLNTA?oc=5,"Wed, 28 Jan 2026 08:00:00 GMT","USD/JPY, EUR/USD Forecast: Dollar finds a floor as policy pushback emergesFOREX.com",2026-01-28 08:00:00+00:00,2026-01-28
Google_News_Forex,EUR/USD: Stalemate deepens as tariff noise clouds directional risks - FOREX.com,https://news.google.com/rss/articles/CBMiswFBVV95cUxPcWdlUjllY0ZCMXdxVjFfM1ZSdmJQWElBN21YbnlXU3JrQmY3WmRvSWNPSElDbDZXejlGQUpnQ21icjUyWFZmbVhiSXlkbGtRV21sUlFjQ2lJWFJ3cmZHYmxCclF3MDE3X0M5SEswNFJxV0g0UmtDeXNFSEFjYXNuaUdacU5JZm02eG5EV2JJTjQzcDYxWG5aUGlVZlV0U2dIajZnNk5qX3p5NUFfWmVRUGhqUdIBvwFBVV95cUxPVG5rWjNhay0yNk93a3JMZktBcEpmbFdfQzJfUUNTNFhRZHlYSVdYSXZ4X0lSa2htQ0k0RXBLa1Etb01NRl9NMGc3SVJTS0g1bHU2Yy02VW1rZGJSTjhhWWM3VnhXNmJRWGhWS2dzdE41MHpTQUgxb3FKbHZFLWhEeTliQnVpM2VPdWhXa2w1SXVWcjFpWnRIRUl2QzQwWmxsVDEtMV9nZnRhUkFKa1E1WERuU0VqY050RTRHdGxTUQ?oc=5,"Tue, 24 Feb 2026 08:00:00 GMT",EUR/USD: Stalemate deepens as tariff noise clouds directional risksFOREX.com,2026-02-24 08:00:00+00:00,2026-02-24
Google_News_Forex,EUR/USD Outlook: The Euro Approaches Yearly Highs Ahead of the ECB Decision - FOREX.com,https://news.google.com/rss/articles/CBMivAFBVV95cUxQTmk0M1AzZjdqclNjTUhDX3ZoNXFudklUd0FkOHJhVE8tLWhZQWo2dmVsaW0wQW5mNTNGcTN3bFF5emc3S3BoelBhUENZMFhyZEpGN3dSU185OVNQdzB5M1hjUkFuZXpkb3Z4Q3hIQWhORG5HMmtwZ01FSnNVNERYUXJQMThvLWFaTVlqMXRKeVZrLWhybnhiUXB5Ny1SYmIyOG05QkNYZS0tWnpLazQ4R3VFNnRBd24yVVV2RNIByAFBVV95cUxQN3hYM2RWMEtLVUkzY2dLSTJlSHQxaG9lM2FQR0NGNEx5Q0o0cXhoN21HaDI4Q04yZXRaLWpSckFzRW8yTHFraXJDWEtfV2RUMVI1S2g2aEEwN29kVUE0OTJjZktKWUgyenUzU2w4YXdaTjlWc0RNTXJLQnZVZkYtQ2x6azIza29RdVk1TExWYURVOEwtdkRZWjdTa0t1S3R3QlFCM19kT0FVYzBDS1N0bHVabXZjblNOSUdpSWNVaVpqMDR0RUNVeA?oc=5,"Mon, 15 Dec 2025 08:00:00 GMT",EUR/USD Outlook: The Euro Approaches Yearly Highs Ahead of the ECB DecisionFOREX.com,2025-12-15 08:00:00+00:00,2025-12-15
